1,INT POKROVSKOENIGHT,16
2,INT KITCHEN POKROVSKOE SAME TIMENIGHT,7
3,EXT YARD POKROVSKOE SAME TIMENIGHT,5
4,INT COWSHED POKROVSKOE SAME TIMENIGHT,24
5,INT DINING ROOM POKROVSKOENIGHT,12
6,INT MOSCOW DAY,5
7,INT OBLONSKYS DRESSING ROOM OBLONSKY,21
8,INT DAY NURSERY OBLONSKY HOUSE SAME,14
9,INT OBLONSKYS DRESSING ROOM SAME TIME,10
10,INT SCHOOLROOM OBLONSKY HOUSE SAME,21
11,INT ST PETERSBURGDAY,7
12,INT ANNAS BOUDOIR KARENIN HOUSE SAME,8
13,INT LINEN CLOSETDAY,5
14,INT LINEN CLOSET OBLONSKY HOUSEDAY,6
15,INT BEDROOM LEVEL OBLONSKY HOUSENIGHT,10
16,INT KARENINS STUDY KARENIN HOUSEDAY,58
17,INT OBLONSKYS DRESSING ROOM OBLONSKY,14
18,INT BEDROOM LEVEL OBLONSKY HOUSE SAME,20
19,INT OBLONSKYS OFFICE MOSCOWDAY,27
20,INT OBLONSKYS PRIVATE OFFICE SAME TIMEDAY,51
21,INT GENERAL OFFICE SAME TIMEDAY,10
22,EXT LANGLETERRE RESTAURANT MOSCOWDAY,6
23,INT LANGLETERRE RESTAURANT MOSCOW,68
24,INT ST PETERSBURGNIGHT,7
25,INT DAY NURSERY KARENIN HOUSEDAY,29
26,INT KARENIN HOUSENIGHT,6
27,INT MOVING TRAINNIGHT,38
28,EXT SHCHERBATSKY HOUSE MOSCOWNIGHT,3
29,INT ENTRANCE HALL SHCHERBATSKY HOUSE,23
30,INT RECEPTION ROOM SHCHERBATSKY HOUSE,82
31,EXT SHCHERBATSKY HOUSENIGHT,5
32,EXT KHITROVKA MOSCOWNIGHT,2
33,INT THE UNICORN KHITROVKANIGHT,18
34,INT NIKOLAIS ROOM KHITROVA SAME TIME,83
35,INT STATION MOSCOWDAY,22
36,EXT PLATFORM THE ARRIVING TRAIN SAME,3
37,EXT PLATFORM ENTRANCE GATE SAME TIMEDAY,8
38,EXT PLATFORM SAME TIMEDAY,9
39,EXT TRAIN ENGINE SAME TIME,2
40,EXT EXITENTRANCE GATE SAME TIMEDAY,3
41,EXT PRIVATE COACH SAME TIMEDAY,2
42,INT TRAIN SAME TIME DAY,10
43,INTEXT PORCHDAY,3
44,EXT PLATFORM SAME TIMEDAY,9
45,INT TRAIN SAME TIME DAY,21
46,EXT PLATFORM SAME TIMEDAY,8
47,INT TRAIN SAME TIME DAY,29
48,EXT PLATFORM SAME TIMEDAY,5
49,EXT TRACKS SAME TIME DAY,7
50,EXT PLATFORM AND EXIT GATEDAY,22
51,INT OBLONSKY COACHDAY,20
52,INT RECEPTION ROOM OBLONSKY HOUSE,59
53,INT RECEPTION ROOM OBLONSKY HOUSEDAY,69
54,INT RECEPTION ROOM OBLONSKY HOUSENIGHT,6
55,INT ENTRANCE HALL OBLONSKY HOUSE SAME,13
56,EXT NEAR POKROVSKOEDAY,8
57,INT BATHHOUSE POKROVSKOE DAY,49
58,INT THE BALL MOSCOWNIGHT,163
59,INT TRAIN SAME TIMENIGHT,6
60,EXT RUSSIANIGHT,3
61,INT THE TRAIN,11
62,EXT BOLOGOYENIGHT,27
63,EXT STATION ST PETERSBURGDAY,34
64,EXT VRONSKYS APARTMENT ST PETERSBURG,4
65,INT VRONSKYS FLAT ST PETERSBURG SAME,44
66,INT SEROZHAS BEDROOM KARENIN HOUSE,17
67,INT BEDROOM FLOOR KARENIN HOUSENIGHT,6
68,INT KARENINS DRESSING ROOM SAME TIME,4
69,INT BOUDOIR SAME TIMENIGHT,2
70,INT DRESSING ROOM SAME TIMENIGHT,6
71,INT BOUDOIR SAME TIMENIGHT,8
72,INT BEDROOM SAME TIMENIGHT,23
73,INT KITTYS ROOM SHCHERBATSKY HOUSE,9
74,INT OUTSIDE KITTYS ROOM SAME TIMEDAY,16
75,INT KITTYS ROOM SAME TIMEDAY,8
76,INT OUTSIDE KITTYS ROOM SAME TIMEDAY,25
77,INT KITTYS ROOM SAME TIMEDAY,8
78,INT ART EXHIBITION ST PETERSBURGDAY,10
79,INT PIANO RECITAL ST PETERSBURGDAY,7
80,EXT PARK ST PETERSBURGDAY,12
81,INT STAIRS AND ENTRANCE HALL KARENIN,17
82,INT FRENCH THEATRE ST PETERSBURGNIGHT,21
83,INT OPERA HOUSE ST PETERSBURGNIGHT,6
84,INT BETSYS OPERA BOXNIGHT,16
85,INT KARENIN OPERA BOX SAME TIMENIGHT,19
86,INT TVERSKOY OPERA BOX SAME TIMENIGHT,6
87,INT BETSYS RECEPTION ROOMS TVERSKOY,39
88,EXT TVERSKOY HOUSE ST PETERSBURGNIGHT,4
89,INT CAB ST PETERSBURG SAME TIMENIGHT,5
90,INT BETSYS RECEPTION ROOMS TVERSKOY,136
91,INT ENTRANCE HALL TVERSKOY HOUSENIGHT,3
92,EXT TVERSKOY HOUSE SAME TIMENIGHT,4
93,INT TVERSKOY HOUSE SAME TIMENIGHT,6
94,EXT TVERSKOY HOUSE ST PETERSBURG SAME,4
95,INT TVERSKOY HOUSE ST PETERSBURG SAME,7
96,EXT TVERSKOY HOUSE ST PETERSBURG SAME,5
97,INT KARENIN COACH SAME TIMENIGHT,2
98,INT ENTRANCE HALL KARENIN HOUSENIGHT,2
99,INT KARENINS DRESSING ROOM KARENIN,51
100,INT ANNAS BOUDOIR KARENIN HOUSE SAME,13
101,INT BEDROOM KARENINS HOUSE SAME TIMENIGHT,11
102,EXT VRONSKY APARTMENT DAY,3
103,INT VRONSKY APARTMENT SAME TIMEDAY,4
104,INT VRONSKYS APARTMENT SAME TIMEDAY,3
105,INT VRONSKYS BEDROOM SAME TIMEDAY,5
106,INT VRONSKYS BEDROOM SAME TIMEDAY,3
107,INT VRONSKYS BEDROOM SAME TIMEDAY,3
108,INT VRONSKYS BEDROOM SAME TIMEDAY,22
109,EXT SPRING MELT POKROVSKOEDAY,4
110,EXT POKROVSKOEDAY,14
111,INT DINING ROOM POKROVSKOEDAY,59
112,EXT COPSE POKROVSKOE LAST LIGHT,17
113,INT DAY NURSERY OBLONSKY HOUSEDAY,42
114,EXT IDYLLIC COUNTRYSIDEDAY,86
115,INT KARENINS STUDY KARENIN HOUSEDAY,34
116,INT DEMINS HOUSE TSARSKOENIGHT,20
117,EXT DEMINS GARDEN TSARSKOENIGHT,24
118,EXT STABLES TSARSKOENIGHT,13
119,EXT MEADOWDAY,58
120,EXT MAZE KARENINS RENTED HOUSE,30
121,EXT THE RACESDAY,17
122,EXT THE LADIES STAND THE RACES SAME TIME,21
123,EXT NEAR THE STARTING POST THE RACES SAME,29
124,EXT STARTING POST THE RACES SAME TIMEDAY,7
125,EXT LADIES STAND THE RACES SAME TIMEDAY,81
126,INT MOVING COACHDAY,71
127,EXT MAZENIGHT,21
128,INT ST PETERSBURGNIGHT,3
129,INT IMPERIAL SALON ST PETERSBURGNIGHT,25
130,INT SEROZHAS BEDROOM KARENINS HOUSE,4
131,INT BEDROOM LEVEL KARENIN HOUSE SAME,6
132,INT BEDROOM KARENIN HOUSE ST PETERSBURG,15
133,INT SITTING ROOM KARENIN HOUSE SAME TIME,6
134,EXT HAYMAKING KASHINDAY,14
135,EXT HAYMAKING KASHIN SUNDOWN,5
136,EXT HAYMAKING KASHINDUSK,53
137,EXT HAYMAKING KASHINNIGHT,4
138,EXT HAYMAKING KASHINDAWN,10
139,INT STATION ST PETERSBURGDAY,4
140,INT FRENCH THEATRE ST PETERSBURGNIGHT,39
141,INT BEDROOM VRONSKYS FLAT ST PETERSBURG,5
142,EXT KARENIN HOUSE ST PETERSBURGNIGHT,8
143,INT ENTRANCE HALL KARENIN HOUSE SAME,10
144,INT RECEPTION ROOM KARENIN HOUSE SAME,65
145,INT COMMITTEE CHAMBER ST PETERSBURGNIGHT,12
146,INT ENTRANCE HALL KARENIN HOUSENIGHT,8
147,INT ANNAS BOUDOIR KARENIN HOUSE SAME,38
148,EXT STREET MOSCOWDAY,3
149,INT GOVERNMENT BUILDING MOSCOWDAY,4
150,INT OUTER ROOM OBLONSKYS OFFICE SAME,9
151,INT RECEPTION ROOM OBLONSKY HOUSENIGHT,61
152,INT ENTRANCE HALL OBLONSKY HOUSE SAME,22
153,INT DINING ROOM OBLONSKY HOUSENIGHT,56
154,INT RECEPTION ROOM OBLONSKY HOUSENIGHT,66
155,EXT STREET MOSCOWNIGHT,11
156,INT TRAIN MOSCOW TO ST PETERSBURGNIGHT,2
157,INT ENTRANCE HALL KARENIN HOUSEDAY,12
158,INT BEDROOM LEVEL KARENIN HOUSE SAME,6
159,INT ANNAS BOUDOIR KARENIN HOUSE SAME,7
160,INT BEDROOM KARENIN HOUSEDAY,44
161,INT BOUDOIR KARENIN HOUSE SAME TIMEDAY,2
162,INT BEDROOM KARENIN HOUSE SAME TIMEDAY,43
163,INT VRONSKY FLAT ST PETERSBURG,22
164,INT BEDROOM VRONSKY FLATDAY,5
165,INT BEDROOM OBLONSKY HOUSE MOSCOW,24
166,INT ENTRANCE HALL SHCHERBATSKY HOUSE,14
167,INT KITTYS ROOM SHCHERBATSKY HOUSEDAY,5
168,INT OUTSIDE KITTYS ROOM SAME TIMEDAY,20
169,INT CHURCHDAY,11
170,INT NURSERY KARENIN HOUSEDAY,6
171,INT BOUDOIR KARENIN HOUSE ST PETERSBURG,4
172,INT BEDROOM KARENIN HOUSEDAY,9
173,INT ENTRANCE HALL KARENIN HOUSEDAY,8
174,INT BEDROOM LEVEL KARENIN HOUSEDAY,6
175,INT BEDROOM KARENIN HOUSE SAME TIMEDAY,113
176,EXT ROAD BRIDGE ST PETERSBURGDAY,3
177,INT COACH SAME TIME DAY,2
178,INT SECOND COACH SAME TIMEDAY,2
179,INT COACH SAME TIME DAY,2
180,EXT ROAD BRIDGE SAME TIMEDAY,3
181,INT SECOND COACH SAME TIMEDAY,6
182,INT BEDROOM THE SOUTHDAY,7
183,INT KARENINS STUDY KARENIN HOUSEDAY,42
184,EXT SNOWY COUNTRYSIDE POKROVSKOE SAME,8
185,EXT THE HOUSE POKROVSKOE SAME TIMEDAY,18
186,INT SITTING ROOM POKROVSKOE SAME TIME,15
187,INT STAIRS POKROVSKOE SAME TIMEDAY,8
188,INT GUEST BEDROOM POKROVSKOE SAME TIME,23
189,INT OUTSIDE GUEST BEDROOM POKROVSKOE,11
190,INT SITTING ROOM POKROVSKOEDAY,14
191,INT OUTSIDE GUEST BEDROOM POKROVSKOE,15
192,INT GUEST ROOM POKROVSKOEDAY,18
193,INT BOYS ROOM POKROVSKOE SAME TIMEDAY,5
194,EXT THE HOUSE POKROVSKOE SAME TIMEDAY,3
195,INT GUEST ROOM POKROVSKOEDAY,14
196,INT DINING ROOM POKROVSKOEDAY,12
197,EXT GRAVEYARD POKROVSKOEDAY,2
198,EXT THE HOUSE AND YARD POKROVSKOEDAY,8
199,INT GOVERNMENT BUILDING SAME TIME DAY,8
200,INT COMMITTEE CHAMBER SAME TIMEDAY,15
201,EXT TOY SHOP ST PETERSBURGDAY,3
202,INT VRONSKYS FLAT ST PETERSBURGDAY,6
203,EXT KARENIN HOUSE ST PETERSBURGDAY,9
204,INT ENTRANCE HALL KARENIN HOUSE SAME,21
205,INT STAIRS KARENINS HOUSE SAME TIMEDAY,3
206,INT UPPER LEVEL KARENIN HOUSE SAME TIME,4
207,INT UPPER STAIRS KARENIN HOUSE SAME TIME,8
208,INT TOP FLOOR KARENIN HOUSE SAME TIME,3
209,INT SEROZHAS ROOM KARENIN HOUSE SAME,7
210,INT UPPER STAIRS KARENIN HOUSE SAME TIME,5
211,INT UPPER LEVEL KARENIN HOUSE SAME TIME,7
212,INT BEDROOM KARENIN HOUSE SAME TIMEDAY,30
213,INT UPPER LEVEL KARENIN HOUSE SAME TIME,16
214,INT SEROZHAS ROOM KARENIN HOUSE SAME,19
215,INT OUTSIDE SEROZHAS ROOM KARENIN HOUSE,9
216,INT VRONSKYS FLAT ST PETERSBURGDAY,50
217,INT VRONSKYS FLAT ST PETERSBURGNIGHT,57
218,INT OPERA HOUSE ST PETERSBURGNIGHT,18
219,INT VRONSKYS FLAT ST PETERSBURGNIGHT,3
220,EXT OPERA HOUSE ST PETERSBURGNIGHT,3
221,INT STAIRS GALLERY OPERA HOUSENIGHT,3
222,INT ANNAS BOX OPERA HOUSE SAME TIME,30
223,INT OPERA HOUSE SAME TIMENIGHT,19
224,INT ANNAS BOX SAME TIMENIGHT,16
225,INT BETSYS BOX SAME TIMENIGHT,25
226,INT ANNAS BOX SAME TIMENIGHT,5
227,INT NEIGHBOURS BOX SAME TIMENIGHT,10
228,INT BETSYS OPERA BOX SAME TIMENIGHT,28
229,INT VRONSKYS FLAT ST PETERSBURGNIGHT,13
230,INT BEDROOM VRONSKY FLAT SAME TIMENIGHT,17
231,EXT MOSCOWDAY,2
232,INT TEA SHOP MOSCOWDAY,43
233,EXT GRAND HOTEL MOSCOWNIGHT,1
234,INT HOTEL SUITE MOSCOWNIGHT,3
235,INT HOTEL BEDROOM SAME TIMENIGHT,3
236,INT BEDROOM MOSCOW HOTELDAY,18
237,INT HOTEL SUITE MOSCOWDAY,61
238,INT BEDROOM HOTEL SAME TIMEDAY,18
239,INT DINING ROOM HOTEL SUITEDAY,4
240,INT STUDY HOTEL SUITEDAY,61
241,EXT HOTEL BUILDING SAME TIMEDAY,3
242,INT HOTEL SUITE SAME TIMEDAY,6
243,INT STUDY HOTEL SUITE SAME TIMEDAY,12
244,INT BEDROOM HOTEL SUITE SAME TIMEDAY,10
245,INT BEDROOM HOTEL SUITENIGHT,4
246,INT STUDY HOTEL SUITENIGHT,3
247,INT BEDROOM HOTEL SUITEDAY,4
248,INT OUTSIDE THE BEDROOM HOTEL SUITE SAME,15
249,INT CLOSE HOTELDAY,3
250,INT HOTEL SUITE SAME TIMEDAY,6
251,INT HOTEL SUITEDAY,3
252,INT STAIRS HOTELDAY,7
253,INT LOCAL TRAINDAY,20
254,EXT LOCAL STATION SAME TIMEDAY,37
255,EXT POKROVSKOEDAY,4
256,EXT RAILSTHE RED HANDBAG,3
257,EXT POKROVSKOEDAY,2
258,EXT HAYFIELD POKROVSKOE SAME TIMEDAY,31
259,EXT POKROVSKOEDAY,2
260,EXT HOUSE AND PORCH POKROVSKOE SAME,21
261,INT NURSERY POKROVSKOE SAME TIMEDAY,26
262,EXT PORCH POKROVSKOENIGHT,6
263,EXT FLOWERING MEADOWDAY,12
264,EXT BATTLEFIELD BALKANSDAY,7
