1,INT EXAM ROOM  DAY,74
2,INT ZOES APARTMENT  DAY,35
3,INT WAVERLY INN,40
4,INT MONAS APARTMENT  NIGHT,63
5,INT EXAM ROOM  DAY,12
6,INT DOCTORS OFFICE HALLWAY  LATER,14
7,INT WAITING ROOM  MOMENTS LATER,9
8,INT ELEVATOR  DAY,18
9,EXT MADISON AVENUE  DAY,17
10,INT TAXI  MOMENTS LATER,51
11,EXT TAXI  CONTINUOUS,22
12,INT TH STREET SUBWAY STATION  DAY,10
13,INT  TRAIN  DAY,7
14,INT UNION SQUARE SUBWAY STATION  DAY,23
15,INT HUDSON PETS  DAY,71
16,EXT HUDSON PETS  NIGHT,88
17,EXT WEST VILLAGE BROWNSTONE  MORNING,3
18,INT ZOES APARTMENT  MORNING,8
19,INT CAROLS APARTMENT  DAY,107
20,INT LE PAIN QUOTIDIEN  DAY,67
21,EXT FARMERS MARKET  DAY,79
22,EXT THE LITTLE GOAT CHEESE STAND  LATER,81
23,INT HUDSON PETS  DAY,56
24,EXT TH STREET  NIGHT,4
25,INT GRAYS PAPAYA HOT DOGS  NIGHT,109
26,EXT PERRY STREET  NIGHT,18
27,INT ZOES APARTMENT  DAY,7
28,INT EQUINOX  DAY,27
29,INT EQUINOX STEAM ROOM  DAY,35
30,INT ZOES BEDROOM  NIGHT,5
31,INT ZOES BATHEROOM  NIGHT,33
32,INT TAXI  NIGHT,25
33,INT UNDERGROUND RESTAURANTSMALL APARTMENT  NIGHT,35
34,INT UNDERGROUND RESTAURANTSMALL APARTMENT  MOMENTS LATER,13
35,INT UNDERGROUND RESTAURANTSMALL APARTMENT  MOMENTS LATER,11
36,INT DRUGSTORE  NIGHT,10
37,INT UNDERGROUND RESTAURANTSMALL APARTMENT  NIGHT,25
38,INT BATHROOM  NIGHT,17
39,INT UNDERGROUND RESTAURANTSMALL APARTMENT  NIGHT,20
40,EXT BACK PATIO  SAME,24
41,INT BATHROOM  NIGHT,26
42,EXT PERRY STREET  NIGHT,78
43,INT ZOES BEDROOM  NIGHT,5
44,EXT SHADYBROOK RETIREMENT COMMUNITY  DAY,2
45,INT SHADYBROOK LOBBY  DAY,20
46,EXT SHADYBROOK COURTYARD  LATER,31
47,EXT SHADYBROOK COURTYARD  LATER,42
48,INT NANAS ROOM  LATER,66
49,INT CAR  DAY,22
50,INT GAS STATION MINI MART  DAY,12
51,EXT CAR  LATER,3
52,INT CAR  SAME,17
53,EXT LITTLE GOAT FARM  DAY,9
54,INT HOUSE  MOMENTS LATER,30
55,INT STANS BEDROM  MOMENTS LATER,15
56,INT KITCHEN  DAY,33
57,INT STANS BEDROOM  LATER,15
58,INT HALLWAY  MOMENTS LATER,9
59,INT KITCHEN  NIGHT,56
60,INT DINING ROOM  LATER,19
61,INT LIVING ROOM  LATER,69
62,EXT LITTLE GOAT FARM  NIGHT,70
63,INT CHEESE CAVE  NIGHT,57
64,EXT DAIRY  MOMENTS LATER,4
65,INT HOUSE  MOMENTS LATER,3
66,INT STANS BEDROOM  NIGHT,12
67,INT STANS ROOM  LATER,63
68,INT STANS BATHROOM  MOMENTS LATER,142
69,INT STANS BEDROOM  LATER,5
70,EXT LITTLE GOAT FARM  DAY,3
71,INT GUEST ROOM  MORNING,32
72,INT CAR  DAY,20
73,EXT MONAS APARTMENT  NIGHT,10
74,INT ZOES APARTMENT  DAY,7
75,INT EXAM ROOM  DAY,145
76,EXT CAROLS APARTMENT  LATER,63
77,EXT SHADYBROOK RETIREMENT COMMUNITY  DAY,54
78,EXT LITTLE GOAT FARM  DAY,35
79,INT STANS BEDROM  NIGHT,6
80,INT ZOES APARTMENT  DAY,5
81,INT CAROLS APARTMENT  DAY,48
82,EXT HUDSON STREET  DAY,113
83,INT ZOES BEDROOM  NIGHT,24
84,INT EXAM  ROOM,32
85,EXT MADISON AVENUE  DAY,17
86,INT UNION SQUARE CAFE  NIGHT,37
87,INT MCDONALDS  NIGHT,17
88,INT ZOES BEDROOM  NIGHT,35
89,INT EQUINOX GYM  DAY,37
90,INT ZOES APARTMENT  NIGHT,38
91,EXT PERRY STREET  LATER,30
92,INT TAXI  CONTINUOUS,7
93,INT ZOES APARTMENT  LATER,61
94,INT PUCK BUILDING  NIGHT,25
95,INT ZOES BEDROOM  LATER,52
96,INT ZOES BEDROOM  LATER,4
97,INT ZOES LIVING ROOM  CONTINUOUS,146
98,INT LORIS APARTMENT BUILDING LOBBY  NIGHT,19
99,INT LORIS APARTMENT  NIGHT,79
100,INT LORIS APARTMENT BUILDING LOBBY  MOMENTS LATER,14
101,INT LORIS APARTMENT  LATER,32
102,INT LORIS LIVING ROOM  NIGHT,40
103,INT LORIS LIVING ROOM  LATER,60
104,INT LORIS FOYER  SAME,9
105,INT LORIS LIVING ROOM  MOMENTS LATER,33
106,INT LORIS LIVING ROOM  MOMENTS LATER,20
107,EXT TH STREET  DAY,76
108,EXT FARMERS MARKET  MOMENTS LATER,41
109,INT ZOES APARTMENT  DAY,4
110,INT LE PAIN QUOTIDIEN  DAY,83
111,INT ZOES APARTMENT  MORNING,8
112,EXT ZOES BROWNSTONE  DAY,36
113,INT DR HARRIS OFFICE  DAY,40
114,INT SHADYBROOK COURTYARD  DAY,51
115,INT SHADYBROOK DINING ROOM  DAY,48
116,INT ZOES APARTMENT  DAY,16
117,INT CHURCH  DAY,8
118,INT SHADYBROOK REC ROOM  LATER,48
119,EXT FARMERS MARKET  DAY,19
120,INT SHADYBROOK REC ROOM  LATER,53
121,EXT SHADYBROOK RETIREMENT HOME  DAY,35
122,INT ROLLS ROYCE  LATER,25
123,INT LENOX HILL HOSPITAL  DAY,33
124,INT LABOR AND DELIVERY ROOM  DAY,48
125,EXT TH STREET  DAY,5
126,INT TAXI  MOMENTS LATER,9
127,EXT TH STREET  DAY,21
128,EXT FARMERS MARKET  LATER,88
129,INT OPERATING ROOM  DAY,14
130,INT HOSPITAL ROOM  NIGHT,11
131,EXT TH AVENUE  DAY,15
132,INT GRAYS PAPAYA HOT DOGS  DAY,61
