1,EXT BOMBARDED NEIGHBORHOOD WARTORN COUNTRY  DAY,36
2,EXT SAWTOOTH WALL  DAY,5
3,EXT MOUND OF RUBBLE  DAY,9
4,EXT RUINED HIGHRISE  DAY,3
5,EXT MOUND OF RUBBLE,17
6,EXT SAWTOOTH WALL  MINICAM POV,5
7,EXT MOUND OF RUBBLE,7
8,EXT RUINED HIGHRISE  POV THROUGH VIEWFINDER,5
9,EXT MOUND OF RUBBLE,15
10,EXT RUINED HIGHRISE,2
11,EXT SAWTOOTH WALL,5
12,EXT MOUND OF RUBBLE,5
13,EXT STREET,4
14,EXT MOUND OF RUBBLE,21
15,EXT LOGAN INTERNATIONAL AIRPORT BOSTON  RUNWAY ,4
16,EXT INTERNATIONAL TERMINAL  NIGHT,34
17,INT JEFF AND AMYS APARTMENT  NIGHT,8
18,INT BEDROOM  NIGHT,20
19,INT DARKROOM  NIGHT,54
20,INT LIVING ROOM  KITCHEN AREA  NIGHT,69
21,EXT CREDIT MONTAGE  VARIOUS LOCATIONS  LOW ANGLE ,11
22,EXT OPEN DESERT  DAY,11
23,INT JEEP CHEROKEE  DAY,12
24,EXT HIGHWAY   YARDS AHEAD,8
25,INT CHEROKEE  DAY,5
26,EXT HIGHWAY  DAY,4
27,INT CHEROKEE  DAY,30
28,EXT GAS STATION  DAY,14
29,INT CONVENIENCE MART  SAME TIME,37
30,EXT GAS STATION  DAY,107
31,INT CHEROKEE  DRIVING  DAY,38
32,EXT DESERT HIGHWAY  AERIAL  DAY,4
33,INT CHEROKEE  DRIVING  FEW MINUTES LATER,85
34,EXT HIGHWAY  DAY,276
35,EXT ROADSIDE  TWENTY MINUTES LATER,29
36,EXT DESERT ROAD  MINUTES LATER,2
37,INT CHEROKEE  SAME TIME,2
38,EXT DESERT HIGHWAY  DAY,3
39,EXT BELLES DINER  DAY,9
40,INT BELLES  DAY,95
41,EXT BELLES  DAY,13
42,INT DINER  DAY,20
43,EXT BELLES  DAY,8
44,INT CHEROKEE  DAY,6
45,EXT DESERT HIGHWAY  MINUTES LATER,2
46,INT CHEROKEE  DAY,7
47,EXT FORK IN ROAD  DAY,2
48,EXT DESERT HIGHWAY  AERIAL VIEW  DAY,4
49,INT CHEROKEE  DAY,205
50,INT PETERBILT CAB  DAY,12
51,EXT PETERBILT  DAY,40
52,EXT REAR OF PETERBILT  DAY,56
53,INT PETERBILT CAB  DAY,3
54,EXT CAB  DAY,138
55,INT POLICE STATION  DAY,49
56,EXT ROOF OF BELLES DINER  DAY,3
57,EXT PARKING LOT  DAY,4
58,INT BELLES DINER  DAY,117
59,EXT BELLES DINER  DAY,99
60,INT CHEROKEE  DAY,12
61,EXT CROSSROADS  DAY,6
62,EXT ROUTE   DAY,4
63,INT CHEROKEE  DAY,6
64,EXT MOUNTAINS  DAY,4
65,INT CHEROKEE  DAY,243
66,EXT ROCK OUTCROPPING  MINUTES LATER,35
67,EXT ANOTHER PART OF CLIFF  LATER,20
68,INT CAR TRUNK  DAY,81
69,INT CAR TRUNK  DAY,12
70,EXT MESA OVERLOOK  DAY,203
71,EXT BOTTOM OF MESA  DAY,11
72,EXT STREET  DAY,6
73,INT BANK  DAY,105
74,INT BANK REST ROOM  DAY,21
75,INT BANK  DAY,17
76,EXT STREET  DAY,39
77,INT BANK  DAY,12
78,EXT HIGHWAY  OUTSKIRTS OF TOWN  DAY,143
79,EXT MOUNTAIN ROAD  DAY,4
80,INT PICKUP  DAY,11
81,EXT MOUNTAIN ROAD  DAY,3
82,INT PICKUP  DAY,5
83,EXT MOUNTAIN ROAD  DAY,3
84,INT PICKUP  DAY,4
85,INT TOW TRUCK  DAY,4
86,INT PICKUP  DAY,28
87,EXT MOUNTAIN ROAD  DAY,4
88,INT PICKUP  DAY,45
89,INT POLICE CRUISER  DAY,4
90,EXT MOUNTAIN ROAD  DAY,3
91,INT POLICE CRUISER  DAY,4
92,EXT HIGHWAY  DAY,5
93,INT DODGE RAM  DAY,16
94,INT CRUISER  DAY,8
95,EXT HIGHWAY  DAY,2
96,INT CRUISER  DAY,9
97,INT PICKUP  DAY,17
98,INT CRUISER  DAY,3
99,EXT HIGHWAY  DAY,22
100,INT PICKUP  DAY,18
101,EXT HIGHWAY  DAY,63
102,EXT BLUFF  DAY,16
103,EXT TRUCK STOP  DAY,18
104,EXT TRUCK WASH  DAY,18
105,EXT BLUFF  JEFFS POV,4
106,EXT TRUCK WASH  DAY,6
107,EXT TRUCK STOP PARKING LOT  DAY,76
108,EXT INTERSTATE  UNDER TRUCK  DAY,16
109,EXT INTERSTATE  DAY,4
110,EXT UNDER TRUCK  DAY,7
111,EXT BETWEEN CAB AND TRAILER  DAY,21
112,INT TRUCK CAB  DAY,3
113,EXT TRUCK COUPLER  DAY,8
114,INT POLICE STATION  DAY,10
115,EXT REDS PETERBILT  DAY,5
116,EXT REDS PETERBILT  DUSK,7
117,EXT REDS PETERBILT  NIGHT,3
118,EXT ROOF OF TRUCK CAB  NIGHT,6
119,EXT RESIDENTIAL LOT  NIGHT,25
120,EXT TRUCK CAB  NIGHT,4
121,EXT YARD  NIGHT,66
122,EXT BARN  NIGHT,9
123,EXT ROOF OF BARN  NIGHT,7
124,EXT ROOF OF BARN  NIGHT,3
125,INT BARN HAYLOFT  NIGHT,16
126,EXT BARN  NIGHT,5
127,INT BARN  NIGHT,18
128,INT BARN HAYLOFT  NIGHT,32
129,INT BARN HAYLOFT  NIGHT,3
130,INT BARN GROUND FLOOR  NIGHT,13
131,INT BARN HAYLOFT KNOTHOLE  NIGHT,4
132,INT BARN GROUND FLOOR  NIGHT,14
133,INT BARN HAYLOFT KNOTHOLE  NIGHT,3
134,INT BARN GROUND FLOOR  NIGHT,76
135,INT BARN HAYLOFT  NIGHT,4
136,INT REAR OF BARN  NIGHT,59
137,INT BARN  MOVING VAN CAB  NIGHT,21
138,EXT BARN  NIGHT,8
139,EXT REDS HOUSE  BACK PORCH  NIGHT,3
140,INT REDS HOUSE  REAR ENTRYWAY  NIGHT,21
141,INT REDS KITCHEN  NIGHT,178
142,EXT BARN  NIGHT,43
143,INT BARN  NIGHT,126
144,EXT BARN  DAWN,27
145,EXT FIELD  LONG SHOT  DAWN,4
146,EXT TRAILER HOME  DAWN MINUTES LATER,12
147,INT TRAILER  DAWN,49
148,INT REDS PETERBILT  DAY,5
149,INT TRAILER HOME  DAY,7
150,INT TRUCK CAB  DAY,3
151,INT TRAILER HOME  DAY,9
152,INT TRUCK CAB  DAY,435
153,EXT REDS HOUSE  DAY,83
