1, INT SALOON CAR  EVENING,97
2, INT SUBURBAN SEMI  DAY,12
3, INT GARDEN SHED  DAY,18
4, INT SUBURBAN SEMI  DAY,53
5, INT SUBURBAN SEMI  DAY,33
6, INT SUBURBAN SEMI  DAY,10
7, INT SUBURBAN SEMI  DAY,6
8, INT SUBURBAN SEMI PIPS BEDROOM  NIGHT,3
9, INT SUBURBAN SEMI MASTER BEDROOM  CONTINUOUS,8
10, EXT  INT SALOON CAR  NIGHT LATER,7
11, EXT PLAYGROUND  DAY,19
12, INT CHEAP FLAT  DAY,81
13, INT CHEAP FLAT  HALLWAY  NIGHT,4
14, LATER INT CHEAP FLAT  BEDROOM  NIGHT,49
15, EXT SCHOOL  DAY,4
16, EXT QUIET ROAD  DAY LATER,3
17, EXT CHEAP FLAT  EVENING,5
18, INT CHEAP FLAT  CONTINUOUS,13
19, INT CHEAP FLAT  KITCHEN,26
20, INT CHEAP FLAT BATHROOM  EVENING LATER,2
21, INT CHEAP FLAT  BEDROOM  EVENING LATER,16
22, INT CHEAP FLAT  BEDROOM  CONTINUOUS,3
23, INT SUBURBAN SEMI  DAY,51
24, INT SALOON CAR  EVENING,8
25, INT CHEAP FLAT  EVENING,42
26, INT CHEAP FLAT  BEDROOM  EVENING LATER,31
27, INT CHEAP FLAT  BEDROOM  CONTINUOUS,38
28, INT STORAGE DEPOT  DAY,6
29, INT STORAGE DEPOT  DAY,8
30, INT MAIN WAREHOUSE  DAY,250
31, EXT STORAGE DEPOT  DAY SAME TIME,3
32, INT STORAGE DEPOT  DAY SAME TIME,155
33, EXT STORAGE DEPOT  DAY SAME TIME,3
34, INT STORAGE DEPOT  DAY SAME TIME,91
35, INT THE WAREHOUSE  DAY,3
36, INT THE BOX  DAY,3
37, INT STORAGE DEPOT  AREA   DAY,25
38, INT THE WAREHOUSE  DAY,3
39, INT STORAGE DEPOT  AREA   DAY,43
40, INT THE WAREHOUSE  DAY,2
41, INT STORAGE DEPOT  AREA   DAY,60
42, INT THE BOX  DAY,13
43, EXT STORAGE DEPOT  DAY SAME TIME,10
44, EXT LONDON E  EVENING,12
45, INT COUNCIL HOUSE  EVENING,62
46, EXT LONDON E  EVENING,22
47, EXT NEARBY,14
48, INT E COUNCIL HOUSE  EVENING,28
49, INT E HOUSE  NIGHT,9
50, INT E COUNCIL HOUSE  EVENING LATER,8
51, INT LIVING ROOM  EVENING,2
52, INT KITCHEN  EVENING,15
53, INT E COUNCIL HOUSE  EVENING LATER,3
54, INT AUSTENS ROOM  EVENING,37
55, INT PAULS ROOM  EVENING,14
56, EXT E  EVENING,73
57, INT  EXT IMAGES STROBE FAST,11
58, INT E COUNCIL HOUSE  EVENING,11
59, INT E COUNCIL HOUSE  LATER EVENING,2
60, INT E COUNCIL HOUSE  EVENING,2
61, INT JADEN ROOM  EVENING,3
62, INT LIVING ROOM  EVENING,2
63, EXT E  DAY,3
64, INT E COUNCIL HOUSE  SHOWER  EVENING,2
65, INT THE HALLWAY  EVENING,2
66, INT JADENS BEDROOM  EVENING,11
67, INT E HOUSE  NIGHT,9
68, EXT E  NIGHT,3
69, INT  EXT GOLF GTIE  DAY,45
70, INT E COUNCIL HOUSE  NIGHT,3
71, INT JADENS ROOM  NIGHT,5
72, INT CHURCH  DAY,11
73, EXT E  NIGHT,4
74, INT E HOUSE  NIGHT,6
75, INT E HOUSE  NIGHT,6
76, INT E HOUSE  CONTINUOUS,8
77, EXT E  NIGHT,6
78, INT HOSPITAL WARD  DAY,6
79, INT E COUNCIL HOUSE  DAY,24
80, INT JADENS BEDROOM  NIGHT,3
81, INT THE BATHROOM  NIGHT,4
82, INT THE BATHROOM  LATER NIGHT,7
83, EXT LYLE PARK CANNING TOWN LONDON  EVENING,46
84, EXT ROYAL VICTORIA DOCK  NIGHT LATER,11
85, INT E COUNCIL HOUSE  EVENING,7
86, INT E COUNCIL HOUSE  EVENING,11
87, INT COUNTRY HOME  DAY,25
88, INT RESEARCH ROOM FACILITY  DAY,41
89, INT ARTIST STUDIO  DAY,20
90, INT RESEARCH ROOM FACILITY  DAY,4
91, INT BOARD ROOM FACILITY  DAY,141
92, INT COUNTRY HOME  DAY,4
93, INT BOARD ROOM FACILITY  CONTINUOUS,42
94, INT ARTIST STUDIO  DAY,21
95, INT BOARD ROOM FACILITY  CONTINUOUS,35
96, INT COUNTRY HOME  DAY,12
97, INT BOARD ROOM FACILITY  DAY,21
98, INT FACILITY  DAY FLASHBACK,4
99, INT ELLES APARTMENT  NIGHT,6
100, INT COUNTRY HOME  DAY,3
101, EXT ELLES APARTMENT  DAY,13
102, INT ELLES APARTMENT  DAY SAME TIME,144
103, INT BOARD ROOM FACILITY  DAY,24
104, INT ELLES APARTMENT  DAY SAME TIME,104
105, INT BOARD ROOM FACILITY  DAY,4
106, INT ELLES APARTMENT  DAY,31
107, INT FACILITY  DAY,10
108, EXT SOUTH LONDON STREET  NIGHT,11
109, INT RADIO STATION  DJ BOOTH  NIGHT,145
110, INT SHONAS HOME BEDROOM  NIGHT,7
111, INT SHONAS HOME KITCHEN  NIGHT,7
112, INT LIVING ROOM  NIGHT,7
113, INT HALLWAY  NIGHT,183
114, INT KITCHEN  NIGHT,17
115, INT LIVING ROOM  NIGHT,4
116, INT UPSTAIRS  NIGHT,5
117, INT BEDROOM  NIGHT,10
118, INT LANDING  NIGHT,8
119, INT KITCHEN  NIGHT,60
120, INT KITCHEN  LATER NIGHT,165
