1,GIANCALDO SALVATORES MOTHERS HOUSE EXTINT DAY,68
2,ROME STREETS EXTINT NIGHT,22
3,ROME SALVATORE S APARTMENT INT NIGHT,71
4,GIANCALDO CHURCH AND SACRISTY INT MORNING,46
5,CINEMA PARADISO AND PROJECTION BOOTH INT MORNING,61
6,GIANCALDO MAIN SQUARE EXT DAY,10
7, CINEMA PARADISO PROJECTION BOOTH INT DAY,95
8,GIANCALDO SALVATORES HOUSE INT EVENING,58
9,GRADE SCHOOL COURTYARD EXT DAY,23
10,FOURTH GRADE INT DAY,60
11,CINEMA PARADISO BALCONY AND MAIN FLOOR INT DAY,103
12,SQUARE AND ENTRANCE OF CINEMA PARADISO EXT NIGHT,90
13,CEMETERY ROAD AND VILLAGE ROAD EXT DAY,76
14,SALVATORE S HOUSE EXT DAY,69
15,SQUARE AND PROJECTION BOOTH EXTINT DAY,12
16,CINEMA PARADISO INTEXT DAY,24
17,CINEMA PARADISO PROJECTION ROOM AND SQUARE INTEXT DAY,208
18,CINEMA PARADISO INT DAY,12
19,SQUARE AND VILLAGE EXT MORNING,10
20,GRADE SCHOOL DINING HALL INT MORNING,74
21,VARIOUS SETTINGS INT DAYEVENING,62
22,FIFTH GRADE INT DAY,29
23,SQUARE AND PROJECTION BOOTH CINEMA PARADISO EXTINT DAY,34
24,CINEMA PARADISO BALCONY AND BOOTH INT EVENING,27
25,PREFECTURE CITY INT DAY,18
26,PREFECTURE AND CITY STREET EXT DAY,8
27,CINEMA PARADISO BOX OFFICE PROJECTION BOOTH SQUARE INTEXT EVENING,97
28,PROJECTION BOOTH AND SQUARE INTEXT EVENING,98
29,PROJECTION BOOTH INT DAY,12
30,SQUAREEXTEVENING,5
31,ICINEMA PARADISO INT EVENING,4
32,SQUARE AND CINEMA PARADISO ENTRANCE EXT EVENING,11
33,CINEMA PARADISO STAIRS AND PROJECTION BOOTH INT EVENING,13
34,CINEMA PARADISO INT EVENING,4
35,SQUARE AND CINEMA PARADISO EXT EVENING,20
36,CINEMA PARADISO EXT EVENING,5
37,CINEMA PARADISO INT EVENING,13
38,CINEMA PARADISO PROJECTION BOOTH INT EVENING,32
39,CINEMA PARADISO INT EVENING,15
40,PROJECTION BOOTH INT EVENING,85
41,CAFE IN THE SQUARE INTEXT MORNING,66
42,CINEMA PARADISO INT DAY,20
43,CINEMA PARADISO PROJECTION BOOTH INT,11
44,VILLAGE STREETS AND COUNTRYSIDE EXT DAY,6
45,ENTRANCE OLD ABANDONED MOVIE HOUSE EXT DAY,17
46,OLD ABANDONED MOVIE HOUSE INT DAY,7
47,VARIOUS COUNTRY ROADS AND VILLAGE STREETS EXT DAYSUNDOWN,14
48,CINEMA PARADISO INT EVENING,8
49,PROJECTION BOOTH INTEXT EVENING,12
50,OLD ABANDONED MOVIE HOUSE INT EVENING,30
51,VILLAGE STREETS AND COUNTRY ROADS EXT EVENING,42
52,CINEMA PARADISO INT DAYEVENING,34
53,CINEMA PARADISO INT MORNING,39
54,VARIOUS SETTINGS INTEXT DAY,30
55,HIGH SCHOOL COURTYARD ENTRANCE EXT MORNING,52
56,CINEMA PARADISOPROJECTION BOOTHINTAFTERNOON,132
57,CINEMAPARADISOANDVARIOUSSTREETSEXTDAY,56
58,SALVATORES BEDROOMINTDAY,15
59,PHONEBTH AND ELENAS HOUSEINTDAY,63
60,ALFREDOS HOUSEEXTAFTERNOON,114
61,ICHURCHINTEVENING,137
62,SQUARE AND ELENAS HOUSE EXT NIGHT,28
63,SALVATORES HOUSE GIANCALDO INT NIGHT,14
64,ELENAS HOUSEEXTNIGHT,21
65,SALVATORE S HOUSE GIANCALDO INT NIGHT,19
66,ELENA S HOUSE EXT NIGHT,6
67,CINEMA PARADISO PROJECTION BOOTH INT AFTERNOON,32
68,VARIOUS SETTINGS INTEXT DAY,9
69,ROAD AT THE EDGE OF TOWNEXT DAY,34
70,CINEMA PARADISO INT EVENING,40
71,CINEMA PARADISO TOILET INT EVENING,61
72,BEACH AND IMPERIA ARENA EXT DAY,6
73,BEACH IMPERIA ARENA PROJECTION BOOTH EXTEVENING,48
74,VARIOUS SETTINGS INTEXT DAY,10
75,ARENA IMPERIA PROJECTION BOOTH EXTINTEVENING,49
76,CINEMA PARADISO ENTRANCE EXT DAY,19
77,UNIVERSITY EXT DAY,42
78,CINEMA PARADISO ENTRANCE EXT MORNING,21
79,SQUARE AND PROJECTION BOOTH CINEMA PARADISO EXTINT DAY,38
80,ROAD TO THE CITY EXT AFTERNOON,5
81, CINEMA PARADISOPROJECTION BOOTHINTAFTERNOON,8
82,CITYEXTAFTERNOON,8
83,CINEMA PARADISOPROJECTION BOOTHINTAFTERNOON,3
84,ELENAS HOUSE IN THE CITYEXTINTAFTERNOON,14
85,CINEMA PARADISOPROJECTION BOOTHINTAFTERNOON,4
86,ROAD TO THE VILLAGE EXT SUNDOWN,5
87,CINEMA PARADISO PROJECTION BOOTH INT SUNDOWN,16
88,CINEMA PARADISO ENTRANCE EXT SUNDOWN,4
89,CINEMA PARADISO PROJECTION BOOTH INT SUNDOWN,33
90,ROME VARIOUS SETTINGS MILITARY LIFE EXT INT DAYNIGHT,59
91,GIANCALDO SQUARE AND STREETS EXT DAY,15
92,ALFREDOS HOUSE INT AFTERNOON,26
93,BEACH AND WATERFRONT EXT AFTERNOON,125
94,VARIOUS SETTINGS EXTINT NIGHT,20
95,GIANCALDO RAILWAY STATION EXT DAY,36
96,PUNTA RAISI AIRPORT EXT DAY,8
97,SUPERHIGHWAY INTEXT DAY,10
98,SALVATORES MOTHERS HOUSE EXTINT DAY,23
99,SALVATORES MOTHERS HOUSE INT DAY,66
100,GIANCALDO MAIN STREET AND SQUARE EXT DAY,88
101,SALVATORE S MOTHERS HOUSE EXTINT EVENING,61
102,CINEMA PARADISO EXT DAY ,5
103,CINEMA PARADISO PROJECTION BOOTH INT DAY,37
104,CAF IN SQUARE INTEXT DAY,22
105,GIANCALDO STREET EXT DAY,26
106,SALVATORES MOTHERS HOUSE INT AFTERNOON,19
107,HIGH SCHOOL STREETS AND LITTLE SQUARE EXT DAY,11
108,SALVATORES MOTHERS HOUSE INT DAY,138
109,SMALL SQUARE AND HOUSE INTEXT EVENING,22
110, CAF AND SMALL SQUARE INTEXT EVENING,90
111,DIFFERENT SETTINGS INTEXT EVENING,7
112,SALVATORES MOTHERS HOUSE INT EVENING,8
113,SEAFRONT AND PIER EXTINT CAR EVENING,197
114,CINEMA PARADISO PROJECTION BOOTH INT AFTERNOON F,44
115,WATERFRONT INT CAR EVENING,23
116,CINEMA PARADISO PROJECTION BOOTH INT AFTERNOON F,24
117,WATERFRONT EXTINT CAR EVENING,96
118,ALFREDOS WIDOWS HOUSE INT DAY,40
119,CINEMA PARADISO PROJECTION BOOTH INT DAY,38
120,CAF IN SQUARE AND ELENAS HOUSE INTEXT DAY,32
121,CINEMA PARADISO EXT DAY,10
122,CINEMA PARADISO INT DAY,4
123,SQUARE AND CINEMA PARADISO EXT DAY,6
124,ELENA S HOUSE INT DAY,5
125,SQUARE AND CINEMA PARADISO EXT DAY,19
