1,EXT BIHAR  DAY DAWN SUMMER MID,20
2,EXT ROADSIDE  BUS STOP  DAY DAWN,48
3,EXT ROADSIDEINT BUS  DAY,30
4,INT ASHRAM  ANOTHER FLOWER  DAY,26
5,INT SPARTAN ROOM  TRUMPET  DAY,67
6,EXT COUNTRY AIRPORT ASSAM  WINDING ROAD  DAY,5
7,INT AIRPORT  WAITING ROOM,29
8,EXT AIRPORT  LOW ANGLE  DAY,20
9,INT  FOURSEATER  DAY,37
10,EXT HOWRAH STATION CALCUTTA  DAY EARLY MORNING,75
11,EXT CHOWRINGHEE LANE  DAY MIDDAY SUN,61
12,EXT SMALL BUILDING IN BACK STREET  DAY,10
13,INT SMALL ROOM  DAY,65
14,INT CHATTERGEE STAIRCASE  DAY,3
15,INT GUEST ROOM  DAY,23
16,INT MAIN ROOM  DAY,17
17,INT BATHING AREA,54
18,EXT SMALL STREET  DAY,7
19,EXT VICTORIA MONUMENT  STREET  NIGHT DUSK,8
20,INT CHATTERGEES LIBRARY  TORSO  NIGHT,22
21,EXT KITCHEN  WINDOW  NIGHT,4
22,EXT RIVER BANK  HOWRAH BRIDGE  DAY,19
23,EXT DOCKS  DAY,19
24,EXT BARA BAZAR  DAY,4
25,INT MENS SHOP  MOVING MIRROR,20
26,EXT MENS SHOP  DAY,32
27,EXT JUTE MILL DAY  LATE AFTERNOON SUN,4
28,INT JUTE MILL  DAY,30
29,INT CHATTERGEE RECEPTION ROOM  DAY LATE AFTERNOON,45
30,EXT CHATTERGEE HOME  DAY,10
31,EXT GREEN ACRES COURTYARD  COW  DAY LATE AFTERNOON,9
32,INT HOTEL ROOM  DAY,49
33,EXT RIVERBANK  HOWRAH BRIDGE  DAY EARLY EVENING,68
34,EXT BRIDGE  NIGHT,29
35,EXT GREEN ACRES  NIGHT,3
36,INT MAXS ROOM,3
37,EXT SETTLEMENT  CLOSE ON BULLDOZER  DAWN,64
38,EXT CHURCH  CLOSE ON BILLBOARD  DAY,17
39,EXT SIDE OF RESTAURANT,17
40,INT BLOOD DISPENSARY  CLOSE ON HASARIS ARM  DAY,22
41,EXT DISPENSARY  DAY,25
42,INT MAXS ROOM  NIGHT,61
43,INT MAXS ROOM  NIGHT HALF HOUR LATER,60
44,INT BACK ALLEY  BAR  FLAMING LIGHT  NIGHT,60
45,EXT BAR  NIGHT,22
46,EXT MAHARAJAH SIGN  NIGHT,28
47,INT CLINICSCHOOL CITY OF JOY  MAXS POV  CRUCIFIX,55
48,EXT CLINICSCHOOL  NIZAMUDHIN LANE  MAXS FACE,107
49,EXT STREET  FLYING FEET  DAY,69
50,INT GODFATHERS HOUSE  DAY,9
51,INT THRONE ROOM,107
52,EXT MATTRESS SIGN  DAY EARLY EVENING,4
53,EXT SQUARE  NIGHT EARLY EVENING,9
54,INT RAMS HUT  NIGHT,17
55,EXT GREEN ACRES  ON SKY  NIGHT,6
56,EXT SQUARE AND STREET CITY OF JOY  DAY,26
57,EXT SQUARE  HIGH ANGLE  DAY,10
58,EXT PARK STREET  DAY,47
59,EXT ST PIUS  DAY,17
60,INT SMALL RESTAURANT  DAY,42
61,EXT CITY OF JOY  AROUND CORNER  DAY EARLY EVENING,40
62,EXT POST OFFICE  DAY,12
63,EXT SQUARE CITY OF JOY  TEA SHOP  DAY DUSK,116
64,EXT RAMS HUNT NIGHT  UPSTAIRS,141
65,EXT PATHNIGHT,8
66,EXT RAILWAY LINE  LEPER HUTS  NIGHT,7
67,INT HUT  NIGHT,108
68,EXT LANE  NIGHT,46
69,EXTINT JOANS AND THE PALS ALTERNATE  NIGHT,22
70,EXT CALCUTTA AIRPORT  ESTABLISHING  DAY,7
71,INT AIRPORT  DAY,149
72,EXT SQUARE  DAY EARLY MORNING,111
73,EXT SCHOOL GIRLS HOUSE  HASARIS WHEELS  DAY TWO,40
74,EXT SECOND WEDDING SHOP  DAY,44
75,INT EXAMINING ROOM  DAY,38
76,EXT SQUARE  DAY EARLY EVENING,79
77,INT GODFATHERS THRONE ROOM  OLD RADIO  DAY,145
78,EXT GODFATHERS HOUSE  DAY,16
79,INT METAL PIECEWORK SHOP  DAY,17
80,EXT SIDE STREET  DAY,22
81,EXT JOANS ROOM  KIDS  ABOVE  NIGHT,3
82,INT JOANS ROOM,151
83,MONTAGE  INTEXT COWSHEDS  DAY,65
84,EXT CLINIC  NIGHT,73
85,EXT GREEN ACRES  THROUGH RICKSHAW WHEELS  DAY,46
86,EXT SIDE STREET  DAY,20
87,EXT CITY OF JOY  DAY,185
88,INT COURTYARD  DAY,5
89,INT EXAMINING ROOM  MAX ALOKA POOMINA,30
90,EXT GODFATHERS COURTYARD  HAND AND PENCIL  DAY,57
91,EXT GODFATHERS HOUSE  DAY,14
92,INT CLINIC  JOANS ROOM  RAFT OF MEDUSA  NIGHT,54
93,EXT RAMS HUT  TEA SHOP  NIGHT,71
94,INT RAMS HUT,6
95,INT BLOOD DISPENSARY  CLOSE ON HASARIS ARM  DAY,18
96,EXT BLOOD BANK  DAY,65
97,EXT STREET  MOVING SHOT  DAY,15
98,EXT SKELETON WAREHOUSE MITRA  CO EXPORTERS  JUDAS,3
99,INT SKELETON WAREHOUSE  DAY,18
100,INT MANAGERS OFFICE,12
101,INTEXT TAXI  ROAD TO AIRPORT  DAY,13
102,INT AIRPORT  DEPARTURE AREA  WIDE SHOT  DAY,23
103,INT CAFETERIA  ALOKA AND JOAN  DAY,34
104,EXT COMPOUND  DAY,3
105,INT RAMS HUT  DAY,43
106,EXT LEPER COLONY DAWN  DAY,3
107,INT ROOM  DAY,14
108,EXT LEPER COLONY  DAY,9
109,INT TANNERY  DAY,21
110,EXT SQUARE  DAY,13
111,EXT COURTYARD AND STORAGE SHED  CLINIC,43
112,EXT LATRINES  FOUNTAIN  ALOKA  DAY DAWN,48
113,EXT DOCKS  FROM THE GATE  DAY,4
114,EXT METRO CONSTRUCTION SITE  DAY,6
115,EXT SKELETON WAREHOUSE  EXTREME CLOSEUP  HASARIS,7
116,EXT CLINIC  COURTYARD  DAY,10
117,INT EXAMINING ROOM,30
118,EXT SHED  DAY,4
119,INT STORAGE ROOM,38
120,INT MOVIE THEATER  NIGHT,21
121,EXT STREET  NEAR CITY OF JOY  NIGHT,47
122,EXT SQUARE  NIGHT,27
123,EXT PARK STREET  FROM THE RICKSHAW  DAY,7
124,EXT MEDWAR PINE MEMORIAL HOSPITAL  NIGHT,3
125,INT HOSPITAL  CORRIDOR  SIDE ROOM  DAY,55
126,EXT HOSPTIAL  DAY DAWN,21
127,EXT CLINIC  COURTYARD  DAY,20
128,INT SHED  CLOSE ON TWO PAINTBRUSHES  NIGHT,82
129,EXT GODFATHERS HOUSE  DAY,68
130,EXT SKELETON WAREHOUSE MITRA  CO  DAY,2
131,INT MANAGERS OFFICE  DAY,22
132,EXT GODFATHERS HOUSE  DAY,93
133,INT BONSAL COURT  DAY,80
134,EXT CITY OF JOY  DAY,13
135,EXT CLINIC COURTYARD  DAY,18
136,INT CLINIC  NIGHT,40
137,INT GREEN ACRES  MAXS BATHROOM  TUB FAUCET  NIGHT,24
138,EXT CITY OF JOY  SQUARE  NIGHT,5
139,INT COURTYARD  NIGHT,10
140,EXT PARK CIRCUS  DAY,61
141,EXT WEDDING SHOP  DAY,13
142,EXT CLINIC  GUTTERS  NIGHT,3
143,INT CLINIC COURTYARD,6
144,INT CLINIC ROOM,5
145,EXT CIRCULAR ROAD  FISTFUL OF RUPEES RUNNING MONTAGE,28
146,INT LEPER COLONY  MEETAS ROOM  DAY,44
147,INT POST OFFICE  DAY,11
148,INT SUBASHS HOUSE  NIGHT,9
149,INT ROOM  NIGHT,50
150,EXT STREETS  DAY,8
151,EXT CLINIC  DAY,69
152,EXT MUD BANK  WIDE SHOT  DAY,14
153,EXT LEPER COLONY  DAY,13
154,EXT LEPER COLONY  PAIR MUDDY PARTIAL HANDS  SAME,27
155,EXT MUD BANK  DAY,48
156,INT CLASSROOM  NIGHT,10
157,INT CLINIC  MAXS ROOM  NIGHT,43
158,EXT RAMS HUT  TWO MONTHS LATER  DAY,5
159,INT PALS ROOM  DAY,34
160,INT ST PIUS SCHOOL  HEADMISTRESSES OFFICE  DAY,24
161,EXT NARROW LANE  NEAR CITY OF JOY  DAY,143
162,EXT MAXS ROOM  UPSTAIRS BALCONY  NIGHT,12
163,INT MAXS ROOM  NIGHT SEVERAL HOURS LATER,66
164,INT RAMS HUT  HASARIS FACE  DAY,60
165,INT PALS ROOM  FLOWER,20
166,EXT SQUARE  DAY  EARLY EVENING,7
