1,INT HOSPITAL ROOM NEW ORLEANS  MORNING PRESENT,129
2,EXT THE NEW TRAIN STATION NEW ORLEANS  DAY ,10
3,INT CLOCKMAKERS SHOP NEW ORLEANS  NIGHT ,9
4,INT THE HOSPITAL ROOM NEW ORLEANS  MORNING PRESENT,5
5,INT CLOCKMAKERS SHOP NEW ORLEANS  MORNING PRESENT,20
6,INT CLOCKMAKERS SHOP NEW ORLEANS  NIGHT ,9
7,EXT OLD TRAIN STATION NEW ORLEANS  DAY ,11
8,INT WORKSHOP BELOW THE CLOCKMAKERS HOME  NIGHT ,38
9,EXT OLD TRAIN STATION NEW ORLEANS  DAY ,9
10,EXT NEW ORLEANS CEMETERY  DAY ,8
11,INT THE CLOCK WORKSHOP NEW ORLEANS  LATE NIGHT ,9
12,INT THE NEW TRAIN STATION NEW ORLEANS  DAY ,30
13,EXT BATTLEFIELD  DAY ,12
14,INT THE NEW TRAIN STATION NEW ORLEANS  DAY ,7
15,EXT OLD TRAIN STATION NEW ORLEANS  DAY ANOTHER TIME,7
16,INT TRAIN STATION NEW ORLEANS  DAY ,14
17,EXT THE MISSISSIPPI RIVER  AT THE END OF A DAY,4
18,INT HOSPITAL ROOM NEW ORLEANS  MORNING PRESENT,107
19,EXT NEW ORLEANS  NIGHT ,23
20,INT BUTTON HOUSE NEW ORLEANS  NIGHT ,6
21,INT MASTER BEDROOM BUTTON HOUSE  NIGHT ,66
22,EXT NEW ORLEANS  NIGHT ,5
23,EXT A BRIDGE NEW ORLEANS  NIGHT ,20
24,EXT NEW ORLEANS GARDEN DISTRICT  NIGHT ,6
25,EXT THE BACK OF AN OLD NEW ORLEANS HOUSE  NIGHT ,131
26,INT THE NOLAN HOUSE NEW ORLEANS  NIGHT ,21
27,INT QUEENIES ROOM OLD HOUSE NEW ORLEANS  NIGHT ,61
28,INT PARLOR NOLAN HOUSE NEW ORLEANS  NIGHT ,9
29,INT QUEENIES ROOM  THAT NIGHT ,57
30,INT PARLOR NOLAN HOUSE  THAT NIGHT ,48
31,INT QUEENIES ROOM  STILL LATER THAT NIGHT ,36
32,INT THE HOSPITAL ROOM NEW ORLEANS  DAY PRESENT,23
33,INT NEW TRAIN STATION NEW ORLEANS  ANOTHER DAY ,6
34,INT THE NOLAN HOUSE  DINING ROOM NEW ORLEANS ,40
35,EXT THE PORCH NOLAN HOUSE NEW ORLEANS  NIGHT ,26
36,INT QUEENIES ROOM  NIGHT ,36
37,INT THE PARLOR NOLAN HOUSE LATE AT NIGHT ,25
38,EXT THE FRONT LAWN NOLAN HOUSE  MORNING ,12
39,INT MRS WAGNERS ROOM NOLAN HOUSE  MORNING ,15
40,INT THE KITCHEN NOLAN HOUSE  MORNING ,47
41,INT KITCHEN NOLAN HOUSE  NIGHT ,51
42,INT CHURCH TENT NEW ORLEANS  A SATURDAY NIGHT ,126
43,INT THE PARLOR ROOM NOLAN HOUSE  ANOTHER DAY ,21
44,EXT NOLAN HOUSE ANOTHER MORNING ,9
45,EXT AN OLD NEW ORLEANS CEMETERY  DAY ,11
46,EXT THE FRONT PORCH THE NOLAN HOUSE  DUSK ,19
47,INT THE NOLAN HOUSE KITCHEN  ANOTHER DAY ,43
48,INT THE PARLOR NOLAN HOUSE  ANOTHER TIME ,32
49,INT DINING ROOM NOLAN HOUSE  ANOTHER DAY ,42
50,EXT STREET OUTSIDE NOLAN HOUSE NEW ORLEANS  DAY ,21
51,INT THE STREETCAR NEW ORLEANS  DAY ,36
52,INT OR EXT THE STREETCAR NEW ORLEANS  DAY,8
53,EXT THE PERISTYLE NEW ORLEANS  PARK  END OF DAY ,42
54,EXT BOURBON STREET CORNER NEW ORLEANS  DUSK ,39
55,EXT NOLAN HOUSE NEW ORLEANS  LATE NIGHT ,9
56,INT KITCHEN QUEENIES SINK NOLAN HOUSE  NIGHT,16
57,INT HOSPITAL ROOM NEW ORLEANS  MORNING PRESENT,41
58,EXT THE LAWN THE NOLAN HOUSE  DAY ,108
59,INT DINING ROOM NOLAN HOUSE  THANKSGIVING ,58
60,INT PARLOR NOLAN HOUSE  NIGHT LATER ,70
61,INT A ROOM NOLAN HOUSE  LATE AT NIGHT ,15
62,INT BACK STAIRWELL NOLAN HOUSE  LATE NIGHT ,126
63,INT BEDROOM NOLAN HOUSE  LATE NIGHT ,22
64,INT THE HOSPITAL ROOM NEW ORLEANS  DAY PRESENT,30
65,INT THE KITCHEN NOLAN HOUSE  NIGHT ,9
66,INT ATTIC NOLAN HOUSE  NIGHT ,46
67,INT FRONT ROOM NOLAN HOUSE  ANOTHER DAY ,57
68,INT THE OLDER WOMANS ROOM NOLAN HOUSE  DAY ,12
69,INT NOLAN HOUSE PARLOR  VISITING DAY ,9
70,INT PARLOR NOLAN HOUSE  ANOTHER NIGHT ,22
71,INT A BATHROOM NOLAN HOUSE  NIGHT ,23
72,INT HOSPITAL ROOM NEW ORLEANS  DAY PRESENT,75
73,EXT THE MISSISSIPPI RIVER  DAY ,61
74,EXT TUGBOAT MISSISSIPPI RIVER NEW ORLEANS  DAY ,38
75,INT TUGBOAT WHEELHOUSE  END OF ANOTHER DAY ,66
76,INT A CLUB THE FRENCH QUARTER  NIGHT ,102
77,INT WHORE HOUSE THE QUARTER NEW ORLEANS  NIGHT ,24
78,INT A ROOM WHORE HOUSE FRENCH QUARTER  NIGHT ,13
79,INT THE ROOM WHORE HOUSE FRENCH QUARTER  NIGHT ,39
80,INT THE ROOM WHORE HOUSE FRENCH QUARTER  NIGHT ,11
81,INT PARLOR WHORE HOUSE THE QUARTER  LATER STILL ,32
82,EXT STREET FRENCH QUARTER  LATE AT NIGHT ,13
83,INT THOMAS CAR NEW ORLEANS  LATE AT NIGHT ,22
84,INT BAR FRENCH QUARTER  LATE AT NIGHT ,72
85,INT THE BAR  FRENCH QUARTER  LATER THAT NIGHT ,53
86,EXT NOLAN HOUSE  LATE AT NIGHT ,28
87,INT NOLAN HOUSE  LATE NIGHT ,23
88,EXT LAWN NOLAN HOUSE  ANOTHER DAY ,8
89,INT GRANDMA FULLERS ROOM  DAWN ,17
90,EXT BEHIND THE KITCHEN  NOLAN HOUSE  DAWN ,24
91,EXT THE DOCKS MISSISSIPPI RIVER  DAYBREAK ,7
92,INT TUGBOAT MISSISSIPPI RIVER  DAYBREAK ,50
93,EXT THE TUGBOAT THE MISSISSIPPI RIVER  EARLY ,32
94,INT THE HOSPITAL ROOM NEW ORLEANS  DAY PRESENT,35
95,INT OLDER WOMANS ROOM,55
96,INT NOLAN HOUSE  ANOTHER DAY ,12
97,EXT CEMETERY PLOT NEW ORLEANS CEMETERY  DAY ,13
98,INT BENJAMINS ROOM ATTIC  NOLAN HOUSE  DAY ,16
99,INT PARLOR NOLAN HOUSE NEW ORLEANS  DAY ,15
100,EXT THE FRONT PORCH  NOLAN HOUSE  DAY ,39
101,INT THE HOSPITAL ROOM NEW ORLEANS  DAY PRESENT,57
102,EXT SOMEWHERE ON THE SEA  DAY ,13
103,EXT TUGBOAT AT SEA  DAY ,20
104,EXT DOCK SOMEWHERE  DAY ,15
105,EXT TUGBOAT AT SEA  DUSK ,14
106,EXT ATLANTIC OCEAN  DAY ,5
107,INT HOSPITAL ROOM NEW ORLEANS  DAY PRESENT,7
108,EXT HARBOR SOMEWHERE  NIGHTFALL ,9
109,EXT NEW YORK SKYLINE  DAY ,4
110,INT LANDMARK BUILDING DANCE LOFT NEW YORK  DAY ,17
111,INT HOSPITAL ROOM NEW ORLEANS  DAY PRESENT,9
112,INT LANDMARK BUILDING DANCE LOFT NEW YORK NIGHT  ,10
113,INT HOSPITAL ROOM NEW ORLEANS  DAY PRESENT,38
114,EXT MURMANSK HARBOR RUSSIA  DAY ,37
115,EXT MURMANSK STREET RUSSIA  NIGHT ,6
116,INT WINTER PALACE RUSSIA  NIGHT ,57
117,INT LOBBY WINTER PALACE RUSSIA  NIGHT ,51
118,EXT MURMANSK HARBOR RUSSIA  DAY ,7
119,INT BENJAMINS ROOM  WINTER PALACE  NIGHT ,18
120,INT WINTER PALACE RUSSIA  LATE NIGHT ,139
121,INT KITCHEN WINTER PALACE RUSSIA  DAYBREAK ,16
122,INT LOBBY WINTER PALACE RUSSIA  DEAD OF NIGHT  ,5
123,INT KITCHEN WINTER PALACE RUSSIA  BEFORE DAWN  ,32
124,INT VARIOUS BEDROOMS  DEAD OF NIGHT ,13
125,INT KITCHEN  WINTER PALACE  RUSSIA  DAYBREAK ,38
126,INT DINING ROOM WINTER PALACE RUSSIA  NIGHT ,41
127,INT THE HOSPITAL ROOM NEW ORLEANS  DAY PRESENT,26
128,INT WINTER PALACE RUSSIA  ANOTHER LATE NIGHT ,58
129,EXT THE ENGLISH CHANNEL  DAY ,27
130,EXT CALAIS BEACH  NIGHT ,10
131,INT DINING ROOM  WINTER PALACE  LATE NIGHT ,25
132,INT WINTER PALACE RUSSIA  ANOTHER LATE NIGHT ,25
133,EXT MURMANSK RUSSIA  DEAD OF NIGHT ,60
134,INT LOBBY WINTER PALACE RUSSIA  LATE NIGHT ,8
135,INT ELEVATOR WINTER PALACE RUSSIA  LATE NIGHT  ,4
136,INT HALLWAY WINTER PALACE RUSSIA  LATE NIGHT ,10
137,INT WINTER PALACE RUSSIA  ANOTHER DAY ,11
138,INT ELEVATOR WINTER PALACE RUSSIA  LATE DAY ,9
139,INT HALL WINTER PALACE RUSSIA  NIGHT TO DAWN ,25
140,INT WINTER PALACE RUSSIA  ANOTHER NIGHT ,9
141,INT LOBBY WINTER PALACE RUSSIA  EARLY MORNING  ,65
142,INT BENJAMINS ROOM WINTER PALACE LATER ,13
143,EXT TUGBOAT ATLANTIC OCEAN SOMEWHERE  NIGHT ,59
144,INT THE TUGBOAT KITCHEN  DAY ,14
145,INT THE GALLEY  TUGBOAT  NIGHT,15
146,EXT TUGBOAT ATLANTIC OCEAN  ANOTHER NIGHT ,13
147,INT CREW QUARTER TUGBOAT ATLANTIC OCEAN  NIGHT ,33
148,EXT TUGBOAT ATLANTIC OCEAN  NIGHT ,29
149,EXT TUGBOAT  ATLANTIC OCEAN  NIGHT ,27
150,INT PILOT HOUSE TUGBOAT ATLANTIC OCEAN  NIGHT ,5
151,EXT TUGBOAT ATLANTIC OCEAN  NIGHT ,53
152,EXT TUGBOAT ATLANTIC OCEAN  LATE AFTERNOON ,6
153,EXT A LIBERTY SHIP THE NORTH ATLANTIC  DUSK ,60
154,EXT THE NOLAN HOUSE NEW ORLEANS  TWILIGHT ,16
155,INT THE NOLAN HOUSE NEW ORLEANS  TWILIGHT ,90
156,EXT PORCH NOLAN HOUSE  EVENING ,5
157,INT PARLOR NOLAN HOUSE  NIGHT LATER ,16
158,INT THE PARLOR NOLAN HOUSE  NIGHT ,32
159,INT THE NOLAN HOUSE  EARLY ONE EVENING ,77
160,INT HOSPITAL ROOM NEW ORLEANS  MORNING PRESENT,16
161,INT BACK STAIRS NOLAN HOUSE  TWILIGHT ,17
162,INT GRANDMA FULLERS ROOM  TWILIGHT ,74
163,EXT A NEW ORLEANS STREET  NIGHT,31
164,INT NEW ORLEANS RESTAURANT  NIGHT ,71
165,EXT A NEW ORLEANS PARK  NIGHT,99
166,INT HOSPITAL ROOM NEW ORLEANS  MORNING PRESENT,44
167,INT BENJAMINS ROOM NOLAN HOUSE  NIGHT ,50
168,INT DELMONICOS STEAK HOUSE NEW ORLEANS  NIGHT ,69
169,EXT BUTTON FACTORY NEW ORLEANS  NIGHT ,6
170,INT BUTTON FACTORY NEW ORLEANS  NIGHT ,14
171,INT WORK FLOOR BUTTON FACTORY  NEW ORLEANS  NIGHT,67
172,INT THE BUTTON HOUSE THE GARDEN DISTRICT  NIGHT ,86
173,INT QUEENIES ROOM  NIGHT ,34
174,INT THE NOLAN HOUSE  BACK STAIRS HALLWAY  NIGHT,39
175,EXT THOMAS BUTTONS HOUSE  MIDDLE OF THE NIGHT,5
176,INT THOMAS BUTTONS HOUSE  MIDDLE OF THE NIGHT,12
177,EXT THOMAS BUTTONS HOUSE  MIDDLE OF THE NIGHT,5
178,EXT LAKE PONTCHARTRAIN LOUISIANA  SUNRISE,5
179,EXT THE BUTTON SUMMER HOME LAKE PONTCHARTRAIN  SUNRISE ,35
180,EXT AN OLD CEMETERY NEW ORLEANS  DAY ,35
181,INT BUTTON FACTORY NEW ORLEANS  DAY ,66
182,EXT NEW YORK CITY  NIGHT ,7
183,INT THE MAJESTIC THEATER NYC  NIGHT ,10
184,INT BACKSTAGE THE MAJESTIC THEATER  NYC  NIGHT ,64
185,INT A NEW YORK LOFT  NIGHT ,49
186,INT HOSPITAL ROOM NEW ORLEANS  MORNING PRESENT,8
187,EXT NEW YORK STREET  NIGHT ,46
188,INT HOSPITAL ROOM NEW ORLEANS  MORNING PRESENT,8
189,EXT THE MANHATTAN STREET  NIGHT ,26
190,INT HOSPITAL ROOM NEW ORLEANS  MORNING PRESENT,34
191,EXT MOSCOW STREET  NIGHT ,9
192,INT MOSCOW APARTMENT  NIGHT ,9
193,INT BENJAMINS ROOM NOLAN HOUSE  NIGHT ,10
194,INT THE HOSPITAL ROOM NEW ORLEANS  DAY THE PRESENT,7
195,EXT THE BAYOU LOUISIANA  DAY,16
196,EXT THE NOLAN HOUSE  AN EARLY EVENING ,20
197,EXT A STREET IN PARIS FRANCE  DAY ,6
198,INT A HOSPITAL PARIS FRANCE  DAY ,212
199,INT A HOSPITAL ROOM PARIS FRANCE  DAY ,102
200,INT THE HOSPITAL ROOM NEW ORLEANS  DAY PRESENT,17
201,EXT PARIS  DAY,4
202,INT THE HOSPITAL ROOM NEW ORLEANS  DAY PRESENT,6
203,EXT PARIS  DAY,4
204,INT THE HOSPITAL ROOM NEW ORLEANS  DAY PRESENT,61
205,INT THE TRAIN STATION NEW ORLEANS DAY ,6
206,EXT LAKE PONTCHARTRAIN LOUISIANA  ANOTHER DAY ,17
207,EXT A NEW ORLEANS RESTAURANT  NIGHT,6
208,EXT A NEW ORLEANS HOUSE  DAYBREAK,5
209,INT BENJAMINS ROOM NOLAN HOUSE  EARLY ANOTHER,20
210,EXT THE STREET BY NOLAN HOUSE  END OF THE DAY ,6
211,EXT THE NOLAN HOUSE  END OF THE DAY ,31
212,INT THE KITCHEN NOLAN HOUSE  THAT NIGHT ,43
213,INT BACK STAIRWAY  NOLAN HOUSE  THAT NIGHT ,5
214,INT HALLWAY NOLAN HOUSE  RD FLOOR  THAT NIGHT ,6
215,INT THE BEDROOM NOLAN HOUSE  THAT NIGHT ,55
216,EXT THE FLORIDA GULF COAST  ANOTHER DAY ,7
217,EXT THE FLORIDA COAST A COVE  DAY ,15
218,EXT THE CARIBBEAN ANOTHER COVE  DAY ,4
219,EXT THE CARIBBEAN ANOTHER COVE  NIGHT,5
220,EXT THE CARIBBEAN ANOTHER COVE  NIGHT ,6
221,EXT THE BOAT  CARIBBEAN ,6
222,EXT THE CARIBBEAN AN ISLAND BEACH  DAY ,4
223,EXT THE CARIBBEAN  ANOTHER DAY ,14
224,INT A CARIBBEAN HOTEL BAR  DAY ,60
225,INT HOTEL ROOM THE CARIBBEAN HOTEL  NIGHT ,70
226,INT HOTEL ROOM CARIBBEAN HOTEL  LATER THAT NIGHT  ,13
227,INT HOSPITAL ROOM NEW ORLEANS  DAY THE PRESENT,26
228,INT HOTEL ROOM CARIBBEAN HOTEL  MIDDLE OF NIGHT ,28
229,EXT THE NOLAN HOUSE NEW ORLEANS  ANOTHER DAY ,7
230,INT THE NOLAN HOUSE NEW ORLEANS  ANOTHER DAY ,26
231,INT A BLACK BAPTIST CHURCH NEW ORLEANS  DAY ,11
232,EXT AN OLD NEW ORLEANS CEMETERY  DAY ,18
233,EXT THE BUTTON HOUSE GARDEN DISTRICT  DAY ,6
234,INT THE BUTTON HOUSE  ANOTHER DAY ,39
235,EXT A SUBURBAN TOWNHOUSE NEW ORLEANS  DAY ,6
236,INT HOSPITAL ROOM NEW ORLEANS  DAY PRESENT,19
237,INT THE SUBURBAN TOWNHOUSE NEW ORLEANS  DAY ,7
238,INT BEDROOM SUBURBAN TOWNHOUSE NEW ORLEANS DAY ,17
239,INT PORCH SUBURBAN TOWNHOUSE NEW ORLEANS  DAY ,9
240,INT A PUBLIC SWIMMING POOL YWCA  DAY ,33
241,EXT LAKE PONTCHARTRAIN LOUISIANA  DAYBREAK ,5
242,EXT THE DOCK AT THE LAKE  DAYBREAK ,15
243,INT THE HOSPITAL ROOM NEW ORLEANS  DAY THE PRESENT,41
244,INT A DANCE STUDIO NEW ORLEANS  DAY ,16
245,INT DANCE STUDIO NEW ORLEANS  NIGHT ,50
246,INT HOSPITAL ROOM NEW ORLEANS  MORNING PRESENT,41
247,INT A NEW ORLEANS STREET CAR  DAY ,10
248,EXT A NEW ORLEANS DINER  LATE AT NIGHT ,5
249,INT SAME NEW ORLEANS DINER  LATE AT NIGHT ,78
250,INT THEIR BEDROOM SUBURBAN TOWNHOUSE  MORNING ,25
251,INT THEIR BEDROOM  SUBURBAN TOWNHOUSE  DAY ,8
252,INT THEIR BEDROOM  SUBURBAN TOWNHOUSE  DAY ,19
253,INT HOSPITAL ROOM NEW ORLEANS  MORNING PRESENT,32
254,INT HOSPITAL CORRIDOR NEW ORLEANS  DAY PRESENT,12
255,INT HOSPITAL ROOM NEW ORLEANS  DAY THE PRESENT,22
256,INT THEIR BEDROOM SUBURBAN TOWNHOUSE NEW ORLEANS ,15
257,EXT A PARK  NEW ORLEANS  DAY ,54
258,INT SUBURBAN TOWNHOUSE  NEW ORLEANS  DAY ,14
259,INT THE HOSPITAL ROOM NEW ORLEANS  DAY  PRESENT,6
260,INT SUBURBAN TOWNHOUSE  LATER IN THE DAY ,9
261,INT THEIR BEDROOM  SUBURBAN TOWNHOUSE  LATE AT NIGHT,34
262,EXT SUBURBAN TOWNHOUSE NEW ORLEANS  NIGHT ,10
263,INT SUBURBAN TOWNHOUSE NEW ORLEANS  LATE AT NIGHT,8
264,INT HOSPITAL ROOM NEW ORLEANS  MORNING PRESENT,88
265,INT THE HOSPITAL ROOM NEW ORLEANS  DAY PRESENT,25
266,INT THE DANCE STUDIO NEW ORLEANS  ANOTHER NIGHT ,172
267,EXT A STREET NEW ORLEANS  NIGHT ,8
268,INT HOSPITAL ROOM NEW ORLEANS  MORNING PRESENT,30
269,INT BENJAMINS HOTEL ROOM NEW ORLEANS  NIGHT ,56
270,INT BENJAMINS HOTEL ROOM NEW ORLEANS  NIGHT ,21
271,INT HOSPITAL ROOM NEW ORLEANS  MORNING PRESENT,20
272,INT DAISYS HOUSE NEW ORLEANS  LATE DAY ,13
273,INT A TAXI NEW ORLEANS  LATE DAY ,8
274,EXT NOLAN HOUSE  LATE  DAY ,9
275,INT NOLAN HOUSE  LATE DAY ,47
276,INT PARLOR NOLAN HOUSE  DAY ,57
277,INT HOSPITAL ROOM NEW ORLEANS  MORNING PRESENT,6
278,INT THE KITCHEN NOLAN HOUSE  MORNING ,54
279,INT BENJAMINS ROOM NOLAN HOUSE  DAY,23
280,EXT NOLAN HOUSE  DAY ,48
281,INT HOSPITAL ROOM NEW ORLEANS  MORNING PRESENT,6
282,EXT NOLAN HOUSE  DAY ,22
283,INT BENJAMINS ROOM NOLAN HOUSE  DAY ,8
284,INT BENJAMINS ROOM NOLAN HOUSE  NIGHT ,13
285,EXT NOLAN HOUSE  ANOTHER DAY THE FALL ,8
286,INT NOLAN HOUSE  ANOTHER DAY ,21
287,INT PARLOR NOLAN HOUSE  ANOTHER DAY FALL ,7
288,EXT PORCH NOLAN HOUSE  LATE DAY ,8
289,INT TRAIN STATION NEW ORLEANS  DAY ,8
290,INT HOSPITAL ROOM NEW ORLEANS  MORNING PRESENT,7
291,INT BENJAMIN AND DAISYS ROOM NOLAN HOUSE  DAY ,42
292,INT HOSPITAL ROOM NEW ORLEANS  MORNING PRESENT,20
293,INT A TRAIN SOMEWHERE IN INDIA  LATE AT NIGHT,31
294,EXT SOMEWHERE,7
295,EXT RIVER,7
296,INT THE PARLOR,6
297,EXT TUGBOAT,12
298,EXT ENGLISH CHANNEL,6
299,INT BUTTON FACTORY NEW ORLEANS,7
300,INT KITCHEN NOLAN HOUSE NEW ORLEANS,6
301,INT NOLAN HOUSE NEW ORLEANS,6
302,INT DANCE STUDIO,4
303,INT HOSPITAL ROOM NEW ORLEANS  MORNING PRESENT,36
304,INT TRAIN STATION NEW ORLEANS  DAY PRESENT,7
