1,EXT THE OCEAN  DAY,28
2,EXT HONOLULU  DAY,17
3,INT HOSPITAL ROOM  DAY,35
4,INT NEUROLOGISTS OFFICE  DAY,15
5,INT HOSPITAL ROOM  DAY,32
6,INT ELEMENTARY SCHOOL CLASSROOM  DAY,90
7,EXT ELEMENTARY SCHOOL  DAY,47
8,INT HOSPITAL ROOM  DAY,119
9,INT HOSPITAL HALLWAY  DAY,48
10,INT HOSPITAL GIFT SHOP  DAY,45
11,INT HOSPITAL STAIRWAY  DAY,17
12,INT HOSPITAL HALLWAY  DAY,4
13,INT HOSPITAL ROOM  CONTINUOUS,48
14,EXT BRIEF MONTAGE  DAY,5
15,EXT KING HOUSE  DAY,24
16,INT KING HOUSE  DAY,70
17,INT MATTS CAR  DAY,60
18,EXT LANIS HOUSE  KAIMUKI  LATE AFTERNOON,31
19,EXT LANIS FRONT PORCH  LATE AFTERNOON,6
20,INT LANIS HOUSE  CONTINUOUS,85
21,EXT LANIS HOUSE  DUSK,49
22,INT MATTS STUDY  NIGHT,32
23,EXT DOWNTOWN HONOLULU  DAY,9
24,INT MATTS LAW OFFICE  DAY,19
25,INT LAW OFFICE CONFERENCE ROOM  DAY,49
26,EXT QUEENSS HOSPITAL  DAY,5
27,INT FAMILY CONSULTATION ROOM  DAY,67
28,INT HOSPITAL HALLWAY  DAY,5
29,INT HOSPITAL ROOM  CONTINUOUS,50
30,EXT KALAKAUA AVENUE  DAY,5
31,EXT OCEAN OUTRIGGER BEACH  DAY,13
32,EXT OCEAN OUTRIGGER RESTAURANT  DAY,122
33,EXT OCEAN OUTRIGGER POOL  CONTINUOUS,31
34,EXT OUTRIGGER RESTAURANT  DAY,5
35,EXT AIRPORT  DAY,12
36,INT AIRPLANE  DAY,13
37,EXT KINGS HIGHWAY BIG ISLAND  DUSK,5
38,INT RENTAL CAR  DUSK,4
39,EXT HAWAII PREPARATORY ACADEMY  NIGHT,5
40,INT DORM SUPERVISORS ROOM HALLWAY  NIGHT,36
41,INT DORM HALLWAY  NIGHT,38
42,EXT SOCCER FIELD  NIGHT,67
43,EXT KING HOUSE  NIGHT,8
44,INT KING HOUSE  NIGHT,6
45,INT ALEXANDRAS ROOM  CONTINUOUS,6
46,INT KING KITCHEN  DAY,90
47,EXT KING SWIMMING POOL  DAY,127
48,INT LIVING ROOM  DAY,117
49,EXT KING HOUSE  DAY,5
50,EXT NUUANU NEIGHBORHOOD  DAY,4
51,EXT THE MITCHELLS HOUSE  DAY,5
52,INT THE MITCHELLS HOUSE  CONTINUOUS,182
53,EXT THE MITCHELLS HOUSE  DAY,9
54,EXT NUUANU NEIGHBORHOOD  DAY,5
55,EXT KING SWIMMING POOL  DAY,52
56,EXT KING HOUSE  DAY,18
57,EXT MONTAGE  TBD,3
58,EXT THORSON HOUSE  DAY,167
59,INT MATTS CAR  DAY,90
60,EXT DIAMOND HEAD ROAD  DAY,25
61,EXT KAHALA  DAY,30
62,EXT BRIAN SPEERS BLOCK  KAHALA  DAY,107
63,EXT NEARBY STREET  KAHALA  DAY,45
64,EXT BRIEF MONTAGE,11
65,INT MATT AND LIZS BEDROOM  NIGHT,49
66,INT MATTS BEDROOM  NIGHT,20
67,INT HOSPITAL HALLWAY  DAY,7
68,INT HOSPITAL ROOM  DAY,320
69,EXT KING HOUSE  DAY,4
70,INTEXT KING HOUSE  DAY,11
71,INT KING KITCHEN  DAY,34
72,INT KING LIVING ROOM  DAY,41
73,EXT KING HOUSE DRIVEWAY  DUSK OR NIGHT,10
74,INT MATTS STUDY  NIGHT,55
75,EXT AIRPORT  DAY,4
76,INT AIRPLANE  DAY,13
77,EXT KAUAI AIRPORT  DAY,73
78,EXT COUSIN RALPHS JEEP  DAY,23
79,EXT TURNOFF POINT  DAY,4
80,EXT COUNTRY ROAD  DAY,10
81,EXT BUMPY ACCESS ROAD  DAY,4
82,EXT LOOKOUT POINT  DAY,109
83,EXT COUSIN RALPHS JEEP  DAY,6
84,EXT PRINCEVILLE  DAY,8
85,EXT ST REGIS HOTEL FRONT DOORS  DAY,4
86,INT ST REGIS HOTEL LOBBY  DAY,29
87,INT HOTEL SUITE  DAY,13
88,EXT HOTEL SUITE LANAI  DAY,104
89,EXT ST REGIS BEACH  DAY,64
90,EXT HANALEI BAY  PINE TREES  DAY,52
91,EXT HANALEI BAY FOREST AREA  LATE AFTERNOON,45
92,EXT ST REGIS HOTEL BEACH AREA  LATE AFTERNOON,31
93,INT HOTEL SUITE SITTING ROOM  NIGHT,72
94,INT HOTEL SUITE BEDROOM  NIGHT,7
95,INT HOTEL SUITE SITTING ROOM  CONTINUOUS,146
96,EXT HANALEI BAY  DAWN,32
97,EXT HANALEI BEACH COTTAGE  CONTINUOUS,16
98,EXT HANALEI BAY  DAY,157
99,EXT HANALEI TOWN  DUSK,8
100,INT TAHITI NUI RESTAURANT  DUSK,199
101,EXT THE ROAD BY THE BAY  SUNSET,76
102,EXT HANALEI BAY COTTAGE  NIGHT,227
103,INT HANALEI BAY COTTAGE  NIGHT,123
104,EXT HANALEI BAY COTTAGE  NIGHT,29
105,INT AIRPLANE  NIGHT,41
106,INT HOSPICE HALLWAY  DAY,6
107,INT HOSPICE ROOM  CONTINUOUS,178
108,INT HOSPICE ROOM  THE NEXT DAY,124
109,INT HOSPICE HALLWAY  CONTINUOUS,35
110,INT KING HOUSE  MATTS STUDY  NIGHT,8
111,EXT HIGHWAY OUTSIDE KING FAMILY SHARED PROPERTY  DAY,4
112,INT KING FAMILY SHARED PROPERTY HOUSE  DAY,5
113,EXT KING FAMILY SHARED PROPERTY  DAY,6
114,EXT KING FAMILY SHARED PROPERTY HOUSE  DAY,7
115,EXT KING FAMILY SHARED PROPERTY HOUSE  LATER,166
116,INT HOSPITAL ROOM  DAY,153
117,INT HOSPICE HALLWAY  DAY,13
118,EXT MONTAGE  DAY,9
119,EXT THE OCEAN  DAY,145
