1,EXT A DITCH  NIGHT,53
2,INT A DARK PLACE  DAY NIGHT,20
3,INT UNIDENTIFIABLE ROOM  DAY,21
4,INT SUPERMARKET  DAY,50
5,INT SUPERMARKET AISLE  DAY,11
6,INT SUPERMARKET STOCKROOM  DAY,53
7,EXT BEHIND THE STORE  CONTINUOUS,66
8,INT SUPERMARKET  DAY,16
9,INT BEHIND THE REFRIGERATOR CASE  DAY CONTINUOUS,120
10,INT SUPERMARKET  CHECKOUT LANE  DAY,115
11,INT MANNIES CAR  PARKING LOT  NIGHT,69
12,EXT DOORSTEP  NIGHT,22
13,INT HALLWAY  NIGHT,7
14,INT APARTMENT  LIVING ROOM  NIGHT,174
15,EXT THE BEAST  NIGHT,8
16,EXT DOORSTEP  NIGHT,47
17,INT MANNIES CAR  NIGHT,34
18,INT VENICE HOUSE  MAIN ROOM  NIGHT,105
19,INT BATHROOM  NIGHT,11
20,INT HALLWAY  NIGHT,4
21,INT BATHROOM  NIGHT,7
22,INT HALLWAY  NIGHT,5
23,INT BATHROOM  NIGHT,19
24,INT HALLWAY  NIGHT,5
25,INT BATHROOM  NIGHT,5
26,INT HALLWAY  NIGHT,11
27,INT MAIN ROOM  NIGHT,49
28,INT HALLWAY  NIGHT NORMAL,18
29,EXTINT THE BEAST ON STREET  NIGHT,59
30,INT SUPERMARKET  NIGHT,10
31,INT AT THE MANAGERS COUNTER  NIGHT,15
32,INT AT CHECKSTAND  NIGHT,4
33,INT AN AISLE  NIGHT,4
34,INT DRUG AISLE  NIGHT,14
35,INT END OF ANOTHER AISLE  NIGHT,10
36,INT FRONT OF THE STORE  NIGHT,31
37,INT THE BEAST  DRIVING  NIGHT,37
38,INT GAINES APARTMENT  NIGHT,117
39,EXT DOWNSTAIRS DOORWAY  NIGHT,9
40,INT GAINES APARTMENT  NIGHT,64
41,EXT FIELD PARKING LOT  NIGHT,5
42,INT THE BEAST  NIGHT,38
43,EXT FIELD  PARKING LOT  NIGHT,9
44,EXT AT THE MINIVAN  NIGHT,11
45,INT THE MINIVAN  NIGHT,37
46,EXT LINE OUTSIDE A WAREHOUSE  NIGHT,27
47,INT GAINES APARTMENT  NIGHT,27
48,INT WAREHOUSE  MARY XMAS SUPAFEST  NIGHT,16
49,EXT WAREHOUSE  NIGHT,23
50,INT BY THE ENTRANCE  NIGHT,30
51,EXT WAREHOUSE ALLEY  NIGHT,17
52,EXT DIFFERENT ALLEY  NIGHT,19
53,EXT ALLEY  DUMPSTERS  NIGHT,26
54,EXT FIELD  EDGE OF PARKING LOT  NIGHT RAIN,73
55,EXT IN THE DITCH  NIGHT RAIN,42
56,INT SUPERMARKET STOREROOM  DAY,24
57,EXT ALLEY BEHIND SUPERMARKET  DAY,43
58,INT THE TRUNK  DAY NIGHT,14
59,EXT SIDE OF INTERSTATE  DAY,20
60,INT SINGHS CADILLAC  DRIVING  DAY,83
61,INT SILVER STAR CASINO RESTAURANT  NIGHT,95
62,INT HOTEL LOBBY  NIGHT,38
63,INT HOTEL ROOM  NIGHT,50
64,INT MIRRORED ELEVATOR  NIGHT,12
65,INT THE CASINO  NIGHT,31
66,INT CASINO  NIGHT,6
67,INT CASINO HALLWAY  NIGHT,5
68,INT ELEVATOR  NIGHT,27
69,INT THE BECKYS HOTEL ROOM  NIGHT,28
70,INT HOTEL ROOM  LATER,40
71,INT HALLWAY  ELEVATOR BAY  NIGHT,6
72,INT CASINO MENS ROOM  NIGHT,19
73,INT BY THE ELEVATORS  NIGHT,9
74,EXT HOTEL ENTRANCE  NIGHT,14
75,INT THE FERRARI  DRIVING ON FREEWAY  NIGHT,28
76,INT FERRARI  DRIVING DOWNTOWN  LATER,59
77,EXT ELEVEN  NIGHT,43
78,INT HOTEL ROOM  NIGHT,32
79,INT THE OTHER ROOM  NIGHT,17
80,EXT PARKING LOT  CRAZY HORSE  NIGHT,34
81,INT THE CRAZY HORSE  NIGHT,24
82,INT SHORT HALLWAY  NIGHT,37
83,INT PRIVATE ROOM  NIGHT,126
84,EXT PARKING LOT  NIGHT,7
85,INT FERRARI  DRIVING  NIGHT,63
86,INT VICTORS OFFICE  NIGHT,67
87,INT HOTEL ROOM BATHROOM  NIGHT,5
88,INT HOTEL ROOM  NIGHT,28
89,INT RAM CHARGER  NIGHT,11
90,EXT THE STRIP  NIGHT,5
91,INT HOTEL LOBBY  NIGHT,8
92,INT ELEVATOR  NIGHT,32
93,INT HOTEL ROOM  NIGHT,27
94,INT HALLWAY  NIGHT,6
95,INT HOTEL ROOM  NIGHT,9
96,INT OTHER ROOM  NIGHT,27
97,INT HALLWAY  NIGHT,5
98,INT HOTEL ROOM  NIGHT,10
99,INT HALLWAY  NIGHT,4
100,INT HOTEL ROOM  NIGHT,10
101,INT ADJOINING ROOM  NIGHT,29
102,INT STAIRWELL  NIGHT,5
103,INT PARKING GARAGE  NIGHT,11
104,INT CADILLAC  PARKING GARAGE EXIT  NIGHT,22
105,B EXT PARKING RAMP  NIGHT,6
106,EXT FLAMINGO ROAD  NIGHT,5
107,A INT CADILLAC  NIGHT,45
108,EXT A SIDE STREET  NIGHT,17
109,EXT VERY NARROW ALLEY  NIGHT,42
110,INT THE CADILLAC  NIGHT,8
111,EXT ALLEYWAY  NIGHT,10
112,INT CADILLAC  NIGHT,9
113,INT RAM CHARGER  NIGHT,6
114,EXT ALLEY  NIGHT,9
115,A INT CADILLAC  NIGHT,3
116,B EXT STREET  NIGHT,5
117,C INT RAM CHARGER  NIGHT,5
118,D EXT STREET  NIGHT,6
119,INT CADILLAC  NIGHT,20
120,INT ROLLED RAM CHARGER  NIGHT,7
121,EXT STREET  NIGHT,7
122,EXT HIGHWAY  NIGHT,5
123,INT CADILLAC  DAWN,31
124,EXT STREET  CRASH SCENE  DAWN,22
125,A INT SUPERMARKET STOCKROOM  DAY,48
126,INT BATHROOM AT FALAFEL HUT  DAY,53
127,INT FALAFEL HUT  DAY,73
128,EXT BY A PAYPHONE  DAY,7
129,INT BURKES CAR  DAY,31
130,INT BURKES CAR  DRIVING  DAY,50
131,INT GROCERY STORE  DAY,33
132,INT FRONT OF THE STORE  DAY,22
133,INT CAR IN PARKING LOT  DAY,27
134,EXT STREET IN HOLLYWOOD  NIGHT,4
135,EXT FRONT OF GAINES APARTMENT  NIGHT,5
136,INT BURKES CAR  NIGHT,7
137,A INT VENICE HOUSE  MAIN ROOM  NIGHT,47
138,INT VENICE HOUSE  NIGHT,39
139,INT VENICE HOUSE  LATER,100
140,EXT A TINY HOUSE IN CULVER CITY  NIGHT,8
141,INT LIVING  DINING ROOM  NIGHT,13
142,INT KITCHEN  NIGHT,23
143,INT BEDROOM  NIGHT,66
144,INT KITCHEN  NIGHT,44
145,INT DINING ROOM  NIGHT,91
146,EXT FRONT OF BURKES HOUSE  NIGHT,9
147,INT LIQUOR STORE ON PICO  NIGHT,60
148,INT HIGH RISE APARTMENT HALLWAY  NIGHT,50
149,EXT WAREHOUSE  MARY XMAS SUPAFEST  NIGHT,47
150,INT SUPAFEST  NIGHT,26
151,EXT FIELD  NIGHT RAINING,5
152,INT MIATA  NIGHT RAINING,45
153,EXT FIELD  PARKING LOT  NIGHT RAIN,4
154,EXT  GAS  NIGHT RAIN,4
155,INT MIATA  NIGHT RAIN,36
156,EXT SIDE OF THE GAS STATION  NIGHT RAIN,8
157,EXT GAS STATION ISLAND  NIGHT RAIN,7
158,INT GAS STATION BATHROOM  NIGHT RAIN,7
159,EXT GAS STATION ISLAND  NIGHT RAIN,40
160,EXT FIELD  NIGHT RAIN,134
161,EXT PARKING LOT  NIGHT RAIN,52
162,INT JAVAMAN CAFE  HOLLYWOOD  DAY,85
163,A INT CAFE  LATER,73
164,INT STAIRWELL TO GAINES APARTMENT  DAY,33
165,A INT GAINES LIVING ROOM  DAY,150
166,INT APARTMENT  LATER,71
167,INT HALLWAY  DAY CONTINUOUS,12
168,INT HOSPITAL ROOM  DAY,13
169,A EXT SUPERMARKET  DAY,3
170,B INT SUPERMARKET BREAK ROOM  DAY,4
171,C INT SUPERMARKET AISLE  DAY,3
172,D INT SUPERMARKET  CHECKOUT LANE  DAY,69
173,EXT ALLEY  DAY,7
174,EXT A DIFFERENT ALLEY  DAY,6
175,EXT BEHIND A DUMPSTER  DAY,12
176,EXT ALLEY INTERSECTION  DAY,11
177,EXT PARKING LOT  DAY,76
178,A EXT WAREHOUSE  NIGHT,10
179,INT SIMONS APARTMENT  DAY,33
