1,INT DARKROOM  INTERVIEW ,32
2,INT SUBMARINE HALLWAY  NIGHT,18
3,INT SUBMARINE STATEROOM  NIGHT,26
4,INTEXT SCOTLAND  TUNNEL  NIGHT,14
5,EXT SCOTLAND CHAPEL REMAINS,25
6,EXT DITCH,39
7,EXT AMONG THE RUINS  NIGHT,10
8,EXT NEARBY  BROOM  NIGHT,13
9,EXT ABBEY RUINS  ALTAR AREA  NIGHT,6
10,EXT BEHIND THE ALTAR  NIGHT,32
11,EXT ABBEY RUINS  ALTAR AREA  CEREMONY  NIGHT,19
12,EXT THE HILLTOP  ALLIED SOLDIERS  NIGHT,5
13,EXT ABBEY RUINS  ALTAR AREA  NIGHT,28
14,EXT COSMIC SLIT  NIGHT,4
15,EXT COSMIC SLIT  FROM THE OTHER SIDE  NIGHT,7
16,EXT ABBEY RUINS  ALTAR AREA  NIGHT,4
17,EXT RUINS  IN THE UNDERBRUSH  NIGHT,7
18,EXT RUINS IN THE UNDERBRUSH  NIGHT,8
19,EXT ABBEY RUINS  ALTAR AREA  NIGHT,28
20,EXT ABBEY RUINS  ALTAR AREA  NIGHT,10
21,EXT INSIDE THE CHURCH  NIGHT,15
22,EXT INSIDE CHURCH RUINS  NIGHT,5
23,EXT INSIDE CHAPEL RUINS  NIGHT,79
24,EXT CHAPEL RUINS  NIGHT,8
25,INT DARKROOM  BACK TO INTERVIEW ,18
26,EXT INSIDE THE CHURCH  BACK TO   NIGHT,17
27,INT STUDIO TV HOST SHOW  INTERVIEW   DAY,23
28,EXT HIGH MOUNTAINS EASTERN EUROPE  DAY,4
29,EXT HIGH MOUNTAINS SET EASTERN EUROPE  DAY,14
30,INT ICE CAVE  SMALL CORRIDOR  DAY,3
31,INT ICE CAVE  MAIN NAVE  DAY,5
32,INT ICE CAVE  LABYRINTH  DAY,4
33,INT ICE CAVE  CENTRAL LABYRINTH AREA  DAY,26
34,INT DOCTORS OFFICE  DAY,10
35,INT DOCTORS OFFICE  EXAMINATION ROOM  DAY,25
36,EXT NY  MANHATTAN STREET  DAY,36
37,EXT BPRD BUILDING COMPLEX  DAY,6
38,EXT BPRD COMPLEX  GATE ENTRANCE  DAY,19
39,EXT UPHILL ROAD  THE MOPED  DAY,2
40,INT BPRD LOBBY  DAY,22
41,INTEXT OPEN ELEVATOR  ON THE WAY DOWN  DAY,3
42,INT OPEN ELEVATOR  DAY,3
43,INT BPRD  CONCRETE CHAMBER   DUSK,6
44,INT BROOMS OFFICE FULL AQUARIUM DUSK,100
45,INT BPRD  FREAK CORRIDOR A  NIGHT,65
46,INT HELLBOYS DEN  NIGHT,123
47,EXT MACHEN LIBRARY  NIGHT,19
48,INTEXT GARBAGE TRUCK  LIBRARY STREET ENTRANCE  NIGHT,2
49,EXT MACHEN LIBRARY  STREET ENTRANCE  NIGHT,4
50,INTEXT GARBAGE TRUCK LAB  LIBRARY CROWD  NIGHT,40
51,EXT COURTYARD  LOADING DOCK MACHEN LIBRARY  NIGHT,22
52,INT MACHEN LIBRARY MAIN LOBBY  NIGHT,21
53,INT MAIN CORRIDOR  MACHEN LIBRARY SET  NIGHT,40
54,INT MAGIK EXHIBITION HALL  NIGHT,29
55,INT MAIN CORRIDOR  MACHEN LIBRARY SET  NIGHT,7
56,INT MAGIK EXHIBITION HALL  NIGHT,23
57,INT MACHEN LIBRARY  MAGIK EXHIBIT HALL  NIGHT,11
58,INT MACHEN LIBRARY  EXHIBIT CORRIDOR DOORS  NIGHT,5
59,INT MACHEN LIBRARY  MAGIK EXHIBIT HALL  NIGHT,19
60,INT MACHEN LIBRARY  EXHIBIT CORRIDORS  NIGHT,5
61,INT MACHEN LIBRARY  MAGIK EXHIBIT HALL  NIGHT,4
62,EXT AN ALLEY  BEHIND MACHEN LIBRARY  NIGHT,37
63,EXT AN ALLEY  BEHIND MACHEN LIBRARY  NIGHT,47
64,EXT ALLEY,5
65,EXT LOADING ALLEY  NIGHT,36
66,EXT WEST SIDE STREET  NIGHT,21
67,EXT ALLEY  NIGHT,5
68,EXTINT STUNT TRACKS TUNNEL  NIGHT,16
69,INT STUNT TRACKS  FRONT  CAR  NIGHT,3
70,EXTINT THE SUBWAY   TRAIN CAR SET  NIGHT,5
71,INT STUNT,3
72,INT THE SUBWAY TRACKS STUNT TRACK  NIGHT,3
73,INT STUNT TRACKS FRONT  CAR,3
74,INT UNDERCARRIAGE  STUNT TRACKS  FRONT  CAR  NIGHT,9
75,INT STUNT TRACKS FRONT  CAR,34
76,EXT WESTSIDE HIGHWAY  NIGHT,13
77,INT SUBWAY TRACKS STUNT TRACK,5
78,EXT WESTSIDE HIGHWAY  SAME,4
79,INT SUBWAY TRACKS STUNT TRACK,17
80,INT MAIN ABANDONED BATHS ALCOVE  NIGHT,30
81,EXT MACHEN LIBRARY ENTRANCE  NIGHT,3
82,INT MAGIK EXHIBIT HALL  NIGHT,71
83,INT MAGIK EXHIBIT HALL  FLASHBACK,11
84,STATUE   E O SAINT,62
85,INT MACHEN LIBRARY  NIGHT,17
86,EXT CENTRAL PARK  NIGHT,8
87,EXT BELLAMIE MENTAL HOSPITAL  NIGHT,10
88,INT BELLAMIE MENTAL CORRIDOR  NIGHT,23
89,EXT BELLAMIE MENTAL HOSPITAL  GARDEN AREA  NIGHT,24
90,EXT BELLAMIE MENTAL HOSPITAL  GARDEN AREA NIGHT,85
91,INT BPRD MEDICAL BAY A  NIGHT,61
92,INT MEDICAL BAY EXAMINATION TABLE  LATER,25
93,INT BROOMS OFFICE  NIGHT,38
94,INT BRPD ARCHIVE  CONFERENCE ROOM  NIGHT,29
95,INT BELLAMIE MENTAL HOSPITAL  CORRIDOR  NIGHT,3
96,INT HOSPITAL  LIZS ROOM MIN SECURITY WARD  NIGHT,21
97,EXT TENEMENT BUILDING COURTYARD  DAY,37
98,EXT TENEMENT COURTYARD  DAY,6
99,EXT TENEMENT COURTYARD  STEPS ,20
100,INT BELLAMIE HOSP  LIZS ROOM MIN SEC WARD  NIGHT,4
101,INT BELLAMIE MENTAL HOSPITAL  MIN SEC WARD  NIGHT,2
102,INT BELLAMIE MENTAL HOSPITAL  SECURITY ROOM  NIGHT,13
103,INT BELLAMIE MENTAL HOSPITAL  SECURITY ROOM SET NIGHT,3
104,EXT BELLAMIE MENTAL HOSPITAL MINIATURE  NIGHT,4
105,INT BPRD  FREAK CORRIDOR A  DAY,4
106,INT HELLBOYS DEN  DAY,44
107,EXT BELLAMIE MENTAL HOSPITAL  DAY,4
108,INT BELLAMIE MENTAL HOSPITAL  MAX SECURITY WING  DAY,13
109,INT BELLAMIE MENTAL HOSPITAL  PADDED CELL  DAY,46
110,INT BEAM TUNNEL AREA  BENJAMIN INSTITUTE  DAY,7
111,INT STORAGE ROOM  DAY,34
112,INT SETLOCATION BUILT SUGAR FACTORY FURNACE ROOM  DAY,15
113,INT STORAGE ROOM  DAY,9
114,INT ABANDONED SHOWER ROOM SET  DAY,9
115,INT UNDERWATER  CHAMBER SET TANK  DAY,3
116,INT UNDERWATER CHAMBER  LOCATION R WAREHOUSE CELLAR,5
117,INT ABANDONED SHOWER ROOM SET  DAY,18
118,INT UNDERWATER CHAMBER   LOCATION RWAREHOUSE  DAY,4
119,INT ABANDONED SHOWER ROOM SET  DAY,24
120,INT TUNNEL LABYRINTH SET  DAY,6
121,INT UNDERWATER CHAMBER  LOCATION R WAREHOUSE  DAY,20
122,INT ABANDONED SHOWER ROOM  DAY,3
123,INT INTERSECTION LOCATION BUILT SUGAR FACTORY  DAY,3
124,INT LOCATIONBUILT SUGAR FACTORY FURNACE ROOM  DAY,18
125,INT SERVICE SHAFT NEW LOCATION SET  DAY,3
126,INT SERVICE SHAFT  SET  SAME,4
127,INT SUBWAY PLATFORM STATION  DAY,74
128,INT SUBWAY PLATFORM  SAME,9
129,INT SUBWAY TRACKS NEXT TO STATION  SAME,8
130,INT UNDERWATER CHAMBER  LOCATION RWAREHOUSE  DAY,4
131,INT UNDERWATER CHAMBER  LOCATION RWAREHOUSE  DAY,5
132,INT ABANDONED SHOWER ROOM SET  DAY,5
133,INT SUBWAY TRACKS NEAR THE STATION  DAY,4
134,INT BEAMSUPPORTED UNDERGROUND TUNNEL STORAGE ROOM  DAY,36
135,INT ABANDONED SHOWER ROOM SET  DAY,8
136,INT CENTER OF THE TUNNEL LABYRINTH SET  DAY,12
137,INT TUNNEL LABYRINTH  CONNECTING SHOWER ROOM SET  DAY,2
138,INT CENTER OF THE TUNNEL LABYRINTH SET,10
139,INT TAXI CAB MOVING  EXT BPRD ADJACENT AVENUE  DAY,34
140,INT BPRD MEDICAL BAY  DAY,43
141,INT BPRD  MAIN HALL AREA  DAY,42
142,INT BPRD  LIZS ROOM  DAY,14
143,INT HELLBOYS DEN  DUSK,78
144,INT BDRP MEDICAL BAY  NIGHT,27
145,INT BPRD HALLWAYS  NIGHT,5
146,INT HELLBOYS DEN  NIGHT,9
147,EXT NEWARK NJ  STREETS  NIGHT,4
148,EXT BUILDING ROOFTOP  NIGHT,4
149,EXT NEWARK NJ STREETS  NIGHT,36
150,EXT ROOFTOP  NIGHT,12
151,EXT NEWARK NJ STREETS  NIGHT,15
152,EXT BUILDING ROOFTOP  FIRE ESCAPE  NIGHT,2
153,EXT BUILDING ROOFTOP  NIGHT,15
154,INT HELLBOYS DEN  NIGHT,10
155,INT BPRD MEDICAL BAY  NIGHT,9
156,EXT BUILDING ROOFTOP  NIGHT,23
157,EXT NEWARK NJ STREET  LIZ AND MYERS  NIGHT,9
158,EXT BUILDING ROOFTOP  NIGHT,3
159,INT BROOMS OFFICE  NIGHT,47
160,EXT RUINS OF NY  DUSK,9
161,INT BROOMS OFFICE  NIGHT,36
162,EXT BUILDING ROOFTOP  NIGHT,24
163,INT BPRD HALLWAY  NIGHT,3
164,INT BROOMS OFFICE  NIGHT,19
165,EXT BPRD BUILDING  DAY,12
166,INT MEDICAL BAY  DAY,23
167,INT BPRD CONFERENCE ROOM  DUSK,23
168,INT BROOMS OFFICE  DUSK,44
169,EXT MOSCOW WAREHOUSE  DAY,6
170,INT MOSCOW WAREHOUSE  DUSK,20
171,INT MOSCOW WAREHOUSE  THE CONTAINER  SAME,37
172,EXT THE NIGHT SKY MATTE SHOT  NIGHT,4
173,INT CARGO PLANE  NIGHT,37
174,EXT COUNTRYSIDE  DAY,5
175,EXTINT COUNTRYSIDE  IN THE TRUCK CAB  DAY,7
176,EXT COUNTRYSIDE  THE TRUCK BED  DAY,5
177,EXTINT COUNTRYSIDE  THE TRUCK CAB DAY,4
178,INT INSIDE THE CARGO BOX  DAY,15
179,EXT TH CENTURY CEMETERY  DAY,12
180,EXT CEMETERY  MAUSOLEUM SECTION LOCATION  DAY,14
181,EXT OPEN GRAVE  DAY,3
182,EXT OPEN GRAVE SET  DAY,10
183,EXT MOSCOW CEMETERY LOCATION  DAY,12
184,EXT CEMETERY  YEFIMOVICH MAUSOLEUM LOCATION  DAY,5
185,INT YEFIMOVICH MAUSOLEUM STAIRS  LATER  DAY,3
186,INT YEFIMOVICH MAUSOLEUM  UNDERGROUND  STAIRCASE,2
187,INT UNDERGROUND  UNDERGROUND INTERSECTION,7
188,INT UNDERGROUND CORRIDOR AND INTERSECTION  DAY,29
189,INT TUNNEL A  CHAMBER  DAY,41
190,INT STONE CORRIDOR  DAY,6
191,INT HEXAGONAL STONE LAB  DAY,4
192,INT STONE CORRIDOR  DAY,4
193,INT HEXAGONAL STONE LAB  DAY,3
194,INT STONE CORRIDOR  DAY,8
195,INT,26
196,INT HEXAGONAL TRAP DOOR PIT  DAY,12
197,INT ABOVE THE HEXAGONAL TRAP DOOR PIT  DAY,5
198,INT HEXAGONAL TRAP DOOR PIT  DAY,4
199,INT ABOVE THE HEXAGONAL TRAP DOOR PIT  DAY,2
200,INT HEXAGONAL TRAP DOOR PIT  DAY,10
201,INT ABOVE THE HEXAGONAL TRAP DOOR PIT  DAY,3
202,INT ABOVE THE HEXAGONAL TRAP DOOR PIT  DAY,8
203,INT BOTTOM OF HEXAGONAL TRAP DOOR PIT  DAY,3
204,INT ABOVE THE HEXAGONAL TRAP DOOR PIT  DAY,29
205,INT TUNNEL B  UNDERGROUND NARROW TUNNEL  DAY,20
206,INT TUNNEL C  UNDERGROUND TUNNEL  STEEP SLOPE  DAY,5
207,INT TUNNEL B  UNDERGROUND TUNNEL  CAVERN AREA  DAY,28
208,INT TUNNEL C  UNDERGROUND TUNNEL FLOOR  DAY,5
209,EXT ANTHILL VIEW OF UNDERGROUND TUNNELS AND PITS  DAY,3
210,INT TUNNEL B  UNDERGROUND TUNNEL CAVERN AREA  DAY,63
211,INT TUNNEL B  UNDERGROUND TUNNEL CAVERN AREA ,17
212,INT THE CATACOMBS  NIGHT,94
213,INT CATACOMBS  NIGHT,3
214,INT CATACOMBS  NIGHT,13
215,EXT VIEW FROM THE CITY  NIGHT,4
216,INT THE OTHER SIDE  NIGHT,3
217,INT CATACOMBS  NIGHT,5
218,EXT ON THE OTHER SIDE  NIGHT,4
219,INT CATACOMBS  NIGHT,1
220,H      SECOND IMPRINT CLACK H,3
221,INT THE SKY  NIGHT,3
222,INT CATACOMBS  NIGHT,34
223,INT CATACOMBS  NIGHT,35
224,INT CATACOMBS  ADJACENT TUNNEL  NIGHT,14
225,INT THE CATACOMBS  NIGHT,39
226,INT CATACOMBS  NIGHT,4
227,INT CATACOMBS  NIGHT,7
228,INT CATACOMBS  NIGHT,5
