1,INT TOLL BOOTH  DAWN,11
2,INT TOLL BOOTH  MOMENTS LATER,12
3,INT TOLL BOOTH  LATER,5
4,EXT BUFFALO STREET  MORNING,3
5,EXT BUFFALO STREET  MORNING,3
6,EXT HENRYS HOUSE  MORNING,3
7,INT HENRYS HOUSE  MOMENTS LATER,95
8,EXT HENRYS HOUSE  CONTINUOUS,21
9,INT HENRYS HOUSE  MOMENTS LATER,50
10,INT IMPALA  LATER,11
11,EXT MAIN ST  DAY,43
12,INT POLICE STATION INTERROGATION ROOM  NIGHT,24
13,INT BUFFALO COURTROOM  DAY,15
14,INT PRISON CELL  DAY,41
15,INT PRISON CELL  MORNING,10
16,INT DINING ROOM  DAY,39
17,INT DINING ROOM  MOMENTS LATER,22
18,EXT YARD  DAY,48
19,INT MAX AND HENRYS CELL  NIGHT,13
20,INT PRISON TIER  NIGHT,4
21,INT VISITING AREA  DAY,48
22,EXT PRISON YARD  LATER THAT DAY,22
23,INT MAX AND HENRYS CELL  DAY,102
24,INT SHOWERS  DAY,34
25,INT MAX AND HENRYS CELL  MORNING,44
26,EXT PRISON  DAY,6
27,INT GREYHOUND BUS  DAY,3
28,EXT BUFFALO STREET  DAY,2
29,EXT HENRYS HOUSE  DAY,18
30,INT HENRYS OLD HOUSE  CONTINUOUS,21
31,INT GARAGE  MINUTES LATER,70
32,EXT STREET NEAR HENRYS OLD HOUSE  MOMENTS LATER,19
33,INT APARTMENT  NIGHT,27
34,INT PAROLE OFFICE BUFFALO  DAY,18
35,EXT FIELD  DAY,8
36,INT APARTMENT  NIGHT,4
37,EXT DITCH  DAY,3
38,INT BUFFALO SIX MOVIE THEATRE  NIGHT,4
39,EXT FIELD  DUSK,6
40,INT PAROLE OFFICE  DAY,31
41,EXT MAIN ST BUFFALO  DAY,80
42,INT ORPHEUM CAFE  CONTINUOUS,76
43,INT BATHROOM  MOMENTS LATER,16
44,EXT ORPHEUM CAFE  DAY,3
45,EXT BACK ALLEY  DAY,9
46,INT HENRYS APARTMENT  DAWN,6
47,INT VISITORS AREA  DAY,117
48,EXT BUFFALO STREET  DAY,18
49,INT ORPHEUM THEATRE  DAY,9
50,INT MAIN THEATRE  CONTINUOUS,102
51,EXT ORPHEUM THEATRE  OUTSIDE,32
52,INT CAFE ORPHEUM  DAY,93
53,INT PRISON  MORNING,33
54,INT PAROLE REVIEW ROOM PRISON  DAY,29
55,EXT PRISON GATE  DAY,55
56,EXT BUS  DAY,2
57,INT BUS  DAY,12
58,INT HENRYS APARTMENT  DAY,19
59,INT HENRYS BATHROOM  LATER,9
60,EXT BUFFALO STREET  DAY,10
61,INT CAFE ORPHEUM BATHROOM  DAY,47
62,INT FIRST BUFFALO BANK  DAY,63
63,EXT ALLEY BEHIND THE ORPHEUM  A MINUTE LATER,76
64,INT THEATRE  SAME TIME,70
65,INT THEATRE BACKSTAGE DOWNSTAIRS  SAME TIME,10
66,INT GREEN ROOM  CONTINUOUS,22
67,INT THEATRE  SAME TIME,49
68,EXT DRESSING ROOM  SAME TIME,6
69,INT DRESSING ROOM  CONTINUOUS,26
70,INT STAGE  SAME TIME,74
71,EXT ALLEY  MOMENTS LATER,18
72,INT APARTMENT BATHROOM  LATER,32
73,INT GOLDEN DRAGON  RESTAURANT  NIGHT,18
74,INT RESTAURANT  LATER,30
75,INT JULIES CAR  LATER,135
76,INT JULIES APARTMENT  KITCHEN  NIGHT,93
77,INT JULIES APARTMENT  MORNING,13
78,INT HENRYS APARTMENT  MORNING,47
79,INT KITCHEN  SAME TIME,28
80,INT APARTMENT  LATER,106
81,INT ORPHEUM THEATRE  DAY,117
82,INT THEATRE BACKSTAGE  MORNING,8
83,EXT DRESSING ROOM  MORNING,2
84,INT THEATRE DRESSING ROOM  CONTINUOUS,13
85,INT THEATRE  MORNING,10
86,INT THEATRE  MORNING,59
87,EXT PARKING LOT  DAY,95
88,INT DAREKS APARTMENT  NIGHT,84
89,INT JULIES CAR  NIGHT  MOVING,15
90,INT JULIES APARTMENT  NIGHT,4
91,INT KITCHEN TABLE  LATE AT NIGHT,51
92,INT ORPHEUM THEATRE STAGE  MORNING,14
93,INT ORPHEUM THEATRE  MORNING,11
94,INT TUNNEL  LATER,8
95,INT OLD TUNNEL  DAY,18
96,EXT GAMETIME SPORTS BAR BUFFALLO OLD TOWN  NIGHT,2
97,INT GAMETIME SPORTS BAR BUFFALLO OLD TOWN  NIGHT,13
98,INT BOOTH  LATER,83
99,INT TUNNEL  DAY,34
100,INT JULIES APARTMENT BEDROOM  NIGHT,60
101,INT APARTMENT  CONTINUOUS,34
102,EXT BUFFALO STREET  NIGHT,7
103,INT HENRYS APARTMENT  NIGHT,98
104,INT APARTMENT  SAME TIME,21
105,INT STAGE  DAY,52
106,INT DRESSING ROOM  LATER,10
107,EXT PARKING LOT BEHIND THE THEATRE  LATER,33
108,INT JOES CAR  DRIVING,79
109,EXT THEATRE  MORNING,34
110,EXT HOSPITAL  NIGHT,3
111,INT HOSPITAL EMERGENCY ROOM  NIGHT,14
112,INT TUNNEL  NIGHT,43
113,INT HENRYS APARTMENT  DAY,13
114,EXT ORPHEUM THEATRE  NIGHT,4
115,INT ORPHEUM THEATRE GREEN ROOM  SAME TIME,30
116,INT JULIES DRESSING ROOM  NIGHT,53
117,INT THEATRE  NIGHT,6
118,INT FIRST BUFFALO BANK  NIGHT,4
119,INT THEATER  SAME TIME,28
120,EXT STREET  NIGHT,11
121,EXT BACK DOOR  THEATRE,3
122,INT THEATRE  SAME TIME,17
123,INT BANK  SAME TIME,7
124,EXT POWER POLE  SAME TIME,11
125,INT STAGE  SAME TIME,20
126,INT BANK  SAME TIME,17
127,EXT ALLEY  SAME TIME,9
128,INT BANK  SAME TIME,5
129,INT BANK  SAME TIME,3
130,EXT POWER POLE  SAME TIME,2
131,INT BANK  SAME TIME,3
132,EXT POWER POLE  SAME TIME,3
133,INT BANK  SAME TIME,3
134,EXT POWER POLE  SAME TIME,8
135,INT STAGE  NIGHT  SAME TIME,9
136,EXT STREET IN FRONT OF BANK  SAME TIME,32
137,INT TUNNEL  SAME TIME,5
138,EXT BACKSTAGE DOOR  SAME TIME,12
139,INT HENRYS DRESSING ROOM AREA  SAME TIME,3
140,INT TUNNEL  CONTINUOUS,20
141,INT THEATRE  NIGHT,17
142,INT TUNNEL ROOM  NIGHT,20
143,INT TUNNEL  SAME TIME,6
144,INT TUNNEL  A MINUTE LATER,8
145,INT VAULT  A FEW MINUTES LATER,12
146,INT STAGE  CONTINUOUS,16
147,INT VAULT  SAME TIME,5
148,INT STAGE  NIGHT,9
149,INT TUNNEL ROOM  A FEW MINUTES LATER,102
150,INT STAGE  CONTINUOUS,31
151,INT TUNNEL  SAME TIME,16
152,EXT THEATRE  SAME TIME,8
153,INT STAGE  SAME TIME,25
154,EXT THEATRE  MOMENTS LATER,10
155,INT STAGE  SAME TIME,24
156,INT CAR  SAME TIME,22
157,INT STAGE  SAME TIME,130
158,EXT THE LOIRE VALLEY FRANCE  DAY,13
159,INT PRIVATE DELIVERY ROOM SOMEWHERE IN NEW MEXICO ,15
160,EXT FORT LAUDERDALE  DAY,4
161,INT MAXS BARBER SHOP  CONTINUOUS,42
