1,INT SHOP NR CHESTER SQUARE LONDON PRESENT DAWN,27
2,EXT STREET CHESTER SQUARE LONDON PRESENT DAWN,3
3,INT KITCHEN CHESTER SQUARE LONDON PRESENT DAY,42
4,INT CORRIDOR CHESTER SQUARE PRESENT DAY,16
5,INTHALL CHESTER SQUARE DAY,2
6,INT BEDROOM HOUSE CHESTER SQUARE LONDON PRESENTDAY,58
7,INT DRAWING ROOM CHESTER SQUARE LONDON PRESENT DAY,83
8,INT SADLERS WELLS LONDON  NIGHT,4
9,INT DRAWING ROOM CHESTER SQUARE LONDON PRESENT DAY,16
10,INT DRAWING ROOM CHESTER SQUARE LONDON PRESENT DAY,10
11,INT BACK PARLOUR SHOP GRANTHAM  DUSK,20
12,INT SHOP GRANTHAM  DUSK,9
13,INT BACK PARLOUR SHOP GRANTHAM  DUSK,10
14,INT SHOP GRANTHAM  DAY,12
15,INT HALL GRANTHAM  DAY,29
16,EXT STREET GRANTHAM  DAY,28
17,INT SHOP GRANTHAM  DAY,8
18,INT DRAWING ROOM CHESTER SQUARE LONDON PRESENT DAY,2
19,INT SHOP GRANTHAM  DAY,20
20,INT DRAWING ROOM CHESTER SQUARE LONDON PRESENT DAY,4
21,INT BEDROOM HOUSE CHESTER SQUARE LONDON PRESENTDAY,79
22,INTEXT BEDROOM CHESTER SQUARE PRESENT DAY,14
23,INT DRAWING ROOM CHESTER SQUARE LONDON PRESENT DAY,59
24,EXT GRAND HOTEL BRIGHTON  NIGHT,28
25,INT DRAWING ROOM CHESTER SQUARE LONDON PRESENT DAY,14
26,INTBEDROOM HOUSE CHESTER SQUARE LONDON PRESENTDUSK,74
27,INT CORRIDOR CHESTER SQUARE LONDON PRESENT EVENING,35
28,INT CORRIDORDARTFORD  EVENING,3
29,INT SITTING ROOM HOUSE DARTFORD  EVENING,13
30,INTDINING ROOM CHESTER SQUARE LONDON PRESENTEVENING,11
31,INT DINING ROOM HOUSE DARTFORD  EVENING,45
32,INT DINING ROOM CHESTER SQUARELONDONPRESENTEVENING,9
33,INT DINING ROOM HOUSE DARTFORD  EVENING,60
34,INT SITTING ROOM DARTFORD  EVENING,7
35,INTDINING ROOM,46
36,INT DRAWING ROOM CHESTER SQUARE LONDON PRESENT,40
37,INT DRESSING ROOM HOUSE CHESTER SQUARE PRESENTNIGHT,57
38,INT BEDROOM CHESTER SQUARE PRESENT NIGHT,26
39,INT SADLERS WELLS,11
40,INT TOWN HALL  NIGHT,112
41,INT DRAWING ROOM CHESTER SQUARE LONDON PRESENT,57
42,INT DRAWING ROOM CHESTER SQUARE LONDON PRESENTNIGHT,13
43,INT HALLWAY HOUSE FARNBOROUGH KENT  DAWN,10
44,INT DRAWING ROOM CHESTER SQUARE LONDON PRESENT,67
45,INT HOUSE OF COMMONS CHAMBER  DAY,62
46,EXT WESTMINSTER STREET  DAY,17
47,INT CABINET ROOM DOWNING STREET  NIGHT,71
48,INT TOWN HALL  NIGHT,22
49,INT CAR STREET CENTRAL LONDON  DAWN,52
50,INT KITCHEN FLOOD STREET LONDON  DAWN,127
51,INT SITTING ROOM CHESTER SQ PRESENT NIGHT,9
52,INT KITCHEN FLOOD STREET LONDON  DAWN,8
53,INT SITTING ROOM CHESTER SQ PRESENT NIGHT,19
54,INT STUDIO LONDON  NIGHT,7
55,INT REECES OFFICE LONDON  DAY,110
56,INT REHEARSAL ROOM NATIONAL THEATRE LONDON  DAY,44
57,EXT YARD ICE CREAM FACTORY DAY,18
58,INT HAIR SALON LONDON  DAY,11
59,EXT YARD ICE CREAM FACTORY DAY,11
60,INT HAIR SALON LONDON  DAY,4
61,EXT FACTORY LONDON  DAY,13
62,INT HAIR SALON  DAY,3
63,INT BACKSTAGE CONFERENCE HALL BRIGHTON  DAY,20
64,INT MAIN HALL CONFERENCE HALL BRIGHTON  DAY,17
65,INT CORRIDOR HOUSE CHESTER SQUARE PRESENT DAY,5
66,INT UNDERGROUND CAR PARK HOUSE OF COMMONS  EVE,26
67,INT CONFERENCE HALL NIGHT,3
68,INT STEPS HOUSE OF COMMONS DAY,3
69,INT CORRIDOR CHESTER SQUARE PRESENT DAY,13
70,INT CONFERENCE HALL NIGHT,17
71,INT CAR DOWNING STREET LONDON  DAY,33
72,EXT DOWNING STREET LONDON  DAY,22
73,INT DRAWING ROOM DOWNING STREET LONDON  DAY,13
74,INT CORRIDOR HOUSE CHESTER SQUARE PRESENT DAY,26
75,INT CONSULTING ROOM HARLEY STREET LONDON PRESENTDAY,104
76,INT CORRIDOR CHESTER SQUARE PRESENT DUSK,14
77,INT KITCHEN CHESTER SQUARE LONDON PRESENT DUSK,25
78,INT DRAWING ROOM CHESTER SQUARE PRESENT DUSK,13
79,INT DRAWING ROOM CHESTER SQUARE PRESENT DUSK,47
80,INT KITCHEN CHESTER SQUARE PRESENT DUSK,2
81,INT DRAWING ROOM CHESTER SQUARE PRESENT DUSK,52
82,INT BATHROOM CHESTER SQUARE PRESENT NIGHT,9
83,INT BEDROOM HOUSECHESTER SQUAREPRESENTNIGHT,32
84,INT CHAMBERS HOUSE OF COMMONS  DAY,27
85,INT CAR STREETS LONDON  DAY,12
86,INT DRAWING ROOM DOWNING STREET  EVENING,183
87,INT CORRIDOR HOUSE OF COMMONS  DAY,9
88,INT CONFERENCE CENTRE BRIGHTON ,12
89,INT LADIES HOUSE OF COMMONS  DAY,19
90,INT BEDROOM CHESTER SQUARE LONDON PRESENT NIGHT,4
91,INT CONFERENCE CENTRE BRIGHTON ,6
92,INT SITTING ROOM SUITE GRAND HOTEL  NIGHT,38
93,EXT GRAND HOTEL BRIGHTON  NIGHT,11
94,INT BEDROOM HOUSE CHESTER SQUARE PRESENT NIGHT,28
95,INT DRAWING ROOMCHESTER SQUAREPRESENTNIGHT,52
96,INT STUDY DOWNING STREET LONDON  DAY,32
97,INT STUDY DOWNING STREET LONDON  DAY,19
98,INT CABINET DOWNING STREET DAY,18
99,INT STUDY LONDON  NIGHT,10
100,INT DRAWING ROOM DOWNING STREET LONDON  DAY,10
101,INT CORRIDOR DOWNING STREET LONDON  DAY,7
102,INT DRAWING ROOM DOWNING STREET LONDON  DAY,44
103,INT CENTRE OF OPERATIONS  DAY,71
104,INT DOWNING STREET  NIGHT,7
105,INT DRAWING ROOMCHESTER SQUAREPRESENTNIGHT,4
106,INT DOWNING STREET  NIGHT,31
107,INT DOWNING STREET STUDY,79
108,INT CAR DOWNING STREET LONDON  DUSK,25
109,INT HOUSE OF COMMONS CHAMBER PARLIAMENT ,29
110,INT CHESTER SQUARE LONDON PRESENT NIGHT,12
111,INT BALLROOM WHITE HOUSE WASHINGTON  NIGHT,20
112,INT EMBASSY BALLROOM  NIGHT,4
113,INT HOUSE OF COMMONS STAIRWAY  DAY,18
114,EXT HOUSE OF COMMONS LONDON DAY,8
115,INT HOUSE OF COMMONS HALLWAY  DAY,16
116,INT CABINET ROOM DOWNING STREET  DAY,128
117,INT CAR DOWNING STREET LONDON  DAY,10
118,EXT TRAFALGAR SQUARE LONDON  DAY,17
119,INT OFFICE DOWNING STREET  DAY,18
120,INT CHAMBERS HOUSE OF COMMONS LONDON,12
121,INT HALLWAYS HOUSE OF COMMONS LONDON,8
122,INT CORRIDOR  HOUSE OF COMMONS LONDON  DAY,17
123,INT STUDY DOWNING STREET LONDON  NIGHT,35
124,EXT PARIS STREET NIGHT,10
125,INT GRAND HALL PARIS NIGHT,13
126,INT GRAND HALL PARIS NIGHT,37
127,INTDINING ROOMCHESTER SQUAREPRESENT,20
128,INT DRAWING ROOM CHESTER SQUARE LONDON PRESENT,23
129,INT STUDY DOWNING STREET LONDON  NIGHT,25
130,INT HOUSE OF COMMONS DAY,30
131,INT DOWNING STREET STUDY  EVENING,6
132,INT CORRIDOR DOWNING STREET LONDON  DAY,24
133,INT BEDROOM CHESTER SQUARE LONDON PRESENT NIGHT,133
134,INT BEDROOM HOUSE CHESTER SQUARE LONDON PRESENTDAWN,33
