1,EXT PONDICHERRY ZOO INDIA   DAY,31
2,EXT PONDICHERRY ZOO INDIA   DAY,25
3,INT PIS HOME KITCHEN MONTREAL  DAY,39
4,EXT ASHRAM SWIMMING POOL PONDICHERRY   DAY,19
5,INT PIS HOME KITCHEN MONTREAL  DAY,24
6,EXT THE PISCINE MOLITOR PARIS   DAY,25
7,INT PIS HOME MONTREAL  DAY,6
8,EXT PIS PRIMARY SCHOOL   DAY,32
9,INT SCIENCE CLASS   DAY,20
10,SC  INT INDIAN HISTORY CLASS   DAY ,41
11,INT FRENCH CLASS   DAY,9
12,EXT GEOGRAPHY CLASS   DAY,11
13,INT SCHOOL HALLWAY   DAY,8
14,INT MATH CLASS   CONTINUOUS,17
15,INT PIS KITCHEN  DAY,82
16,EXT PONDICHERRY SHORELINE   DAY,10
17,EXT ASHRAM STREET   DAY,4
18,EXT PONDICHERRY CANAL   DAY,7
19,SC  EXT PONDICHERRY MUSLIM QUARTER   DAY ,7
20,INT PIS HOME  CONTINUED,8
21,EXT ZOO ENTRANCE   DAY,16
22,EXT THE NURSERY  CONTINUOUS,12
23,INT PIS HOME OUTER ROOM MONTREAL  DAY,36
24,EXT OUTSIDE THE PATEL HOME   NIGHT,14
25,INT PIS BEDROOM   NIGHT,73
26,EXT MUNNAR TEA FIELDS   DAY,15
27,INT CATHOLIC CHURCH   DAY,28
28,INT PIS DINING ROOM MONTREAL  INTERCUTCONTINUOUS,8
29,EXT PLANTATION HOME MUNNAR   DAY,8
30,INT CATHOLIC CHURCH MUNNAR   DAY ,19
31,INT PIS BEDROOM   DAY,13
32,EXT MUSLIM QUARTER   DAY,14
33,EXT PONDICHERRY MOSQUE   DAY,5
34,INT PI FAMILY HOME   DAY,6
35,INT FAMILY KITCHENDINING ROOM   DUSK,75
36,EXT PIS STREET  DAY,26
37,INT THE TIGER FEEDING AREA  PART ,19
38,EXT MONTREAL STREET  DAY,19
39,EXT THE TIGER FEEDING AREA PART TWO   DAY,52
40, EXT THE FEEDING CAGES   A SHORT TIME LATER ,72
41,INT PI AND RAVIS BEDROOM   MORNING,21
42, EXT PIS SCHOOL PONDICHERRY   DAY ,97
43,EXT THE ZOO EXHIBITS   DAY,16
44,INT PATEL DINING ROOM   DUSK,48
45,EXT PONDICHERRY BENEATH THE PIER   DAY,17
46,EXT CARGO SHIP DECK   DUSK,15
47,INT THE TSIMTSUM MESS HALL   DAY,67
48,INT THE TSIMTSUM MESS HALL   DAY,14
49,INT TSIMTSUM CARGO HOLD   DAY,36
50,EXT MONTREAL GARDENS  DAY,23
51,EXT A TOPOGRAPHICAL MAP OF THE PACIFIC   DUSK,18
52,EXT THE TSIMTSUM  NIGHT,6
53,INT CARGO SHIP THE FAMILY CABIN  NIGHT,28
54,INT SHIP HALLWAY  CONTINUOUS,4
55,EXT THE CARGO DECK  CONTINUOUS,18
56,INT THE STAIRS TO THE CABINSLOWER LEVEL  CONTINUOUS,14
57,EXT THE CARGO DECK  CONTINUOUS,112
58,EXT THE OCEAN  CONTINUOUS,6
59,EXT BENEATH THE WATER  CONTINUOUS,20
60,EXT THE OCEANTHE BOAT  CONTINUOUS,24
61,EXT THE LIFEBOAT  DAWN,17
62,EXT THE LIFEBOAT  DAY,45
63,EXT THE LIFEBOAT  DAY,22
64,EXT THE LIFEBOAT  DUSK,18
65,EXT THE LIFEBOAT  DAWN,32
66,EXT THE OCEAN BEHIND THE LIFEBOATTHE LIFEBOAT  DAY,72
67,EXT THE LIFEBOAT  DAY,58
68,EXT THE RAFT BEHIND THE LIFEBOAT  NIGHT,12
69,EXT ABOVE THE RAFT  EARLY MORNING,32
70,EXT THE RAFT  DAY,8
71, EXT THE RAFT  DAY  MONTAGE ,21
72,EXT THE RAFT  A SHORT TIME LATER,23
73,EXT RAFT  DAY,78
74,EXT THE RAFT  AFTERNOON,9
75,EXT THE RAFTTHE LIFEBOAT  A SHORT TIME LATER,12
76,EXT RAFT  INSERT,10
77,EXT RAFT  CONTINUOUS,26
78,EXT RAFT  DAY,8
79,EXT THE LIFEBOATTHE RAFT  DUSK,41
80,EXT THE LIFEBOAT  NIGHT,14
81,EXT THE RAFT  DAY,8
82,EXT THE RAFT  DAY,30
83,EXT THE RAFTTHE LIFEBOAT  A SHORT TIME LATER,12
84,EXT THE RAFT  NIGHT,35
85,EXT THE RAFTLIFEBOAT  LATE AFTERNOON,81
86,EXT THE RAFT  SUNSET,7
87,EXT THE LIFEBOAT  DAY,12
88,EXT THE RAFT  DAY,11
89,EXT THE LIFEBOAT  DAY,36
90,EXT THE LIFEBOATTHE RAFT  DAY,35
91,EXT RAFT  DAY,17
92,EXT RAFT  SUNSET,4
93,EXT THE LIFEBOAT  NIGHT,14
94,EXT THE LIFEBOAT MONTHS LATER  DAY,21
95,EXT THE LIFEBOAT  NIGHT,25
96,EXT LIFEBOAT  DAY,12
97,EXT THE LIFEBOAT  DAY,11
98,EXT LIFEBOAT  DAY,19
99,EXT LIFEBOAT  DAY,60
100,INT THE LIFEBOAT UNDER THE TARP  CONTINUOUS,11
101,EXT THE LIFEBOAT  DAY,8
102,EXT THE LIFEBOAT  DAY,30
103,EXT THE LIFEBOATTHE ISLAND  DAY,31
104,EXT THE ISLAND  DAY,19
105,EXT THE TREE  SUNSET,21
106,EXT UP IN THE TREE  NIGHT,24
107,EXT THE LIFEBOAT  NIGHT,4
108,EXT LIFEBOAT  NIGHT,8
109,EXT UP IN THE TREE  NIGHT,11
110,INT PIS HOME MONTREAL  LATE AFTERNOON,45
111,EXT ISLANDLIFEBOAT  DAY,20
112,EXT THE ISLANDLIFEBOAT  SUNSET,6
113,EXT OCEAN NEAR ISLAND  LIFEBOAT  SUNSET,23
114,EXT THE MEXICAN COASTTHE JUNGLE  DAY,23
115,EXT THE MEXICAN COASTTHE JUNGLE  DAY,28
116,INT PIS HOME DINING ROOM MONTREAL  SUNSET,9
117,EXT THE MEXICAN COASTTHE JUNGLE  DAY,18
118,INT PIS HOME  DINING ROOM  MONTREAL  NEAR SUNSET,71
119,INT INFIRMARY  MEXICO   DAY,74
120,INT PIS HOME MONTREAL  DAY,10
121,INT INFIRMARY MEXICO   DAY,97
122,INT PIS HOME  DINING ROOM  MONTREAL  SUNSET,92
