1,INT CAR  DAY,45
2,EXT TRANS AM  DAY,11
3,EXT BANK  DOWNTOWN  DAY,33
4,INT DINER  DAY,78
5,EXT STREET  DAY,2
6,EXT ROOFTOP ACROSS THE STREET  DAY,15
7,INT BANK  DAY,132
8,EXT BANK  DAY,20
9,INT BANK  DAY,38
10,EXT ROOFTOP  DAY,7
11,INT BANK  DAY,36
12,EXT ROOFTOP  DAY,8
13,EXT STREET  SHORT TIME LATER,75
14,INT METRO DIVISION HEADQUARTERS  DAY  RAINING,17
15,INT HALLWAY  DAY  RAINING,7
16,INT CAPTAIN SOLIS OFFICE  RAINING,62
17,INT HALLWAY  SAME  RAINING,4
18,INT SOLIS OFFICE  SAME  RAINING,108
19,INT HALLWAY  DAY  RAINING,45
20,INT UNDERGROUND GARAGE  NIGHT,75
21,EXT MARKET STREET  NIGHT,4
22,EXT KORDAS BUILDING  NIGHT,3
23,INT PICKUP  NIGHT,28
24,INT BUILDING  NIGHT,3
25,INT KORDAS APT  NIGHT,79
26,INT KITCHEN,44
27,INT HALLWAY  NIGHT,2
28,INT ELEVATOR  NIGHT,24
29,EXT BUILDING  NIGHT,6
30,INT BUILDING  NIGHT,10
31,INT THIRD FLOOR HALLWAY  NIGHT,3
32,INT KORDAS APT  NIGHT,4
33,INT HALLWAY  NIGHT,3
34,INT APT   NIGHT,4
35,EXT BUILDING  NIGHT,4
36,INT SOLIS OFFICE  NIGHT  RAIN,47
37,INT METRO OFFICE AREA  NIGHT,18
38,EXT SAN FRANCISCO STREET  NIGHT  RAINING,2
39,INT PICKUP,3
40,INT RONNIES HALLWAY  NIGHT,30
41,INT RONNIES HOUSE  NIGHT,99
42,EXT PIER   EARLY MORNING,4
43,INT WAREHOUSE  SAME,4
44,INT WATCHMANS QUARTERS  SAME,69
45,INT METRO DIVISION HEADQUARTERS  DAY,83
46,EXT MARKET STREET  DAY,2
47,INT PICKUP  DAY,54
48,EXT TH STREET  DAY,59
49,INT APT HALLWAYSTAIRCASE  ACROSS THE STREET,2
50,INT TH ST APARTMENT BUILDING HALLWAY  DAY,5
51,INT APARTMENT  DAY,55
52,EXT ROOF ACROSS THE STREET  ON MCCALL,4
53,INT RAYMONDS APARTMENT,74
54,EXT APT BLDG,8
55,INT APT BUILDING  HALLWAY  DAY,11
56,INT APT  DAY,29
57,INT METRO DIVISION  NIGHT,21
58,INT BILLY GOAT TAVERN  NIGHT,105
59,INT ROOM  DAY,50
60,INT TRAINING ROOM  MOMENTS LATER,86
61,INT TRAINING ROOM  LATER,37
62,INT CONFERENCE ROOM  DAY,33
63,EXT GOLDEN GATE RACETRACK  DAY,41
64,INT BETTING WINDOWS  DAY,11
65,EXT SEATING AREA  DAY,128
66,INT BETCASH WINDOW  DAY,21
67,EXT JEWELRY STORE  UNION SQUARE  DAY,6
68,INT TRAVEL AGENCY  COMMAND CENTER  DAY,11
69,EXT STREET  DAY,16
70,INT COMMAND POST  DAY,54
71,INT JEWELRY STORE  DAY,7
72,INT COMMAND CENTER  DAY,17
73,EXT STREET OUTSIDE JEWELRY STORE  DAY,13
74,INT COMMAND CENTER,2
75,EXT JEWELRY STORE  DAY,60
76,EXT COMMAND CENTER  DAY,62
77,INT JEWELRY STORE  DAY,56
78,EXT STREET  DAY,4
79,INT COMMAND CENTER  DAY,13
80,INT BUILDING  SAME,2
81,INT COMMAND CENTER  SAME,2
82,EXT ROOFTOP  DIFFERENT BUILDING  SAME,2
83,EXT ANOTHER ROOFTOP  SAME,2
84,INT COMMAND CENTER  SAME,29
85,EXT ROOFTOP  SAME,8
86,INT COMMAND CENTER  ROPERS POV  BINOCULARS  SAME,26
87,INT COMMAND CENTER,31
88,EXT POLICE BARRICADES  DAY,8
89,EXT STREET  DAY,5
90,INT VAN  DAY,4
91,INT CADILLAC  DAY,11
92,INT VAN  DAY,7
93,EXT STREET  DAY,6
94,INT VAN  DAY,6
95,INT CADILLAC,27
96,EXT STREET  DAY,2
97,INT VAN,17
98,INT CABLE CAR,13
99,INT CADILLAC,15
100,EXT UNDER CABLE CAR,2
101,EXT STREET,21
102,EXT INTERSECTION,18
103,INT CAR OF MAN TRAPPED IN INTERSECTION,13
104,INT CABLE CAR,35
105,INT CADDY,5
106,EXT STREET,20
107,INT GARAGE  DAY,7
108,INT THIRD LEVEL  GARAGE,20
109,INT GARAGE,74
110,INT METRO DIVISION  NIGHT,51
111,INT KITCHEN  NIGHT,56
112,INT RONNIES BEDROOM  NIGHT,14
113,INT COUNTY JAIL VISITING ROOM  DAY,56
114,EXT RONNIES HOUSE  NIGHT,2
115,INT RONNIES KITCHEN  NIGHT,2
116,EXT RONNIES HOUSE  NIGHT,3
117,INT KITCHEN  NIGHT,3
118,INT PICKUP  NIGHT,7
119,INT RONNIES KITCHEN  NIGHT,3
120,INT PICKUP  NIGHT,8
121,INT KITCHEN  STORE,5
122,EXT RONNIES HOUSE  NIGHT,2
123,INT KITCHEN  NIGHT,4
124,INT HALLWAY  NIGHT,2
125,INT BEDROOM  NIGHT,7
126,INT BATHROOM  NIGHT,10
127,INT HALLWAY  NIGHT,11
128,INT RONNIES KITCHEN  NIGHT,19
129,EXT RONNIES HOUSE  NIGHT,17
130,INT RONNIES APT  NIGHT,2
131,INT STAIRWAY  NIGHT,2
132,INT RONNIES LIVING ROOM  NIGHT,12
133,EXT BACK OF RONNIES  NIGHT,5
134,EXT STREET  NIGHT,6
135,EXT ANOTHER STREET  NIGHT,9
136,EXT ALLEYWAY  NIGHT,50
137,INT COUNTY JAIL VISITING ROOM  DAY,59
138,INT ROPERS OFFICE  DAY,11
139,INT ROPERS OFFICE  DAY,11
140,EXT VETERANS HOSPITAL ROOFTOP  DAY,25
141,INT STAIRWELL  DAY,44
142,EXT ROOF  DAY,33
143,EXT STREET BELOW  DAY,5
144,EXT ROOF  DAY,36
145,EXT STREET  THAT MOMENT,13
146,EXT ROOF  DAY,58
147,EXT ROOF  DAY,5
148,INT LOBBY  DAY,18
149,INT CAR  DAY,3
150,EXT RACETRACK,4
151,INT BETTING AREA  DAY,15
152,EXT BOX SEAT AREA  DAY,3
153,EXT TRACK  DAY,2
154,EXT BOX SEAT AREA  DAY,83
155,INT JAIL  DAY,29
156,EXT POSTRIO  NIGHT,2
157,INT POSTRIO  NIGHT,64
158,INT HALLWAY JAIL  DAY CLOSE ON,3
159,INT PROPERTY ROOM JAIL  CONTINUOUS,31
160,INT BASEMENT JAIL  CONTINUOUS,9
161,INT LONG HALLWAY JAIL  LATER,9
162,INT CELL BLOCK  CONTINUOUS,27
163,INT SECURITY ROOM  CONTINUOUS,47
164,EXT JAIL SALLY PORT  CONTINUOUS,36
165,INT RONNIES HOUSE LIVING ROOM  NIGHT,73
166,EXT RONNIES HOUSE  NIGHT,2
167,EXT RONNIES DOORSTEP  DAY,19
168,INT STAIRWAY  DAY,9
169,INT RONNIES HALLWAY  SAME,5
170,INT RONNIES APT  SAME,78
171,INT POLICE PROPERTYEVIDENCE ROOM  DAY,49
172,INT ROPERS PICKUP  DAY,15
173,EXT MARE ISLAND  DAY,4
174,EXT MARE ISLAND  NORTH GATE  DAY,10
175,INT ROPERS PICKUP  DAY,6
176,EXT DRY DOCK AREA  DAY,3
177,INT BUILDING  UPPER LEVEL  DAY,3
178,EXT ROPER  DAY,58
179,EXT ROPERS TRUCK  DAY LOW ANGLE BENEATH THE TRUCK,7
180,EXT ROPER  DAY,2
181,EXT ROOFTOP  BUILDING  DAY,7
182,EXT ROPER  DAY,4
183,EXT ROOFTOP  BUILDING  DAY,6
184,EXT ROPER  DAY,23
185,EXT HIGH VANTAGE POINT  DAY,28
186,INT MACHINE SHOP  DAY,84
187,EXT MCCALLS TELESCOPIC POV  DAY,7
188,INT MACHINE SHOP  DAY,13
189,EXT MCCALLS POV  DAY TELESCOPIC SCOPE,10
190,INT MACHINE SHOP  DAY,50
191,EXT MCCALLS POV  DAY,6
192,INT MACHINE SHOP  DAY,6
193,EXT MCCALLS POV  DAY,9
194,INT MACHINE SHOP  DAY,9
195,EXT MCCALLS POV  DAY,4
196,EXT MACHINE SHOP  DAY,28
197,EXT MCCALLS POV  DAY,4
198,INT MACHINE SHOP  DAY,7
199,EXT MCCALLS POV  DAY,8
200,INT MACHINE SHOP  DAY,8
201,EXT MCCALLS POV  DAY,2
202,INT MACHINE SHOP  DAY,4
203,INT KORDAS CAR  DAY,6
204,EXT MCCALLS TELESCOPIC POV  DAY,4
205,INT KORDAS CAR  DAY,3
206,INT MACHINE SHOP  DAY KORDAS CAR,16
207,EXT MCCALLS POV  DAY,4
208,INT MACHINE SHOP  DAY ROPER,27
209,EXT MACHINE SHOP  DAY MCCALLS TELESCOPIC POV OF CAR,4
210,INT MACHINE SHOP  DAY,7
211,EXT MACHINE SHOP  DAY,10
212,INT MACHINE SHOP  DAY ROPER,13
213,EXT MACHINE SHOP  DAY MCCALL,23
214,EXT MACHINE SHOP  REAR  DAY,89
