1,EXT FIELD  DAY,57
2,EXT BELL TOWER  TEN YEARS LATER,4
3,INT MARYS BEDROOM  DAY,29
4,INT CHAPEL  DAY,16
5,INT BOLEYN HOME  NIGHT,116
6,INT BOLEYN CASTLE  DAY,34
7,INT CORRIDOR  NIGHT,10
8,INT HEVER CASTLE  NIGHT,42
9,INT BEDROOOM  NIGHT,58
10,EXT ENGLISH COUNTRYSIDE  DAY,27
11,EXT HEVER  DAY,7
12,EXT HEVER  ESTATE  DAY,6
13,INT HEVER  DAY,17
14,EXT HEVER  DAY,51
15,EXTINT HEVER  DAY,57
16,INT BOLEYN HOUSE  EVENING,22
17,INT BOLEYN HOME  NIGHT,87
18,INT STAIRCASE  BOLEYN HOUSE  NIGHT,16
19,INT GIRLS BEDROOM  NIGHT,8
20,EXT HEVER CASTLE  STABLE YARD  DAY,52
21,EXT COUNTRYSIDE  DAY,20
22,EXT FIELDS  DAY,7
23,EXT FIELDS  DAY,16
24,EXT FIELDS  DAY,20
25,INT FOREST  DAY,12
26,EXT FOREST  RAVINE  DAY,61
27,INT HEVER  NIGHT,83
28,EXT HEVER CASTLE  DAY,26
29,INT HEVER CASTLE  DAY,12
30,INT SIR THOMASS STUDY  DAY,16
31,INT CORRIDOR  SAME TIME,4
32,INT SIR THOMASS STUDY  SAME TIME,69
33,INT CORRIDOR  SAME TIME,8
34,INT WILLIAM CAREYS HOUSE  NIGHT,34
35,EXT BOLEYN HOME  STABLES  DAY,17
36,EXT PALACE  DAY,14
37,INT COURT  DAY,82
38,INT CORRIDORS  WHITEHALL PALACE  AFTERNOON,48
39,EXT TILTYARD  DAY,50
40,INT MARYS ROOM  COURT  DAY,50
41,INT NORFOLKS STUDY  COURT  NIGHT,34
42,INT ROYAL CHAPEL  DAY,9
43,EXT COUNTRY CHAPEL  DAY,9
44,INT ROYAL CHAPEL  DAY,14
45,INT COUNTRY CHURCH  DAY,25
46,EXT ROYAL CHAPEL  DAY,13
47,INT MARYS ROOM  NIGHT,60
48,INT SIR THOMASS STUDY  BOLEYN HOUSE  LONDON  DAY,72
49,INT CORRIDOR OUTSIDE  DAY,37
50,INT BALLROOM  PALACE  NIGHT,106
51,INT KINGS APARTMENT  COURT  NIGHT,152
52,INT PALACE  DAYBREAK,5
53,INT CORRIDOR  OUTSIDE HENRYS APARTMENTS  DAY,24
54,INT NORFOLKS STUDY  COURT  DAY,61
55,INT PALACE  DAY,76
56,INT SIR THOMASS STUDY  LONDON  DAY,33
57,INT BALLROOM  PARKER FAMILY CASTLE  NIGHT,93
58,INT HENRYS APARTMENT  DAY,16
59,INT MARYS APARTMENT  COURT  DAY,9
60,INT KINGS APARTMENT  DAY,13
61,INT HENRYS APARTMENT  DAY,11
62,INT COURT  ACCOMMODATION  DAY,47
63,INT MARYS BEDROOM  DAY,14
64,INT MARYS APARTMENT  DAY,25
65,INT MARYS BEDROOM  COURT  DAY,19
66,INT MARYS APARTMENT  DAY,21
67,INT COURT  DAY,9
68,EXT GARDENS  DAY,19
69,INT MARYS ROOM  LYINGIN  EVENING,33
70,INT MARYS APARTMENT  DAY,41
71,EXT KENT COUNTRYSIDE  COAST  DAY,8
72,EXT VILLAGES  DAY,6
73,EXT COUNTRYSIDE  NIGHT,5
74,EXT COUNTRYSIDE  DAY,7
75,INT GREENWICH PALACE  THAT NIGHT,133
76,INT MARYS BEDROOM  DAY,46
77,EXT TILTYARD  DAY,6
78,INT ARMOURY  DAY,58
79,INT BOLEYN APARTMENTS  COURT  FOLLOWING DAY,24
80,INT KINGS APARTMENT  DAY,16
81,EXT BOLEYN APARTMENTS  DAY,5
82,INT BOLEYN APARTMENTS  DAY,5
83,INT KINGS APARTMENTS  DAY,7
84,EXT BOLEYN APARTMENTS  DAY,5
85,INT BOLEYN APARTMENTS  DAY,4
86,INT KINGS APARTMENT  DAY,10
87,INT CORRIDORS  COURT  DAY,7
88,INT BOLEYN APARTMENTS  COURT  DAY,14
89,INT BOLEYN APARTMENTS  DAY,9
90,INT BOLEYN APARTMENTS  DAY,32
91,INT BOLEYN APARTMENTS  DAY,56
92,INT MARYS BEDROOM  NIGHT,4
93,INT SIR THOMASS BEDROOM  SAME TIME,7
94,INT MARYS ROOM  NIGHT,7
95,INT MARYS ROOM  NIGHT,107
96,INT SIR THOMASS STUDY  NIGHT,40
97,INT MARYS APARTMENT  DAY,4
98,INT CORRIDOR  DAY,7
99,INT MARYS APARTMENT  DAY,47
100,EXT COURTYARD  DAY,20
101,EXT COUNTRYSIDE  DAY,7
102,EXT HILLSIDE  DAY,5
103,INT MANOR HOUSE  NIGHT,33
104,INT CAREYS HOUSE  COURT  NIGHT,16
105,EXT PALACE  SUMMER,4
106,EXT GARDENS  DAY,41
107,INT COURT  DAY,8
108,INT COURT  ANNES APARTMENTS  WINTER  DAY,80
109,INT COURT  SEVERAL MONTHS LATER  DAY,39
110,EXT COUNTRYSIDE  DAY,7
111,INT ROCHFORD HALL  DAY,42
112,EXT ROCHFORD HALL  STABLE YARD  DAY,34
113,INT ROCHFORD HALL  BEDROOM  DAY,5
114,INT ROCHFORD HALL  CORRIDOR  DAY,5
115,EXT HILL  COUNTRYSIDE  DAY,15
116,INT ROCHFORD HALL  CORRIDOR  DAY,7
117,INT COURT  DAY,29
118,INT HENRYS QUARTERS  COURT  SEVERAL MONTHS LATER,16
119,INT CORRIDOR  COURT  DAY,5
120,INT ANNES ROOM  DAY,46
121,EXT CEMETERY  DAY,14
122,INT COURT  BOLEYN HOUSE  NIGHT,15
123,INT COURT  BOLEYN HOUSE  NIGHT,34
124,INT KINGS APARTMENTS  NIGHT,29
125,INT CORRIDOR OUTSIDE KINGS APARTMENTS  DAY,12
126,INT BOLEYN APARTMENTS  COURT  NIGHT,14
127,INT CORRIDOR  BOLEYN APARTMENTS  NIGHT,54
128,EXT BLACKFRIARS  COURTHOUSE  DAY,7
129,INT BLACKFRIARS MONASTERY  DAY,122
130,INT BOLEYN FAMILY HOME  NIGHT,50
131,INT CORRIDOR  DAY,16
132,EXT GARDENS  DAY,41
133,INT QUEENS QUARTERS  SAME TIME,5
134,EXT GARDENS  DAY,5
135,EXT PALACE  SAME TIME,11
136,EXT GREENWICH PALACE  DAY,4
137,INT CORRIDORQUEENS QUARTERSPALACE  DAY,15
138,INT ANNES APARTMENT  DAY,32
139,INT ANNES QUARTERS  NIGHT,17
140,INT PALACE CHAPEL  WESTMINSTER  DAY,15
141,INT PALACE  DAY,58
142,INT COURT  ACCOMMODATION  DAY,60
143,INT QUEENS APARTMENTS  LYINGIN  DAY,51
144,INT COURT  QUEENS APARTMENTS  NIGHT,30
145,INT ANNES BEDROOM  NIGHT,26
146,INT LYINGIN  DAY,30
147,INT MARYS ROOM  COURT  NIGHT,15
148,INT BEDROOM  NIGHT,33
149,INT ANNES BEDROOM  NIGHT,9
150,INT MARYS BEDROOM  PALACE  NIGHT,7
151,INT ANNES BEDROOM  DAY,8
152,EXT RIVER THAMES  WINTER PARTY  MONTHS LATER  DAY,79
153,INT ANNES BEDROOM  NIGHT,19
154,INT ANNES BEDROOM  COURT  NIGHT,129
155,INT CORRIDOR OUTSIDE ANNES ROOM  NIGHT,9
156,INT CORRIDORS  NIGHT,4
157,INT MARYS ROOM  COURT  NIGHT,14
158,INT ANNES BEDROOM  NIGHT,9
159,EXT STABLES  NIGHT,4
160,INT ANNES BEDROOM  NIGHT,8
161,EXT COUNTRYSIDE  NIGHT,4
162,INT ANNES BEDROOM  NIGHT,6
163,INT CORRIDOR OUTSIDE ANNES ROOM  NIGHT,13
164,EXT VILLAGE  DAWN,5
165,EXT WILLIAM STAFFORDS HOUSE  DAY,4
166,INT WILLIAM STAFFORDS HOUSE  DAY,14
167,INT WILLIAM STAFFORDS HOUSE  DAY,14
168,INT KITCHEN  DAY,11
169,INT BEDROOM  DAY,6
170,INT CORRIDOR  DAY,7
171,INT BATHROOM  DAY,6
172,EXT FIELDS  DAY,7
173,EXT STAFFORDS FARMHOUSE  DAY,5
174,INT STAFFORDS FARMHOUSE  DAY,9
175,INT BATHROOM  DAY,27
176,INT COUNTRY CHURCH  DAY,11
177,INT BARN  NIGHT,29
178,EXT WOODS  DAY,6
179,INT BARN  NIGHT,11
180,INT TOWER  DAY,6
181,INT BARN  NIGHT,38
182,EXT COUNTRYSIDE  DAY,2
183,INT GREAT COURT  TOWER OF LONDON  DAY,36
184,EXT COUNTRYSIDE  NIGHT,5
185,INT GREAT COURT  TOWER OF LONDON  NIGHT,33
186,EXT COUNTRYSIDE  NIGHT,4
187,INT COURTROOM  DAY,16
188,EXT TOWER GREEN  THE FOLLOWING DAY,5
189,EXT COUNTRYSIDE  DAY,4
190,EXT TOWER GREEN  DAY,9
191,EXT TOWER OF LONDON  DUSK,16
192,INT PALACE  COURT  DAY,22
193,INT PRIVY CHAMBER  DAY,77
194,EXT TOWER HILL  DAY,7
195,INT ANNES CELL  DAY,16
196,EXT TOWER GREEN  DAY,8
197,INT ANNES CELL  DAY,60
198,EXT TOWER HILL  DAY,35
199,INT CROMWELLS OFFICE  DAY,9
200,EXT TOWER HILL  DAY,35
201,INT BEDROOM  DAY,7
