1, INT NETHERFIELD  HERTFORDSHIRE  DAY I,22
2, EXT LONGBOURN HOUSE  DAY ,22
3, INT LONGBOURN  CONTINUOUS,21
4,INT LIBRARY  LONGBOURN  CONTINUOUS,16
5, INT CORRIDOR  LONGBOURN  THE SAME,6
6, INT DRAWING ROOM  LONGBOURN  THE SAME ,62
7, INT ASSEMBLY ROOMS  MERYTON VILLAGE  NIGHT,325
8, INT BEDROOM  LONGBOURN  NIGHT ,49
9, INT BREAKFAST ROOM  LONGBOURN  DAY ,63
10, EXT COUNTRYSIDE  DAY ,3
11, EXT FIELD  DAY ,7
12, EXT LONGBOURN  DAY ,9
13, EXT GARDEN  DAY ,3
14, EXT MERYTON VILLAGE  DAY ,3
15,  EXT LONGBOURN  DAY ,13
16, INT NETHERFIELD  DAY ,3
17, INT DRAWING ROOM  LONGBOURN  DAY ,36
18, EXT COUNTRYSIDE  DAY ,5
19, INT NETHERFIELD  BREAKFAST ROOM  DAY,47
20,  INT NETHERFIELD LANDING  DAY I,13
21, INT NETHERFIELD  JANES BEDROOM  DAY ,28
22, INT DRAWING ROOM  NETHERFIELD  DAY ,21
23, EXT GARDEN  LONGBOURN  DAY ,24
24, EXT MERYTON VILLAGE  DAY ,9
25, INT DRAWING ROOM  NETHERFIELD  EVENING ,151
26, EXT COUNTRYSIDE  DAY ,2
27, EXT STABLE YARD  NETHERFIELD  DAY ,7
28,  INTEXT BEDROOMSTABLE YARD  NETHERFIELD  THE SAME ,8
29, INT DRAWING ROOM  NETHERFIELD  DAY ,75
30, EXT DRIVE  NETHERFIELD  DAY,28
31, INT CARRIAGE  LEAVING NETHERFIELD  THE SAME ,5
32, EXT MERYTON  DAY ,4
33,  INT CARRIAGE  MERYTON  DAY ,12
34, INT LONGBOURN  HERTFORDSHIRE  DAY ,10
35, INT CARRIAGE  COMING THROUGH MERYTON  DAY ,40
36, INT HALLWAY  LONGBOURN  DAY ,30
37, INT DINING ROOM  NETHERFIELD  EVENING ,72
38, INT CORRIDOR  LONGBOURN  THE SAME ,35
39, EXT BACK MEADOW  LONGBOURN  DAY ,15
40, EXT MERYTON VILLAGE  DAY ,32
41, INT MILLINERS SHOP  DAY ,46
42, EXT MILLINERS SHOP  DAY ,65
43, INT DRAWING ROOM  THE LUCAS HOUSE  DAY ,114
44, EXT BALCONY  THE LUCASES HOUSE  MERYTON  NIGHT ,49
45,  INT BEDROOMS  LONGBOURNE  THE SAME ,37
46, INT NETHERFIELD  HERTFORDSHIRE  NIGHT ,346
47, INT ENTRANCE HALL NETHERFIELD  THE WEE HOURS ,32
48, INT CARRIAGE  HERTFORDSHIRE  MORNING ,10
49, INT BREAKFAST ROOM  LONGBOURNE  DAY ,138
50, INT LIBRARY  LONGBOURN  THE SAME ,22
51, INT HALLWAY  LONGBOURN  THE SAME ,54
52, INT DRAWING ROOM  LONGBOURN  THE SAME ,23
53, EXT NETHERFIELD  DAY ,3
54, INT CARRIAGE  LEAVING NETHERFIELD  THE SAME ,3
55, INT BEDROOM  LONGBOURNE  NIGHT ,36
56, EXT LONGBOURN  THE SAME ,32
57, INT BEDROOM  LONGBOURN  DAY ,70
58, EXT MERYTON  DAY ,24
59,C  INT VILLAGE POST OFFICE  THE SAME ,9
60, EXT MERYTON  DAY ,5
61, EXT HUNSFORD PARSONAGE  KENT  DAY ,6
62, EXT HUNSFORD PARSONAGE DAY ,36
63, INT CHARLOTTES PARLOUR  HUNSFORD  DAY ,58
64, EXT GROUNDS OF ROSINGS  EVENING ,12
65, INT STAIRWAY  ROSINGS  THE SAME ,82
66, INT DINING ROOM  ROSINGS  NIGHT ,95
67, INT DRAWING ROOM  ROSINGS  NIGHT ,97
68, INT DRAWING ROOM  HUNSFORD  DAY ,58
69, EXT HUNSFORD CHURCH  DAY ,73
70, EXT ROSINGS PARK  DAY ,227
71, INT HUNSFORD  DAY ,7
72, INT BEDROOM  HUNSFORD  THE SAME ,21
73, INT DRAWING ROOM  HUNSFORD  DAY ,74
74, EXT HUNSFORD  DAY ,14
75,  INT DRAWING ROOM  HUNSFORD  LATER  DAY ,8
76, TNTEXT CARRIAGECHEAPSIDE  DAY ,8
77,  INT GARDINERS HOUSE  CHEAPSIDE  DAY ,15
78, EXT SMALL BACK GARDEN OF THE GARDINERS HOUSE  E,63
79, INT THE GARDINERS HOUSE  DAY ,47
80, INT DRAWING ROOM  CHEAPSIDE  THE SAME ,29
81, INT BEDROOM  CHEAPSIDE  NIGHT ,14
82, EXT DERBYSHIRE  DAY ,10
83, EXT LAMBTON  DUSK ,4
84, INT INN  LAMBTON  NIGHT ,55
85, INT BEDROOM  INN  NIGHT ,16
86, EXT PEMBERLEY  DAY ,13
87, EXT PARK  PEMBERLY  THE SAME ,7
88, INT PEMBERLY  DAY ,12
89, INT PICTURE GALLERY  PEMBERLY  DAY ,66
90, EXT TERRACE  PEMBERLY  THE SAME ,78
91, INT INN  NIGHT ,34
92, INT LIBRARY AND DRAWING ROOM  PEMBERLEY  DAY ,98
93, EXT DERBYSHIRE  DUSK ,23
94, INT INN  LAMBTON  NIGHT ,16
95, INT PARLOUR  INN  LAMBTON  THE SAME ,51
96, EXT COUNTRYSIDE  NIGHT ,2
97, INT LONGBOURN  MRS BENNETS BEDROOM  DAY ,28
98, EXT LONDON  DAY ,11
99, INT MESS HALL  BARRACKS  NIGHT ,12
100, INT UPSTAIRS AT LONGBOURNE  DAY ,11
101, INT DOWNSTAIRS  LONGBOURN  THE SAME ,7
102, INT LIBRARY  LONGBOURN  DAY CONTINUOUS ,32
103, EXTINT BOARDING HOUSE  LONDON  DAY ,11
104, EXT GARDEN  LONGBOURN  DAY ,61
105,  INT MR  MRS BENNETS BEDROOM  LONGBOURN  DAY I,41
106,  INT HALLWAY  LONGBOURN  DAY ,12
107, INT DINING ROOM  LONGBOURN  DAY ,82
108, EXT GARDEN  LONGBOURN  DAY ,77
109, EXT BINGLEYS HOUSE  MAYFAIR  DAY ,16
110, EXT LONGBOURN  DAY ,33
111, EXT MERYTON VILLAGE  DAY ,43
112, EXT LONGBOURN  DAY ,4
113, INT DRAWING ROOM  LONGBOURN  DAY ,112
114, EXT THE LANE  NEAR LONGBOURN  THE SAME ,13
115, INT DRAWING ROOM  LONGBOURN  DAY ,60
116, INT HALLWAY  LONGBOURN  THE SAME ,12
117, INT DRAWING ROOM  LONGBOURN  THE SAME ,10
118, EXT GARDEN  LONGBOURN  THE SAME ,2
119, EXT COUNTRYSIDE  OVER LOOKING LONGBOURN  THE SAME ,2
120, INT BEDROOM  LONGBOURN  NIGHT ,16
121, INT ELIZABETHS BEDROOM  NIGHT ,31
122, INT DOWNSTAIRS  LONGBOURN  NIGHT ,36
123, INT DRAWING ROOM  LONGBOURN  NIGHT ,112
124, INT BEDROOM  LONGBOURN  NIGHT ,3
125, INT DRAWING ROOM  LONGBOURN  THE SAME ,5
126, EXT LONGBOURN  DAWN ,4
127, EXT COUNTRYSIDE OVERLOOKING LONGBOURN  THE SAME ,64
128, INT DRAWING ROOM  LONGBOURN  DUSK ,20
129,  INT HALLWAYLIBRARY  LONGBOURN  DAY ,34
130, EXT GARDEN  LONGBOURN  DAY ,4
131,  INT LIBRARY  LONGBOURN  DAY ,47
