1,INT GRUBBY HOTEL CORRIDOR  DAY DIMLY LIT,26
2,INT HOTEL ROOM  DAY,89
3,EXT FBI ACADEMY GROUNDS QUANTICO VIRGINIA  DAY,98
4,INT CHILTONS OFFICE  BALTIMORE STATE HOSPITAL FOR THE,38
5,INT ASYLUM CORRIDOR  UPPER FLOOR  DAY,27
6,INT DIFFERENT CORRIDOR  LOWER FLOOR  DAY,70
7,INT DR LECTERS CORRIDOR  DAY,270
8,EXT THE HOSPITAL  PARKING LOT  DAY,28
9,INT FBI ACADEMY FIRING RANGE  DAY,11
10,INT FBI ACADEMY LIBRARY  NIGHT,32
11,INT CRAWFORDS HOUSE  STUDY  NIGHT,100
12,INT CRAWFORDS BEDROOM  NIGHT,16
13,EXT SPLIT CITY MINISTORAGE  DUSK RAINING,9
14,EXT STORAGE UNIT NUMBER   DUSK,39
15,INT THE STORAGE SHED  DUSK VERY DARK,14
16,EXT STORAGE UNIT NUMBER   DUSK,19
17,INT STORAGE SHED  DUSK VERY DARK,101
18,EXT QUINNS HOSPITAL  PARKING LOT  NIGHT RAINING,7
19,INT DR LECTERS CELL AND CORRIDOR  NIGHT DIM LIGHT,172
20,INT CATHERINE MARTINS APARTMENT  MEMPHIS TENNESSEE ,17
21,EXT PARKING LOT  THE APARTMENT COMPLEX  NIGHT,22
22,INT THE PANEL TRUCK  NIGHT,28
23,EXT THE PARKING LOT  NIGHT,7
24,INT FBI ACADEMY CLASSROOM  QUANTICO  DAY,33
25,INT HALLWAY  CLASSROOM BUILDING  DAY,21
26,INT BRIGHAMS JEEP CHEROKEE  DAY DRIVING,40
27,INT BEECHCRAFT PLANE  DAY FLYING,88
28,INT RENTAL CAR  DAY DRIVING,111
29,EXT SIDEWALK OF THE FUNERAL HOME  POTTER WEST VA  DAY,31
30,INT FUNERAL HOME  BACK CORRIDOR  DAY,46
31,INT EMBALMING ROOM  DAY,165
32,EXT BACK STEPS OF THE FUNERAL HOME  DAY,76
33,INT MR GUMBS CELLAR  DAY DIM LIGHT,64
34,INTCLARICES DORM ROOM  FBI ACADEMY  DAWN,7
35,INT RECREATION ROOM  FBI ACADEMY  DAWN,86
36,EXT SMITHSONIAN  MUSEUM OF NATURAL HISTORY  DAY,11
37,INT MUSEUM CORRIDOR  DAY,14
38,INT MUSEUM OFFICE  DAY,24
39,INT ENTOMOLOGY CORRIDOR  DAY,23
40,INT LABORATORY  DAY,69
41,EXT US ROUTE   DAY AERIAL SHOT,13
42,INT THE SURVEILLANCE VAN  DAY DRIVING,71
43,INT BALTIMORE STATE HOSP FOR THE CRIMINALLY INSANE  DAY,40
44,INT DR LECTERS CELL AND CORRIDOR  DAY,228
45,INT MR GUMBS CELLAR  DAY,79
46,INT DR LECTERS CORRIDOR  DAY,16
47,INT DR LECTERS CELL  DAY,111
48,INT JOHNS HOPKINS  GENDER IDENTITY CLINIC  DAY,101
49,INT THE SURVEILLANCE VAN  DAY,7
50,INT FBI BUILDING  OFFICE OF THE DIRECTOR  DAY,27
51,INT THE SURVEILLANCE VAN  DAY,7
52,INTCLARICES DORM ROOM  DOORWAY  DAY,12
53,EXT FBI ACADEMY GROUNDS  QUANTICO  DAY,68
54,INT AIR NATIONAL GUARD HANGER  MEMPHIS TENNESSEE  DAY,136
55,INT MR GUMBS BASEMENT  DAY DIMLY LIT,73
56,INT CATHERINE MARTINS APARTMENT  LIVING ROOM  DAY,9
57,INT KITCHEN,6
58,INT BATHROOM,4
59,INT ATTIC CRAWLSPACE,4
60,INT BEDROOM,4
61,INT BEDROOM,87
62,EXT SHELBY COUNTY COURTHOUSE  DAY,12
63,INT COURTHOUSE  GROUND FLOOR  DAY,24
64,INT ELEVATOR  MOVING,11
65,INT HISTORICAL SOCIETY ROOM  TH FLOOR,284
66,INT GARMENT SWEATSHOP  DAY,40
67,INT MEMPHIS INTERNATIONAL AIRPORT  LOUNGE AREA  DUSK,9
68,INT SHELBY CO COURTHOUSE  HISTORICAL SOCIETY ROOM ,138
69,INT COURTHOUSE  GROUND FLOOR LOBBY  NIGHT,47
70,INT STAIRWELL  NIGHT DIMLY LIT,7
71,INT THIRD FLOOR CORRIDOR  NIGHT DIMLY LIT,14
72,INT HISTORICAL SOCIETY ROOM  NIGHT BRIGHTLY LIT,64
73,EXT STREET IN FRONT OF COURTHOUSE  NIGHT,9
74,INT HISTORICAL SOCIETY ROOM  NIGHT,19
75,INT THE ELEVATOR  DESCENDING  NIGHT,20
76,INT GROUND FLOOR LOBBY  NIGHT,11
77,INT THIRD FLOOR CORRIDOR  NIGHT,42
78,INT GROUND FLOOR LOBBY  NIGHT,28
79,INT EMS AMBULANCE  MOVING,21
80,EXT SIXLANE FREEWAY  NIGHT ARC LIGHTS,20
81,EXT MONTANA PLAIN  DUSK  IN FLASHBACK,7
82,EXT COUNTRY DIRT ROAD  NIGHT  BRIGHT MOONLIGHT,6
83,EXT RANCH BARNYARD  NEAR DAWN,8
84,EXT BARN  NIGHT,8
85,INT FBI DORM  PAY PHONE IN HALLWAY  NIGHT,5
86,INT SHOWER STALL  FBI DORM  NIGHT,7
87,INT CLARICES DORM ROOM  NIGHT,45
88,INT LAUNDRY ROOM  ACADEMY DORM  NIGHT VERY LATE,70
89,INT FBI BUILDING  OFFICE OF THE DIRECTOR  DAY,70
90,EXT SIDEWALK OUTSIDE FBI BUILDING  DAY,58
91,INT MR GUMBS CELLAR  DAY DIM LIGHT,95
92,EXT RESIDENTIAL STREET  BELVEDERE OHIO  DAY,11
93,EXT BIMMEL HOUSE  BACK YARD  DAY,12
94,INT BIMMEL HOUSE  STAIRCASE  DAY,18
95,INT FREDRICAS BEDROOM  DAY,63
96,INT BIMMEL PARLOR  DOWNSTAIRS  DAY,23
97,INT FBI TURBOJET  FLYING  DAY,84
98,EXT BIMMEL BACK YARD  DAY,22
99,EXT AN ISOLATED RUNWAY  OHARE AIRPORT  DAY,8
100,INT SAVING  LOAN  BELVEDERE  DAY,56
101,EXT RESIDENTIAL STREET  CALUMET CITY ILLINOIS  DAY,9
102,INT MR GUMBS CELLAR  DAY DIM LIGHT,5
103,EXT STREET IN CALUMET CITY  FRONT YARD  DAY,7
104,INT MR GUMBS CELLAR  DAY DIM LIGHT,5
105,EXT STREET IN CALUMET CITY  NEIGHBORS HOUSE  DAY,8
106,INT MR GUMBS CELLAR  DAY GREEN LIGHT,6
107,EXT STREET IN CALUMENT CITY  DAY,9
108,INT MR GUMBS CELLAR  DAY GREEN LIGHT,12
109,EXT STREET IN CALUMET CITY  SUSPECTS HOUSE  DAY,11
110,INT MR GUMBS CELLAR  DAY GREEN LIGHT,23
111,INT MR GUMBS FRONT DOOR  DAY,11
112,EXT FRONT DOOR OF SUSPECTS HOUSE  CALUMET CITY,7
113,EXT MR GUMBS FRONT DOOR  DAY,12
114,INT SUSPECTS HOUSE  CALUMENT CITY  DAY,7
115,EXT MR GUMBS FRONT DOOR  DAY,16
116,INT SUSPECTS HOUSE  CALUMET CITY  DAY,6
117,INT MR GUMBS FRONT HALLWAY  DAY,16
118,EXT FRONT YARD OF SUSPECTS HOUSE  CALUMET CITY  DAY,12
119,INT MR GUMBS PARLOR  DAY,92
120,INT MR GUMBS KITCHEN  DAY,21
121,INT MR GUMBS CELLAR  DAY,17
122,INT OUBLIETTE CHAMBER  DAY DIMLY LIT,44
123,INT NEW PASSAGEWAY  DAY DIMLY LIT,8
124,INT WORKROOM  DAY DIMLY LIT,16
125,INT SKINNING ROOM  DAY DIMLY LIT,13
126,INT WORKROOM  DAY DIMLY LIT,8
127,INT BATHROOM  DAY BRIGHTLY LIT,24
128,INT MR GUMBS WORKROOM  DAY GREEN LIGHT,63
129,EXT MR GUMBS HOUSE  DUSK,35
130,EXT GROUNDS OF THE FBI ACADEMY  WEEKS LATER  DAY,27
131,INT ACADEMY DORM  REC ROOM  THAT NIGHT,19
132,INT DORM HALLWAY  NIGHT,21
133,EXT A CLEAR NIGHT SKY,39
134,INT DORM HALLWAY  NIGHT,7
135,EXT THE MOONLIT PATIO,7
