1,EXT CADILLAC DEALERSHIP  DAY,42
2,EXT NEIGHBORHOOD  LINE OF ROW HOUSES  DAY,4
3,INT ROW HOUSE  DAY,38
4,EXT CADILLAC DEALERSHIP  DAY,43
5,EXT TILLEYS HOUSE  DAY,22
6,EXT CADILLAC DEALERSHIP  DAY,24
7,INT TILLEYS CAR  DAY,18
8,EXT CADILLAC DEALERSHIP  DAY,6
9,INT TILLEYS CAR  DAY,6
10,EXT BBS CADILLAC  DAY,5
11,INT TILLEYS CAR  DAY,5
12,EXT BBS CADILLAC  DAY,5
13,INT TILLEYS CAR  DAY,5
14,EXT STREET  DAY,110
15,INT DINER  DAY,76
16,EXT DINER PARKING LOT  DAY,4
17,INT DINER  DAY,152
18,EXT INDUSTRIAL PARK IN A RUNDOWN AREA OF TOWN  DAY,6
19,INT OFFICE  DAY,211
20,EXT LOWERMIDDLE CLASS NEIGHBORHOOD  DAY,6
21,INT BBS CADILLAC  DAY,37
22,EXT WOODEN FRAMED HOUSE  DAY,11
23,INT WOODEN FRAMED HOUSE  DAY,27
24,EXT WOODEN FRAMED HOUSE  DAY,172
25,INT WOODEN FRAMED HOUSE  NIGHT,50
26,INT HOUSE   MONTAGE  ANGLE ON LOONEY,8
27,INT HOUSE   MONTAGE  ANGLE ON CHEESE,7
28,INT HOUSE   MONTAGE  ANGLE ON MOUSE,7
29,INT HOUSE   MONTAGE  ANGLE ON GIL,8
30,INT HOUSE  NIGHT,37
31,INT CADILLAC  NIGHT,19
32,INT PIMLICO HOTEL  BARRESTAURANT  NIGHT,160
33,EXT STREET  NIGHT,5
34,INT CADILLAC  NIGHT,44
35,INT ENTRANCE LOBBY TO PIMLICO HOTEL  NIGHT,55
36,EXT STREET  PROFILE SHOT  NIGHT,4
37,INT PORCH OF HOUSE  NIGHT,103
38,INT TILLEYS HOUSE  BATHROOM  NIGHT,83
39,EXT INDUSTRIAL PARK  DAY,6
40,INT TILLEYS CADILLAC  DAY,42
41,INT SUPERIOR ALUMINUM SIDING OFFICE  TIGHT SHOT  DAY,123
42,EXT SUPERIOR ALUMINUM SIDING BUILDING  DAY,36
43,INT POOL HALL  TIGHT SHOT,50
44,INT ROOM OFF MAIN POOL HALL,13
45,INT POOL HALL,98
46,EXT NORA AND TILLEYS HOUSE  DAY,18
47,INT SMALL NEIGHBORHOOD SUPERMARKET  DAY,51
48,EXT SUPERMARKET  DAY,11
49,EXT STREET  ACROSS FROM SUPERMARKET  DAY,13
50,INT MODEST HOUSE  DAY,28
51,EXT MODEST HOUSE  DAY,44
52,INT MODEST HOUSE  TIGHT SHOT ON SAM  DAY,101
53,INT CORRAL CLUB  NIGHT,79
54,INT SAMS CAR  NIGHT,35
55,INT CORRAL CLUB  ANGLE ON MOE AND BB  NIGHT,290
56,EXT PARKING LOT  NIGHT,46
57,INT SOCIAL SECURITY OFFICE  TIGHT SHOT OF LARGE CAKE,94
58,INT BBS APARTMENT  LIVING ROOM,61
59,INT BBS APARTMENT  BEDROOM  NIGHT,8
60,INT PIMLICO HOTEL  BAR  NIGHT,16
61,INT BBS APARTMENT  BEDROOM,9
62,INT PIMLICO HOTEL  BAR,8
63,INT BBS APARTMENT  BEDROOM,8
64,INT PIMLICO HOTEL  BAR,12
65,INT LIVING ROOM,14
66,EXT STREET  NIGHT,6
67,INT TILLEYS HOUSE,30
68,EXT TILLEYS HOUSE,5
69,INT TILLEYS CAR  NIGHT,13
70,EXT DINER  NIGHT,8
71,EXT STREET  NIGHT,21
72,EXT BBS FRONT DOOR  NIGHT,20
73,INT POOL HALL  LONG SHOT  DAY,8
74,INT GIBRALTAR ALUMINUM SIDING COMPANY,72
75,INT WINGS OFFICE,88
76,INT CONVERTED TOBACCO WAREHOUSE  DAY,78
77,EXT TOBACCO WAREHOUSE  DAY,38
78,EXT RACETRACK  ANGLE ON STARTING GATE  DAY,5
79,INT TURF CLUB AT RACE TRACK  ANGLE ON SAM AND TILLEY,168
80,EXT STREET  DAY,5
81,INT BBS CADILLAC  DAY,76
82,INT SOCIAL SECURITY OFFICE  DAY,36
83,INT SOCIAL SECURITY OFFICE  COFFEE AREA,115
84,INT TURF CLUB AT RACETRACK  CLOSEUP OF TILLEY  DAY,17
85,EXT RACETRACK  DAY,6
86,EXT GRANDSTANDS  DAY,5
87,INT TURF CLUB  ANGLE ON TILLEY SAM AND WING  DAY,11
88,EXT RACETRACK  FINISH LINE  DAY,6
89,INT TURF CLUB  ANGLE ON SAM TILLEY AND WING  DAY,18
90,EXT GRANDSTAND  ANGLE ON MOE AND BB  DAY,10
91,INT TURF CLUB  ANGLE ON WING SAM AND TILLEY  DAY,194
92,EXT RACETRACK  LATE AFTERNOON,95
93,INT BBS CADILLAC  DAY,11
94,EXT OLD TOBACCO WAREHOUSE  DAY,7
95,INT TOBACCO WAREHOUSE  OFFICE  DAY,47
96,EXT STREET  NIGHT,13
97,INT HOUSE  NIGHT,66
98,INT HOSPITAL CORRIDOR,51
99,INT HOSPITAL HALLWAY,49
100,INT DINER  DAY,120
101,INT DINER  DAY,93
102,INT SUPERIOR ALUMINUM SIDING COMPANY OFFICE  DAY,49
103,EXT INDUSTRIAL WAREHOUSE  ANGLE ON BB  DAY,53
104,INT POOL HALL  TIGHT SHOT OF MOUSE  DAY,108
105,INT CORRAL CLUB  NIGHT,92
106,EXT STREET  NIGHT,5
107,INT CADILLAC  NIGHT,29
108,INT TILLEYS BATHROOM  NIGHT,20
109,EXT STREET  NIGHT,13
110,INT TILLEYS HOUSE  BATHROOM  NIGHT,31
111,EXT STREET  NIGHT,5
112,INT TILLEYS HOUSE  NIGHT,19
113,EXT FRONT DOOR OF TILLEYS HOUSE  NIGHT,7
114,INT TILLEYS HOUSE  OTHER SIDE OF FRONT DOOR,17
115,INT TILLYS HOUSE,88
116,INT POLICE STATION  NIGHT,64
117,EXT POLICE STATION  DAY,17
118,INT TILLEYS CAR  DAY,19
119,EXT POLICE STATION  LONG SHOT OF POLICE STATION AND,6
120,INT COFFEE SHOP  DAY,190
121,INT HOSPITAL  MOES ROOM  DAY,94
122,INT SAMS CADILLAC  DAY,55
123,INT THORS SMORGASBORD RESTAURANT  DAY,45
124,INT SUPERIOR ALUMINUM SIDING OFFICE  DAY,52
125,INT TOBACCO WAREHOUSE  DAY,218
126,EXT TOBACCO WAREHOUSE  DAY,17
127,EXT SOCIAL SECURITY OFFICE  NIGHT,94
128,INT PIMLICO HOTEL  BARRESTAURANT  NIGHT,95
129,INT CORRAL CLUB  NIGHT,53
130,EXT STREET  TILLEYS HOUSE  TIGHT SHOT OF HAND ,220
131,EXT SUPERIOR ALUMINUM BUILDING  NIGHT,14
132,INT SUPERIOR ALUMINUM OFFICE  NIGHT,98
133,INT BBS HOUSE  BEDROOM  NIGHT,58
134,INT GIBRALTAR ALUMINUM SIDING OFFICE IN POOL HALL,19
135,INT POOL HALL,237
136,EXT INDUSTRIAL ESTATE AREA  DAY,8
137,INT SUPERIOR ALUMINUM SIDING OFFICE  DAY,278
138,EXT PIMLICO BARRESTAURANT  NIGHT,40
139,INT PIMLICO BAR  NIGHT,104
140,EXT VACANT PARKING LOT  NIGHT,7
141,INT TILLEYS CADILLAC  NIGHT,9
142,EXT CADILLAC IN PARKING LOT  LONG SHOT  NIGHT,6
143,INT BBS APARTMENT  KITCHEN  EGGS  DAY,186
144,EXT BBS APARTMENT  FRONT DOOR  DAY,9
145,EXT DOWNTOWN STREET  DAY,11
146,INT TOBACCO WAREHOUSE  DAY,69
147,INT TOBACCO WAREHOUSE  LONG SHOT OF HEARING ROOM  DAY ,127
148,INT TOBACCO WAREHOUSE  DAY,16
149,EXT TOBACCO WAREHOUSE  DAY,39
150,INT TOBACCO WAREHOUSE  DAY,40
151,EXT TOBACCO WAREHOUSE  DAY,41
152,INT BBS CADILLAC  DAY,25
153,INT BBS CADILLAC  LITTLE LATER,40
