1,EXT DESOLATE MOUNTAIN RANGE  HIGH ANGLE  DAWN,57
2,EXT THE TOP OF THE WATER FALL ,22
3,EXT SNOWCOVERED FOREST  BOND SKIS THROUGH THE PINES ,1
4,EXT MOUNTAIN CLIFF ,3
5,EXT MOUNTAINSIDE ,125
6,EXT A BRITISH WARSHIP  STEAMING IN THE GULF OF OMAN ,1
7,INT WEAPONS CONTROL ROOM  BRITISH WARSHIP ,4
8,EXT DECK OF THE WARSHIP ,2
9,INT WARSHIP WEAPONS CONTROL ROOM ,158
10,INT BONDS MG BOND SHOVES THE THROTTLES TO THE FIREBALL AND ,7
11,INT BONDS MG ,4
12,INTEXT BONDS MIG ,5
13,INTEXT MIG,3
14,INTEXT BONDS MIG ,4
15,INT MIG ,5
16,INTEXT BONDS MIG ,18
17,EXT BONDS MIG ,5
18,EXT OXFORD COLLEGE  DAY,2
19,INT BOOK LINED OFFICE ,44
20,INT MS ANTEROOM  MI,5
21,INT OFFICE  INTERCUT AS NECESSARY,39
22,INT HALLWAY  OUTSIDE JENNYS OFFICE  OXFORD ,35
23,EXT MI LONDON  DAY,2
24,INT CONFERENCE ROOM  DAY,119
25,INT HALLWAY OUTSIDE OF CONFERENCE ROOM  CONTINUOUS,31
26,INT MS ANTEROOM MONEYPENNYS AREA  CONTINUOUS,13
27,INT MS OFFICE  DAY,296
28,EXT VENICE HARBORGRAND CANAL  NIGHT,8
29,EXT PIAZZA SAN MARCO  NIGHT,130
30,EXT RIALTO BRIDGE  FIRST UP STAIRCASE  NIGHT,202
31,EXT VENICE HARBOR  THE NEXT DAY ,4
32,INT DOCKSIDE CAFE ,116
33,INT SEA DOLPHIN II  BELOW DECKS ,12
34,INT METALLURGY LAB  SEA DOLPHIN II  CONTINUOUS,45
35,INT CAFE ,164
36,INT METALLURGY LAB  SEA DOLPHIN II ,50
37,EXT THE SEA DOLPHIN IIHARBOR  DAY,16
38,EXT THE DANIELLI HOTEL  DAY,5
39,INT BONDS HOTEL ROOM ,6
40,EXT GRAND CANAL  BONDS POV,16
41,INT BRIDGE  DUSK,53
42,INT CREWS MESS ,10
43,INT SHIPS HEAD ,6
44,INT ENGINE ROOM ,27
45,EXT MANOR HOUSE  THE COAST OF SCOTLAND  DAY,6
46,INT GRAND ROOM  SCOTTISH MANOR HOUSE ,12
47,INT HARMSWAYS INNER SANCTUM  SCOTTISH MANOR HOUSE  DAY,124
48,EXT LIMOUSINE  MANOR HOUSE  DAY,2
49,INT LIMOUSINE ,2
50,EXT SCOTTISH HIGHLAND ROADWAY  INTEXT LIMOUSINE  MOVING DAY,11
51,EXT SMALL AIRPORT  SCOTLAND ,14
52,INT GULFSTREAM JET  DAY,13
53,INT BRIDGE  NIGHT,66
54,EXT SPACE ,6
55,RETURN ON BRIDGE  INT HMS INDOMITABLE  NIGHT,32
56,EXT UNDERWATER  NIGHT,7
57,INT BRIDGE  NIGHT,33
58,EXT UNDERWATER  NIGHT,7
59,INT ENGINE ROOM ,125
60,THE WORMS POV  UNDERWATER INT PASSAGEWAY ,32
61,EXT THE HMS INDOMITABLE  FOG  NIGHT,2
62,EXT DECK ,7
63,EXT LIFEBOAT ,54
64,EXT LONDON  RESTAURANT BIBENDUM  NIGHT,2
65,INT RESTAURANT BIBENDUM ,24
66,EXT THE BANK OF LONDON  NIGHT,3
67,INT CONFERENCE ROOM  BANK OF LONDON  NIGHT,53
68,EXT STRAIT OF MALACCA  FOG  NIGHT,3
69,INT BRIDGE  SEA DOLPHIN II  NIGHT,10
70,NEUTRAL POV  UNDERWATER  EXT INDOMITABLE,2
71,WORM POV  INT ENGINE ROOM ,7
72,PASSAGEWAY  UNDERWATER  NEUTRAL POV  INT INDOMITABLE ,10
73,INT SEA DOLPHIN BRIDGE ,19
74,INT BILGE HOLD  UNDERWATER ,3
75,INT BRIDGE  SEA DOLPHIN II ,5
76,INT BILGE HOLD  UNDERWATER ,3
77,INT CONFERENCE ROOM  BANK OF ENGLAND  NIGHT,80
78,EXT SEA DOLPHIN II  NIGHT,21
79,INT HALLWAY  BANK OF LONDON  NIGHT ,27
80,EXT BANK OF LONDON  NIGHT  CONTINUOUS ,31
81,EXT HARMSWAY BUILDING HONG KONG AND SHANGHAI BANK  HONG KONG  DUSK,3
82,INT PENTHOUSE BOARDROOM  DUSK,52
83,EXT ROOF OF HARMSWAY BUILDING ,9
84,INT HELICOPTER  AIRBORNE ,7
85,INT HELICOPTERHARMSWAY ROOFTOP POV ,13
86,INT SEA KING HELICOPTER  AIRBORNE  DAY,31
87,NEW ANGLE  EXT SEA RING CHOPPER  HNN BOAT ,5
88,EXT HNN WORLD HEADQUARTERS PETRONAS TOWERS KUALA LUMPUR  DAY,5
89,INT SKY BRIDGE  HNN HEADQUARTERS  DAY,36
90,INT CONFERENCE ROOM  HNN HEADQUARTERS  CONTINUOUS  DAY,53
91,INT SEA KING HELICOPTER  AIRBORNE  DAY,8
92,EXT COASTAL INLET  MARSHLAND  STRAIT OF MALACCA  DAY,59
93,EXT THE RUNNING DOG CIGARETTE BOAT  STRAIT OF MALACCA  DAY ,18
94,EXT PORT KLANG  ESTABLISHING  DAY,41
95,INT HARBOR MASTER OFFICE  PORT KLANG  DAY,31
96,EXT HARBOR MASTERS TOWER  DAY,12
97,EXT KUALA LUMPUR YACHT CLUB  NIGHT,2
98,INT KUALA LUMPUR YACHT CLUB  NIGHT,161
99,EXT A DESERTED MARINA  MORNING ,2
100,EXTINT BOAT AT MARINA  MORNING ,89
101,EXT SPORT FISHING BOAT FLYING BRIDGE  DAY ,61
102,EXT INDOMITABLE  UNDERWATER ,10
103,INT ENGINE ROOM  UNDERWATER ,2
104,INT PASSAGEWAY  UNDER WATER ,4
105,INT CARGO HOLD  UNDER WATER ,11
106,PASSAGE WAY INT INDOMITABLE  UNDER WATER ,40
107,EXT SEA ,11
108,TARO  EXT SALVAGE BARGE DECK ,28
109,INT BRIDGE  SALVAGE BARGE  DAY,98
110,EXT MALACCA STRAIT  DAY,119
111,EXT DECK  THE CUTTER  DAY ,51
112,EXT SPORT FISHING BOAT  STRAIT OF MALACCA  DAY ,9
113,EXT COASTAL ROADWAY  MALAYSIA  BOND CAR  DAY ,3
114,INT BONDS CAR  MOVING  COASTAL ROADWAY  DAY ,16
115,INT HARMSWAYS OUTER OFFICE ,8
116,RETURN ON BOND  INT BONDS CAR  MOVING ,18
117,INT HARMSWAYS OUTER OFFICE ,5
118,EXT KUALA LUMPUR  ROADWAY BOND CAR  LATE AFTERNOON ,3
119,EXT HARMSWAY TOWERS  STREET LEVEL  LATE AFTERNOON ,3
120,INT UNDERGROUND CAR PARK  HARMSWAY TOWERS ,20
121,INT BONDS CAR ,6
122,BACK TO SCENE INT BONDS CAR ,3
123,INT UNDERGROUND CAR PARK ,6
124,EXT PRESSROOM OBSERVATION ARCADE ,7
125,INT PRESSROOM BALCONY ,16
126,INT DRESSING ALCOVE  OFF THE PRESSROOM ,31
127,INT ELEVATOR ,37
128,INT ELEGANT HALLWAY ROGUES GALLERY  LATE AFTERNOON,39
129,INT HNN NEWS CENTER  LATE AFTERNOON ,83
130,INT HARMSWAYS OFFICE ,100
131,INT ELEVATOR HALLWAY  DAY ,5
132,BONDS POV  EXT HARMSWAY TOWERS ,7
133,INT ELEVATOR  DAY,57
134,INT TH FLOOR  DAY,26
135,NEW ANGLE  INT ELEVATOR ,10
136,INT ELEVATOR SHAFT  ABOVE THE ELEVATOR  CONTINUOUS ,9
137,INT ELEVATOR ,8
138,INT HALLWAY  ELEVATOR BANK  ST FLOOR,15
139,INT ELEGANT HALLWAY  ANOTHER PART OF THE BUILDING ,5
140,BOND AND SIDNEY  INT HALLWAY ,15
141,INT SECURITY CENTER ,12
142,CLOSE ON THE GUARD  INT HALLWAY ,16
143,INT SMALL KITCHENCOPIER ROOM ,22
144,INT STAIRWELL  ON THE OTHER SIDE OF THE BUILDING ,52
145,BOND AND SIDNEY INT KITCHEN ,5
146,INT HALLWAY ,16
147,INT STAIRWELL  LANDING ,13
148,INT HALLWAY ,2
149,INT SECURITY CENTER ,8
150,EXT ND FLOOR  TERRACE SETBACK  TWILIGHT ,21
151,INT STAIRWELL ,9
152,RETURN ON BOND  TERRACE SETBACK  EXT ND FLOOR  TWILIGHT ,15
153,EXT HARMSWAY TOWERS  AERIAL ,2
154,INT STAIRCASE ,2
155,EXT TERRACE SETBACK  ND FLOOR ,12
156,EXT TERRACE SETBACK  TWILIGHT ,51
157,INT TH FLOOR SKY BRIDGE ,11
158,INT SECURITY CENTER ,6
159,INT SKY BRIDGE  TWILIGHT ,44
160,EXT HARMSWAY TOWERS  TWILIGHT,5
161,RETURN ON THE RAILING  INT SKY BRIDGE ,14
162,EXT THE PRESS ROOM OBSERVATION BALCONY  TWILIGHT ,11
163,INT SKY BRIDGE  TWILIGHT ,8
164,INT PRESS ROOM ,51
165,INT GARAGE  HARMSWAY TOWERS,108
166,INT BONDS CAR  MOVING  GARAGE ,7
167,INT BONDS CAR  MOVING ,2
168,EXT BACK OF BONDS CAR  MOVING ,2
169,INT BONDS CAR  MOVING ,11
170,INT GARAGE  FIRST TURN ,2
171,INT BONDS CAR ,4
172,INT GARAGE  SECOND TURN  UP RAMP ,4
173,INT BONDS CAR  MOVING ,21
174,INT GARAGE ,20
175,EXT ABERDEEN HARBOR  HONG KONG  MORNING ,16
176,NEW ANGLE EXT POWER PLANT FRONT ENTRANCE WATERSIDE ,44
177,INT HALLWAYRECEPTION  POWER PLANT ,18
178,INT CABIN  HNN BOAT,10
179,INT POWER PLANT CONTROL ROOM ,14
180,EXT ENTRANCEWAY ,205
181,INT AIRLOCK ,11
182,INT AIRLOCK ,6
183,INT CONTROL ROOM ,8
184,THE WORMS POV  INT INTAKE TUNNEL MOVING ,9
185,INT AIRLOCK ,82
186,EXT HELICOPTER  EXT ABERDEEN HARBOR POWER PLANT  DAY,3
187,EXT THE SEA DOLPHIN II  AERIAL  SOUTH CHINA SEA  DAY,39
188,INT LOWER PASSAGEWAYSTORAGE ROOM  SEA DOLPHIN II ,7
189,EXT BONDS HNN HELICOPTER  FLYING  DAY,3
190,INT HELICOPTER  FLYING ,34
191,INT HELICOPTER  FLYING  DAY ,31
192,INT HARMSWAYS CABIN ,6
193,INT BRIDGE ,8
194,INT HARMSWAYS CABIN ,3
195,INT STORAGE CABIN ,2
196,EXT MIDSHIP  DECK ,10
197,BONDS POV  INT HELICOPTER ,10
198,INT HELICOPTER ,8
199,INT HELICOPTER ,3
200,EXT LADDER LEADING TO THE BRIDGE ,4
201,INT HELICOPTER ,2
202,BONDS POV  INT HELICOPTER,3
203,INT BRIDGE ,8
204,ANGLE ON STAMPER EXT MIDSHIP ,2
205,EXT HELICOPTERSHIP,6
206,INT STORAGE COMPARTMENT ,2
207,INT BRIDGE ,3
208,EXT PASSAGEWAY ,45
209,SIDNEY  INT STORAGE ROOM ,2
210,HARMSWAY  INT BRIDGE ,4
211,EXT DECKPASSAGEWAY ,12
212,INT STORAGE CABIN ,3
213,WORMS POV  INT STORAGE CABIN ,2
214,INT PASSAGEWAY ,2
215,INT BRIDGE ,3
216,EXT THE DECK ,4
217,INT STORAGE ROOM ,3
218,INT PASSAGEWAY ,2
219,THE WORMS POV  UNDERWATER INT PASSAGEWAY,6
220,EXT THE SEA DOLPHIN II ,3
