1, EXT CITY STREET  DAY,18
2, EXT CITY STREET  DAY,17
3, EXT NEIGHBORHOOD STREETS  VACANT LOT  DAY,33
4, INT FORTUNE HOUSE  DAY,9
5, INT PEE DEE COUNTY WORK FARM  DAY,10
6,A INT FORTUNE HOUSE  DAY,5
7,A INT PEE DEE COUNTY WORK FARM  DAY,5
8,B INT FORTUNE HOUSE  DAY,20
9, INT FORTUNE HOUSE  LULAS ROOM UPSTAIRS  DAY,5
10, INT PEE DEE COUNTY WORK FARM  DAY,5
11, EXT THE MUSIC BAR  NIGHT,11
12, INT THE MUSIC BAR  NIGHT,55
13, EXT BAY ST CLEMENT  DAY,3
14, INT FORTUNE HOUSE  DAY,6
15,A INT FORTUNE HOUSE  MARIETTAS BEDROOM  DAY,6
16,B INT FORTUNE HOUSE  STAIRWAY  DAY,3
17, EXT FORTUNE HOUSE  DAY,5
18, EXT CITY STREETS  DAY,5
19, INT BEANY THORNS GARAGE  DAY,5
20, EXT FORTUNE HOUSE  DAY,10
21, INT SOUTHERN TIME BAR  DAY,13
22, EXT PEE DEE COUNTY WORK FARM  DAY,30
23, INT CAPE FEAR HOTEL  DAY,98
24, INT FORTUNE HOUSE  KITCHEN  NIGHT,11
25, INT CAPE FEAR HOTEL  DAY,8
26, INT FORTUNE HOUSE  LIVINGROOM  NIGHT,12
27, INT CAPE FEAR HOTEL  DAY,21
28, INT FORTUNE HOUSE  DAY,101
29, INT BAY ST CLEMENT HOTEL  BALLROOM  NIGHT,10
30, INT FORTUNE HOUSE  DAY,14
31, INT CAPE FEAR HOTEL  DAY,68
32, INT FORTUNE HOUSE  KITCHEN  DAY,19
33, INT CAPE FEAR HOTEL  DAY,20
34, INT FORTUNE HOUSE  KITCHENMAIDS ROOM  DAY,12
35, INT CAPE FEAR HOTEL  DAY,47
36, INT CAPE FEAR HOTEL  DAY,53
37, EXT FORTUNE HOUSE  BACKYARD  LATE AFTERNOONEVENING,221
38, INT THE HURRICANE  A SPEED METAL CLUB  NIGHT,74
39, INT CAPE FEAR HOTEL  NIGHT,130
40, INT ABORTION CLINIC  MIAMI  DAY,29
41, INT CAPE FEAR MOTEL  NIGHT,37
42, EXT CITY STREET  CHATTANOOGA  DAY,7
43, INT CAPE FEAR HOTEL  NIGHT,12
44, INT AUNT ROOTIES HOUSE,4
45, INT CAPE FEAR HOTEL  NIGHT,31
46, INT CAPE FEAR HOTEL  NIGHT,8
47, INT AUNT ROOTIES HOUSE  DELLS ROOM  NIGHT,12
48, INT CAPE FEAR HOTEL  NIGHT,12
49,A EXT AUNT ROOTIES HOUSE  DAY,3
50, INT AUNT ROOTIES HOUSE  DAY,18
51, INT CAPE FEAR HOTEL  NIGHT,39
52, INT CAPE FEAR HOTEL  NIGHT,37
53, INT BAY ST CLEMENT HOTEL  HALLWAY ABOVE BALLROOM  NIGHT,12
54, INT MENS ROOM  BAY ST CLEMENT HOTEL  NIGHT,60
55,INT CAPE FEAR HOTEL  NIGHT,21
56, INT THE HURRICANE BAR  NIGHT,6
57, INT BAR  BACK OF THE HURRICANE  NIGHT,43
58, INT JUNIOR TRAINS FRIENDS HOUSE  KITCHEN  SAVANNAH,9
59, INT BAR  BACK OF THE HURRICANE  NIGHT,14
60, INT JUNIOR TRAINS FRIENDS HOUSE  STAIRWAY  NIGHT,8
61, INT BAR  BACK OF THE HURRICANE  NIGHT,28
62, INT JUNIOR TRAINS FRIENDS HOUSE  BEDROOM NIGHT,10
63, INT BAR  BACK OF THE HURRICANE  NIGHT,26
64, INT JUNIOR TRAINS FRIENDS HOUSE  BEDROOM  NIGHT,5
65, INT BAR  BACK OF THE HURRICANE  NIGHT,22
66, INT THUNDERBIRD CONVERTIBLE  DAY,77
67, INT JOHNNIE FARRAGUTS  MAROON BUICK  DAY,3
68, INT THUNDERBIRD  DAY,29
69,A EXT THUNDERBIRDEXT THE HOST OF THE OLD SOUTH HOTEL  DAY,10
70, INT THE HOST OF THE OLD SOUTH HOTEL  EVENING,33
71, EXT ROADSIDE PAYPHONE  NIGHT,6
72, INT MR REINDEERS POSH NEW ORLEANS RESIDENCE  NIGHT,12
73,A EXT ROADSIDE PAYPHONE  NIGHT,6
74,A INT MR REINDEERS POSH NEW ORLEANS RESIDENCE  NIGHT,12
75, INT JOHNNIE FARRAGUTS MAROON  BUICK  NIGHT,4
76, EXT BEACH  NIGHT,66
77, EXT BEACH  NIGHT,32
78, INT THUNDERBIRD  SOUTHERN HIGHWAY  DAY,16
79, INT MINIMART  DAY,74
80, EXT MINI MARTTHUNDERBIRD  DAY,19
81, INT MR REINDEERS POSH NEW ORLEANS RESIDENCE  DAY,5
82, INT MR REINDEERS POSH NEW ORLEANS RESIDENCE  DAY,13
83, INT THE ROUND ROOM RESTAURANT  NEW ORLEANS  DAY,162
84, INT HOTEL BRAZIL  NEW ORLEANS  EVENING,35
85, INT RONNIES NOTHIN FANCY CAFE  NEW ORLEANS  LATE EVENING,53
86, EXT CITY STREET  ROOFTOP IN GEORGE KOVICHS NEIGHBORHOOD  DAY,8
87, INT RONNIES NOTHIN FANCY CAFE  NEW ORLEANS  LATE EVENING,10
88, INT EARL KOVICHS HOUSE  DAY,10
89, INT RONNIES NOTHIN FANCY CAFE  NEW ORLEANS  LATE EVENING,76
90, INT HOTEL BRAZIL  NEW ORLEANS  NIGHT,81
91, INT HOTEL BRAZIL  NEW ORLEANS  NIGHT,56
92, INT HOTEL BRAZIL  NEW ORLEANS  NIGHT,42
93, INT HOTEL BRAZIL  NEW ORLEANS  NIGHT,21
94, INT SNUG HARBOR BAR  NEW ORLEANS  NIGHT,80
95, EXT HOTEL BRAZIL  NEW ORLEANS  DAY,38
96, INT CAFE DU MONDE  DAY,14
97, EXT CITY STREET  NEW ORLEANS  DAY,21
98, INT THUNDERBIRD,158
99, INT INEZS FAISDODO BAR  NEW ORLEANS  NIGHT,1
100,A INT FORTUNE HOUSE  MARIETTAS BEDROOM  NIGHT,128
101, INT THUNDERBIRD  STREETS OF NUNEZ  NIGHT,15
102, EXT RED DEVIL GAS STATION  NIGHT,55
103, EXT CLUB ZANZIBAR  NIGHT,11
104, INT CLUB ZANZIBAR  NIGHT,116
105, INT FORTUNE HOUSE  BEDROOM,2
106, INT CLUB ZANZIBAR  PAYPHONE  NIGHT,102
107, INT CLUB ZANZIBAR  NIGHT,10
108, EXT CLUB ZANZIBAR  NIGHT,37
109, INT FORTUNE HOUSE  MARIETTAS BEDROOM  NIGHT,22
110, INT FORTUNE HOUSE  MARIETTAS BEDROOM  NIGHT,1
111, INT JOHNNIES HOTEL ROOM  MAISON VIOLETTE  NEW ORLEANS,61
112, EXT SHELL STATION  HOUSTON  DAY,33
113, INT TEXAS HIGHWAY  DAY,81
114, INT THUNDERBIRD  HIGHWAY TO SAN ANTONIO  DAY,22
115, INT THUNDERBIRD  HIGHWAY TO SAN ANTONIO  DAY,36
116, INT MAISON VIOLETTE  LOBBY  NEW ORLEANS  NIGHT,23
117, INT HOTEL ROOM  NEW ORLEANS  NIGHT,21
118, INT MAISON VIOLETTE  LOBBY  NEW ORLEANS  NIGHT,9
119, INT MR REINDEERS PRIVATE DINING ROOM  NEW ORLEANS  NIGHT,42
120, INT GALATOIRES RESTAURANT  NIGHT,70
121, INT MAISON VIOLETTE  STAIRWAY AND HALLWAY  NEW ORLEANS  NIGHT,28
122, INT MAISON VIOLETTE  LOBBY  NEW ORLEANS  NIGHT,92
123, EXT SMALL HUT  DESERTED BAYOU  NIGHT,3
124, INT SMALL HUT  DESERTED BAYOU  NIGHT,229
125, INT THUNDERBIRD  TWO LANE TEXAS FARM ROAD  NIGHT,99
126, INT FORTUNE HOUSE  LIVINGROOMUPSTAIRS HALLWAYBEDROOM  NIGHT,15
127, INT THUNDERBIRD  TWO LANE TEXAS FARM ROAD  NIGHT,152
128, INT THUNDERBIRD  BIG TUNA  MORNING,11
129,A EXT IGUANA MOTEL  MORNING,5
130, INT IGUANA MOTEL  DAY,37
131, EXT REDS GARAGE  DAY,99
132, EXT IGUANA BANK  DAY,3
133, INT IGUANA MOTEL  DAY,52
134, EXT SKY OVER BIG TUNA  EVENING,3
135, INT IGUANA MOTEL  COURTYARD  NIGHT,152
136, INT IGUANA MOTEL  SAILOR AND LULAS ROOM  NIGHT,49
137, INT IGUANA MOTEL  SAILOR AND LULAS ROOM  DAY,30
138, EXT PERDITA DURANGOS HOUSE  DAY,72
139, INT INGUANA MOTEL  SAILOR AND LULAS ROOM  DAY,152
140, EXT IGUANA MOTEL  AFTERNOON,22
141,A INT ELDORADO  BIG TUNA  DAY,22
142, EXT ROSARITAS  DAY,12
143, INT ROSARITAS  DAY,127
144,A EXT ROARITAS  LATE AFTERNOONEVENING,58
145, INT IGUANA MOTEL  SAILOR AND LULAS ROOM  NIGHT,137
146, INT BAY ST CLEMENT HOTEL  STAIRCASE  NIGHT,48
147, INT IGUANA MOTEL  SAILOR AND LULAS ROOM  NIGHT,6
148, INT PERDITA DURANGOS HOUSE  NIGHT,87
149, INT IGUANA MOTEL  DAY,19
150, EXT IGUANA MOTEL  DAY,8
151,A INT ELDORADO  BIG TUNA  DAY,31
152, EXT RAMOS FEED STORE  DAY,19
153, INT RAMOS FEED STORE  FRONT OFFICE  DAY,13
154, EXT RAMOS FEED STORE  DAY,20
155, INT RAMOS FEED STORE  FRONT OFFICE  DAY,14
156, EXT RAMOS FEED STORE  DAY,4
157, INT RAMOS FEED STORE  FRONT OFFICE  DAY,19
158,A EXT RAMOS FEED STORE  DAY,17
159, INT IGUANA COUNTY COURTHOUSE  DAY,44
160, INT WALLS UNIT  DAY,44
161, INT FORTUNE HOUSE  DAY,34
162, INT MARIETTA FORTUNES HOUSE  EVENING,1
163, INT LULA FORTUNES HOUSE  EVENING  SIX YEARS LATER,55
164, INT LULAS CAR  EVENING,66
165, INT LULAS CAR  EVENING,39
166, EXT TRAIN STATION  EVENING,25
167, INT TRAIN STATION  EVENING,36
168, INT LULAS CAR  NIGHT,77
169, EXT CITY STREET  LATE AFTERNOONEVENING,3
170, INT LULAS CAR  LATE AFTERNOONEVENING,5
171, EXT CITY STREET  LATE AFTERNOONEVENING,14
172,A EXT CITY STREET  LATE AFTERNOONEVENING,35
173, EXT CITY STREET  LATE AFTERNOONEVENING,19
174, INT LULAS CAR  LATE AFTERNOONEVENING,5
