1,EXT PRAGUE  NIGHT,14
2,EXT ROOFTOP  NIGHT,6
3,EXT THE ALLEY  NIGHT,27
4,INT CONCERT HALL  NIGHT,26
5,EXT CONCERT HALL  NIGHT,2
6,INT ASTONMARTIN  MOVING  NIGHT,7
7,EXT COBBLESTONE STREET  NIGHT,18
8,INT ASTONMARTIN  IDLING  NIGHT,12
9,EXT COBBLESTONE STREET  NIGHT,21
10,INT ASTONMARTIN  FLYING  NIGHT,4
11,EXT THE RIVER  NIGKT,9
12,EXT WASHINGTON DC,6
13,INT UNDERGROUND HEADQUARTERS  HALLWAY  NIGHT,8
14,INT ULTIMATE INFORMATION ROOM  NIGHT,7
15,INT SAM TANNICKS OFFICE  NIGHT,76
16,EXT SKYSCRAPER  DOWNTOWN LA  NIGHT,17
17,INT SKYSCRAPER LOBBY  NIGHT,15
18,INT ELEVATOR  NIGHT,3
19,INT ST FLOOR  NIGHT,37
20,EXT THE ROOF  NIGHT,12
21,EXT STREET LEVEL  NIGHT,3
22,EXT THE ROOF  NIGHT,19
23,EXT STREET LEVEL  NIGHT,16
24,EXT CITY STREETS  NIGHT,4
25,EXT LOFT DISTRICT  DOWNTOWN  NIGHT,2
26,INT XANDERS LOFT APARTMENT  NIGHT,135
27,INT PANS DINER  DAY,232
28,INT AIRPLANE  TWILIGHT,47
29,EXT A FIELD  TWILIGHT,34
30,INT TORTURE ROOM  NIGHT,169
31,EXT DRUG FARM  NIGHT,104
32,INT AIRPLANE HANGER  DAY,162
33,INT GULFSTREAM  DAY,17
34,INT EMPTY FIRST CLASS LOUNGE  SUNSET,24
35,INT AIRPORT TERMINAL  SUNSET,31
36,INT COMMERCIAL JET  NIGHT,100
37,EXT PRAGUE  DAY,3
38,INT BEATUP CAR  MOVING,20
39,EXT DIRTY APARTMENT BUILDING  DAY,9
40,INT DIRTY APARTMENT  DAY,42
41,EXT HALFPIPE DISCO  NIGHT,7
42,INT HALFPIPE DISCO  NIGHT,194
43,INT UNDERGROUND HEADQUARTERS  HALLWAY  MORNING,2
44,INT ULTIMATE INFORMATION ROOM  MORNING,4
45,INT DIRTY APARTMENT  DAY,46
46,INT SAM TANNICKS OFFICE  DAY,42
47,EXT CZECH POLICE BUILDING  ROOFTOP  DAY,28
48,INT CZECH POLICE BUILDING  BASEMENT TRAINING AREA  DAY,119
49,EXT WAREHOUSE DISTRICT  DAY,98
50,EXT STREET  DAY,19
51,INT GTO  MOVING  DAY,14
52,EXT DEAD END STREET  DAY,8
53,INT NIGHTCLUB  NIGHT,140
54,EXT PRAGUE RIVERFRONT  NIGHT,50
55,EXT PRAGUE STREETS  SUNRISE,4
56,INT MEDIEVAL MANOR  COURTYARD  PRAGUE  SUNRISE,9
57,INT MEDIEVAL MANOR  HALLWAY  SUNRISE,9
58,INT MEDIEVAL MANOR  MAIN HALL  SUNRISE,40
59,INT MEDIEVAL MANOR  XANDERS ROOM  SUNRISE,25
60,INT MEDIEVAL MANOR  HALLWAY  LATER THAT MORNING,3
61,INT MEDIEVAL MANOR  MAIN HALL  MORNING,3
62,INT MEDIEVAL MANOR  OFFICE  DAY,51
63,INT YORGIS BEDROOM  DAY,40
64,INT MEDIEVAL MANOR  OFFICE  DAY,35
65,INT MEDIEVAL MANOR  HALLWAY  DAY,15
66,INT ROMANTIC RESTAURANT  DAY,129
67,EXT BAKERY ROOF  DAY,8
68,INT ROMANTIC RESTAURANT  DAY,10
69,EXT ROMANTIC RESTAURANT  DAY,32
70,EXT NORWEGIAN FJORDS  LATE AFTERNOON,51
71,INT SHIP  LATE AFTERNOON,3
72,EXT SHIP  LATE AFTERNOON,50
73,EXT TOP OF TROLL WALL  LATE AFTERNOON,24
74,EXT SMALLER BOAT  LATE AFTERNOON,18
75,EXT SHIP  LATE AFTERNOON,7
76,EXT SMALLER BOAT  LATE AFTERNOON,5
77,EXT SHIP  LATE AFTERNOON,4
78,INT SHIP  LATE AFTERNOON,30
79,EXT SHIPS BRIDGE  LATE AFTERNOON,7
80,EXT SHIP  LATE AFTERNOON,10
81,INT CONFERENCE ROOM  THAT NIGHT,48
82,EXT CZECH POLICE BUILDING  DAY,5
83,INT POLICE BUILDING BASEMENT  DAY,11
84,EXT PRAGUE OPEN AIR MARKET  DAY,61
85,EXT MEDIEVAL MANOR  NIGHT,9
86,EXT MEDIEVAL MANOR  COURTYARD  NIGHT,4
87,INT MEDIEVAL MANOR  DARKENED ROOMS  NIGHT,11
88,INT DRAIN PIPE,8
89,INT MANOR BASEMENT  MAIN HALL  NIGHT,6
90,INT MEDIEVAL MANOR  STUDY  NIGHT,17
91,INT MANOR BASEMENT  MAIN HALL  NIGHT,14
92,INT MEDIEVAL MANOR  STUDY  NIGHT,6
93,INT MANOR BASEMENT  MAIN HALL  NIGHT,7
94,INT MEDIEVAL MANOR  VARIOUS  NIGHT,5
95,INT HALLWAY  NIGHT,4
96,INT DINING HALL  NIGHT,45
97,EXT COURTYARD  SUNRISE,20
98,EXT PRAGUE STREETS  DAYBREAK,18
99,INT BUILDING UNDER CONSTRUCTION  MORNING,10
100,EXT THE ROOFTOPS  MORNING,28
101,EXT ALLEY  MORNING,23
102,INT DIRTY APARTMENT  DAY,78
103,EXT ST CHARLES BRIDGE  DAY,98
104,EXT MOUNTAIN  DAY,21
105,EXT GUARD OUTPOST  DAY,12
106,EXT MOUNTAIN TOP  DAY,109
107,EXT CASTLE  DAY,28
108,INT CASTLE  COURTYARD  DAY,26
109,INT CASTLE  MAIN BUILDING  DAY,114
110,EXT THE CASTLE  DAY,5
111,INT CASTLE  MAIN BUILDING  DAY,8
112,EXT THE CASTLE  DAY,3
113,INT CASTLE  MAIN BUILDING  DAY,16
114,EXT CASTLE  COURTYARD  DAY,4
115,INT CASTLE  GARAGE  DAY,3
116,EXT CASTLE  COURTYARD  DAY,5
117,INT CASTLE  MAIN BUILDING  DAY,6
118,EXT CASTLE  COURTYARD  DAY,21
119,EXT CASTLE  DAY,15
120,EXT MOUNTAIN ROAD  DAY,40
121,EXT OUTSIDE THE INDUSTRIAL COMPLEX  DAY,17
122,EXT INSIDE THE INDUSTRIAL COMPLEX  DAY,96
123,EXT THE RIVER  DAY,88
124,EXT UNDERWATER  DAY,12
125,EXT THE RIVER  DAY,2
126,EXT THE RIVERBANK  DAY,77
127,INT HUT  DAY,2
